Start Time,End Time,Text,sentiment-score
00:17:59.540,00:18:02.920,"You know what? We've only reset the age of the eye once,",0.0
00:18:03.060,00:18:07.520,But how many times can we do this? Maybe it's twice. Maybe it's a hundred times.,0.0
00:18:07.520,00:18:14.860,"So, professor Sinclair claims that his gene therapy reversed aging in the mouse's eye and allowed it to see again.",0.0
00:18:14.880,00:18:21.860,But applying a gene therapy to every one of your trillion cells is pretty impossible.,0.6486
00:18:21.900,00:18:26.700,"So in order for this to actually work and reset an entire body,",0.0
00:18:26.740,00:18:31.480,"you would need another way, and this is where the jellyfish come in,",0.0
00:18:31.480,00:18:37.520,because 'moon jellyfish'—any cell in an adult jellyfish can actually be reset,0.0
00:18:37.520,00:18:42.920,into an earlier stage of its life cycle. It can become a polyp again.,0.0
00:18:42.920,00:18:50.220,So it seems like the jellyfish are actually capable of activating something like the Yamanaka factors,0.7823
00:18:50.220,00:18:54.760,and resetting their epigenomes to an earlier time in their lives.,0.0
00:18:54.760,00:18:57.140,"If we were able to figure out how they do that,",0.0
00:18:57.140,00:19:01.220,"well, then maybe we could do the same with our own cells.",0.2732
00:19:01.220,00:19:04.500,"We do have the ability to reset our epigenomes,",0.3182
00:19:04.500,00:19:08.580,"but that is typically only used when we're in the embryonic stage,",0.0
00:19:08.580,00:19:11.580,when we need to maintain all our cells as stem cells.,0.0
00:19:11.580,00:19:14.760,"As we age, most mammals including humans,",0.0
00:19:14.760,00:19:16.860,we lose stem cells over time.,-0.4019
00:19:16.860,00:19:20.300,And the stem cells we do have become more and more restricted over time,-0.4865
00:19:20.320,00:19:22.420,to the types of cells they can make.,0.0
00:19:22.500,00:19:29.000,"So if we can understand how the 'moon jellyfish' can take, presumably, many different kinds of cells,",0.0
00:19:29.000,00:19:33.340,"and reverse-engineer them into the cells it needs during regeneration,",0.0
00:19:33.340,00:19:36.480,"that might give us an idea of how to do it in ourselves, as well.",0.2732
00:19:36.480,00:19:43.160,"So, I still think we're a fair ways off from reversing aging in the entire human body.",0.3182
00:19:43.160,00:19:48.520,But what I found interesting from talking to professor Sinclair was that there's at least a roadmap.,0.5499
00:19:48.520,00:19:51.440,At least a path ahead where you can see,0.0
00:19:51.440,00:19:56.240,that it could be possible to slow and even reverse aging.,0.0
00:20:00.400,00:20:03.700,Hey this part of the video is sponsored by LastPass.,0.0
00:20:03.700,00:20:07.660,So let's talk about one thing you can do right now to improve your life.,0.4404
00:20:07.660,00:20:12.940,Just go to LastPass.com and start a free account and enjoy free cross-device sync.,0.8689
00:20:12.940,00:20:17.720,Think about how spending just a few moments right now could save you hours or even days,0.4939
00:20:17.740,00:20:22.280,over the course of your life and that's because you will never again get locked out of an account.,0.0
00:20:22.280,00:20:24.280,You'll never have to reset a password,0.0
00:20:24.280,00:20:29.760,"You'll no longer have to burden your brain with remembering passwords or end up having to write them down,",-0.6249
00:20:29.860,00:20:35.100,"and it will make your passwords more secure, because LastPass auto-generates strong passwords for you.",0.7178
00:20:35.100,00:20:39.180,"I love how it auto-fills usernames and passwords on websites,",0.6369
00:20:39.180,00:20:43.480,and it works just as well on iOS or Android apps and mobile sites.,0.2732
00:20:43.480,00:20:47.120,Just think about how much hassle and time this will save you,0.4939
00:20:47.120,00:20:50.540,"if you end up living to, like, a hundred or a hundred and twenty.",0.3612
00:20:50.540,00:20:53.940,I mean how many accounts and passwords will you even have by then?,0.0
00:20:54.190,00:20:59.999,"And if you want extra features, like 'advanced multi-factor authentication', you can upgrade to LastPass premium.",0.5859
00:21:00.070,00:21:03.809,So put your passwords on autopilot right now with LastPass.,0.0
00:21:03.809,00:21:08.860,Click on the link below to find out more and thanks to LastPass for sponsoring this part of the video.,0.4902
