Start Time,End Time,Text,sentiment-score
00:00:05.140,00:00:10.680,"As of today, I have been making Youtube videos full-time for 10 years",0.0
00:00:10.680,00:00:13.310,"So to celebrate, I am answering your questions",0.6096
00:00:13.310,00:00:20.540,plus I'm giving away items like this beautiful spinning top from vorso and other items from my videos,0.884
00:00:20.540,00:00:21.970,so if you want to win one of those,0.6557
00:00:21.970,00:00:27.620,then write down the characters that will appear randomly in the top right corner of this video,0.2023
00:00:27.620,00:00:31.680,Those will be your password to the form in the description,0.0
00:00:31.680,00:00:32.910,so let's get into it,0.0
00:00:37.600,00:00:40.620,Why did you start doing youtube?,0.0
00:00:40.620,00:00:43.570,because I always wanted to be a filmmaker,0.0
00:00:43.570,00:00:47.370,"As a kid, I loved doing plays and musicals",0.7096
00:00:47.370,00:00:51.970,I had the most fun of my life when I was working with creative other people,0.7574
00:00:51.970,00:00:58.680,but I always thought that a career in the traditional film or tv industry was a terrible idea,-0.631
00:00:58.680,00:01:01.310,and like your life was out of your control,0.3612
00:01:01.310,00:01:06.420,It seemed to rely on a big break; I don't think those industries were meritocracies,0.0
00:01:06.420,00:01:11.860,"so for basically my whole life until I was 28, I did the safe thing",0.4404
00:01:11.860,00:01:13.690,And I studied engineering and physics,0.0
00:01:13.690,00:01:16.940,and did a PhD in physics and then I taught people physics,0.0
00:01:16.940,00:01:19.000,and I love science,0.6369
00:01:19.000,00:01:27.400,but I also love just the craft of putting together a film or a video and sending it out into the world,0.7783
00:01:27.400,00:01:28.970,and I think this makes a lot of sense,0.0
00:01:28.970,00:01:32.560,"because I liked learning about science, and I liked performing",0.6808
00:01:32.560,00:01:36.300,and that is exactly what making Youtube videos allows me to do,0.0
00:01:36.300,00:01:41.310,You know the process of doing science is very different from the process of learning science,0.0
00:01:41.310,00:01:46.440,uh and so I think it's not surprising that this is the thing that I love more than being a scientist,0.5245
00:01:49.470,00:01:56.700,I have been on Youtube for 10 years and it was starting to show. There was so much gray in my beard,0.0
00:01:56.700,00:02:00.650,that uh i'm shaving it off to wind back the clock,0.0
00:02:00.650,00:02:05.720,I am giving away this fully specked 2017 macbook pro,0.34
00:02:06.430,00:02:08.670,I used this to make a lot of my videos,0.0
00:02:08.670,00:02:10.590,but those are all wiped off here now,0.0
00:02:10.590,00:02:13.050,so it's just a nicely specced laptop,0.4404
00:02:13.050,00:02:15.530,that you could use to make more videos if you wanted,0.0
00:02:17.370,00:02:23.450,Any advice you have for people coming out of high school or college and unsure how to take their first steps?,-0.25
00:02:23.450,00:02:27.690,the key is just start doing it,0.0
00:02:27.690,00:02:30.800,after making my Youtube channel for a few months,0.0
00:02:30.800,00:02:36.720,I sort of snuck into a science awards in sydney and australia,0.4588
00:02:36.720,00:02:43.200,And there I found sort of the executive producer of the only science show on Australian television,0.0
00:02:43.200,00:02:45.020,and I got his business card,0.0
00:02:45.020,00:02:47.160,"And the very next day, I emailed him",0.0
00:02:47.160,00:02:52.880,"And I sent him links to all of the videos, or you know, the videos I was most proud of anyway",0.5256
00:02:52.880,00:02:55.150,And uh I didn't really expect to hear anything,0.0
00:02:55.150,00:02:57.530,but three weeks later I got an email back from him,0.0
00:02:57.530,00:03:00.480,"and he was like, these are really good why don't you come in and we'll have a chat",0.6901
00:03:01.240,00:03:03.440,and I think the key to that interaction was,0.0
00:03:03.440,00:03:06.010,I had stuff to show him,0.0
00:03:06.010,00:03:10.200,"I didn't go to him and say, ""Hey I'd love to be involved in your TV program.""",0.6369
00:03:10.200,00:03:12.990,you know what can I do for you? What do you need done? You know?,0.0
00:03:12.990,00:03:16.010,I came to him and I said that's what I'm capable of,0.3818
00:03:16.010,00:03:19.710,"and if if that's of interest to you, then great",0.7964
00:03:20.300,00:03:23.870,I have literally thousands of penrose tiles,0.0
00:03:23.870,00:03:27.790,"that I will be sending out, if you want them, I'm giving these away.",0.4019
00:03:27.790,00:03:34.860,I will send you 21 kites and then 13 darts of another color,0.0
00:03:40.720,00:03:43.530,What has been the hardest part of your Youtube journey?,0.0
00:03:44.160,00:03:45.900,I would say the beginning,0.0
00:03:45.900,00:03:48.600,"You know, everything's like a snowball",0.3612
00:03:48.600,00:03:52.480,It's always hardest to make the snowball when it's small,0.0
00:03:52.480,00:03:58.280,and I know that there were a number of times when I thought that I would just quit doing youtube,0.0772
00:03:58.280,00:04:01.120,because it seemed like I was getting no traction,0.0772
00:04:01.120,00:04:05.360,"I think the other problem with the beginning was, I wasn't very good at Youtube",-0.6511
00:04:05.960,00:04:08.730,I wasn't very good at presenting to a camera,-0.3865
00:04:08.730,00:04:10.780,I wasn't very good at picking topics,-0.3865
00:04:10.780,00:04:13.200,Most people know how to tell apart a,0.0
00:04:13.200,00:04:13.960,。。。,0.0
00:04:13.960,00:04:16.580,a hard-boiled egg from a raw egg,0.0
00:04:16.580,00:04:17.460,。。。,0.0
00:04:17.460,00:04:20.830,Well you're gonna find out pretty quick if you uh if you break the shell,0.6486
00:04:22.230,00:04:24.650,I've said it before and I'll say it again,0.0
00:04:24.650,00:04:27.390,I think I was lucky not to know how bad I was,-0.1779
00:04:27.390,00:04:30.300,because otherwise I really would have stopped in the early days,-0.2878
00:04:32.820,00:04:35.680,I am giving away these Ames windows,0.34
00:04:35.680,00:04:38.460,All lovingly handcrafted by me,0.6369
00:04:38.460,00:04:42.050,painstakingly over hours and hours colored in beautiful,0.5994
00:04:42.050,00:04:43.960,gopro hero4,0.0
00:04:43.960,00:04:45.920,still works a little old,0.0
00:04:50.460,00:04:52.690,Do your kids watch your videos?,0.0
00:04:52.690,00:04:53.820,Some of them,0.0
00:04:53.820,00:04:55.360,uh their favorites are the one where,0.4215
00:04:55.360,00:04:57.850,"daddy quote ""blasts off into space""",0.0
00:04:57.850,00:05:01.480,and also the one where the meteor hits the earth,0.0
00:05:02.360,00:05:07.320,I actually feel like the kids are a good barometer of what's gonna be successful,0.8481
00:05:07.320,00:05:10.170,It's like if it appeals to their two and four-year-old brains,0.3612
00:05:10.170,00:05:13.090,then it will appeal to all of us in some way,0.0
00:05:13.620,00:05:19.720,I'm giving away these astronaut shoes which are size 8 US or 41 in Europe,0.34
00:05:19.720,00:05:22.210,the salt lamp from negative ions,-0.5719
00:05:22.210,00:05:24.770,these platonic solids there should be five of them,0.0
00:05:24.770,00:05:30.010,What was the most humbling response you got from the audience and for which video?,0.0
00:05:31.130,00:05:33.240,uh depends on what you mean by humbling,0.0
00:05:33.240,00:05:36.760,In like Brady Haran has ruined this word for me,-0.1531
00:05:36.760,00:05:42.240,but if you mean like the most overwhelming positive response that I've gotten,0.8614
00:05:42.240,00:05:45.960,"You know, I would say I did this video on the bullet block years ago",-0.4404
00:05:45.960,00:05:49.800,and there were over a hundred video responses,0.0
00:05:49.800,00:05:52.290,which just totally blew me away,0.0
00:05:52.290,00:05:54.450,the one-way speed of light video,0.0
00:05:54.450,00:05:56.640,got a huge response from people,0.3182
00:05:56.640,00:05:59.920,"there's over 50,000 comments on that video",0.0
00:05:59.920,00:06:04.560,not to mention the hundreds of emails I received and the tweets,0.0
00:06:04.560,00:06:11.120,and it's incredible to have hundreds and thousands of people thinking about science,0.0
00:06:11.120,00:06:15.570,and the fundamental way that the universe works,0.0
00:06:15.570,00:06:19.400,I am delighted that you guys are with me,0.5106
00:06:21.260,00:06:23.600,What do you do apart from Youtube?,0.0
00:06:24.200,00:06:33.640,"Well, I have three kids and they take up most of the time outside of when I'm doing Youtube videos",0.2732
00:06:33.640,00:06:37.180,so that's it I'm a Youtuber and a dad,0.0
00:06:37.180,00:06:39.250,Which is pretty great,0.8074
00:06:39.250,00:06:40.500,I love going to the beach,0.6369
00:06:40.500,00:06:43.210,"I love hiking up the hill, I love riding our bikes",0.8555
00:06:43.210,00:06:44.460,I'm a pretty simple guy,0.4939
00:06:44.460,00:06:47.580,and 2020 has made things even simpler,0.0
00:06:47.580,00:06:49.360,because there was really nothing we could do,0.0
00:06:49.360,00:06:50.690,the last shade balls,0.0
00:06:53.320,00:06:57.440,All right. What would you say was the hardest part of your PhD?,0.0
00:06:57.440,00:07:02.360,"Okay so the hardest part of a PhD is that it's this research degree, right?",0.2263
00:07:02.360,00:07:03.890,Which maybe is stating the obvious,0.0
00:07:03.890,00:07:05.680,when I got into it I remember,0.0
00:07:05.680,00:07:08.880,talking to someone who had recently finished their PhD and she told me,0.0
00:07:08.880,00:07:12.840,a PhD is a dark time in most people's lives,0.0
00:07:12.840,00:07:14.370,"and I was like,",0.3612
00:07:14.370,00:07:16.890,what did I get myself into,0.0
00:07:16.890,00:07:18.300,but I realized what she meant,0.0
00:07:18.300,00:07:24.060,because for three or four years I was kind of on this roller coaster,0.0
00:07:24.060,00:07:27.160,the problem with research is you never quite know what you're doing,-0.4019
00:07:27.160,00:07:30.780,that's the point of research and you never quite know what you're gonna find,0.0
00:07:30.780,00:07:35.200,so there's a big risk that it's all gonna be worthless,-0.6124
00:07:35.200,00:07:39.640,that you're gonna spend six months or a year or many years depending on your field,0.0
00:07:39.640,00:07:43.280,working on something and only to find out that it didn't work,0.0
00:07:43.280,00:07:45.010,or it's not gonna happen,0.0
00:07:45.010,00:07:49.330,and for me that is a very hard thing to do,-0.1761
00:07:49.330,00:07:52.900,I feel like my personality is not built for that kind of research,0.3612
00:07:52.900,00:07:56.240,because I need sort of to regularly achieve things,0.0
00:07:56.240,00:07:58.210,and to feel like i'm doing practical things,0.3612
00:07:58.210,00:08:00.690,and having a practical impact on the world,0.0
00:08:00.690,00:08:02.160,what was the best part of it?,0.6369
00:08:02.160,00:08:06.120,getting to meet lots of academics and talk to different people,0.0
00:08:06.120,00:08:09.620,My thesis supervisor Manjula Sharma was fantastic,0.5574
00:08:09.620,00:08:15.580,"and I learned a ton about academia, and about research, and about writing",0.0
00:08:15.580,00:08:19.250,it was a real nice shift for me to go into a PhD,0.4215
00:08:19.250,00:08:23.000,that was not solely focused on math you know coming out of engineering physics,-0.2924
00:08:23.000,00:08:27.420,it was nice to be focused on something that involved words and writing and reading,0.6597
00:08:27.420,00:08:31.880,"and I realized, oh that whole area of life has been kind of shut off to me",0.0
00:08:31.880,00:08:35.040,"as an engineering student, so that was a nice transition",0.4215
00:08:35.040,00:08:38.410,What was the most unexpected part of it?,0.0
00:08:38.410,00:08:42.530,well I gotta say that was having more people than just my thesis reviewers,0.2732
00:08:42.530,00:08:44.800,which are three people read my thesis,0.0
00:08:44.800,00:08:48.800,"and the reason for it was, I went out and made videos",0.0
00:08:48.800,00:08:51.660,"You know, about my PhD research",0.0
00:08:51.660,00:08:54.340,and uh it's funny that a Youtube video,0.4404
00:08:54.340,00:09:00.300,is the thing that these days can get your thesis or your papers more citations and better read,0.4877
00:09:00.300,00:09:05.560,In 2010 I made this short video for tedx in Sydney,0.0
00:09:05.560,00:09:09.330,and I initially shot it like talking to camera,0.3612
00:09:09.330,00:09:12.260,and when I got home all the footage was corrupted and I couldn't use it,0.0
00:09:12.260,00:09:14.690,it was the night before the submission deadline,0.0
00:09:14.690,00:09:18.100,and so I drew stick figures in paint,0.0
00:09:18.100,00:09:20.010,ask almost anyone about physics,0.0
00:09:20.010,00:09:23.930,"and chances are they will tell you they don't like it, don't get it, or it's just not their thing",-0.0798
00:09:24.810,00:09:29.400,and I feel like that's still one of my the best things that I've done,0.7717
00:09:29.400,00:09:34.180,"Which is like, there are tons of times when it seems like you should be discouraged and throw in the towel",0.3182
00:09:34.180,00:09:35.060,but I did not,0.0
00:09:35.060,00:09:38.820,I just made do with the crappy tools that I had,-0.5574
00:09:38.820,00:09:44.780,and frankly I think the video was better with the stupid stick figures than it would have been with a talking head,-0.128
00:09:47.410,00:09:51.930,Okay the garage gets full of.. stuff,0.2263
00:09:51.930,00:09:56.690,these are boxes of the Snatoms expansion kit,0.0
00:09:56.690,00:10:00.090,and I want to sign them and send them out to teachers,0.0772
00:10:00.090,00:10:04.540,so teachers use your school emails uh in the form,0.0
00:10:04.540,00:10:08.290,and  will send you one of these if you're lucky,0.4215
00:10:08.290,00:10:12.240,okay lightning round why does Veritasium have 42 mass number,0.296
00:10:12.240,00:10:17.610,because that's the answer to the ultimate question of life the universe and everything from the hitchhiker's guide to the galaxy,0.0
00:10:17.610,00:10:18.680,How are you doing?,0.0
00:10:18.680,00:10:19.170,well,0.2732
00:10:19.170,00:10:20.770,What's your favorite ice cream flavor?,0.4588
00:10:20.770,00:10:22.610,pistachio or rocky road,0.0
00:10:22.610,00:10:26.120,Do you truly love turbulent flow or do you just fake it for the internet?,0.6124
00:10:26.120,00:10:27.280,。。。,0.0
00:10:27.280,00:10:28.000,Merch?,0.0
00:10:28.000,00:10:28.940,I don't have any,0.0
00:10:28.940,00:10:29.740,Would you like some?,0.3612
00:10:29.740,00:10:31.890,some did you learn any Portuguese with your wife?,0.0
00:10:31.890,00:10:33.220,um bocadinho,0.0
00:10:33.220,00:10:35.130,"She hates the way I say ""bacalhau""",-0.4404
00:10:35.130,00:10:36.530,I find it impossible,0.0
00:10:36.530,00:10:38.250,Science or maths?,0.0
00:10:38.250,00:10:38.840,science,0.0
00:10:38.840,00:10:40.130,Do you miss Canada?,-0.1531
00:10:40.130,00:10:42.460,Yes. Today especially,0.4019
00:10:42.460,00:10:43.980,Favorite shrek character?,0.4588
00:10:43.980,00:10:44.490,Shrek,0.0
00:10:44.490,00:10:45.690,Is a hot dog a sandwich?,0.0
00:10:45.690,00:10:46.780,。。。,0.0
00:10:46.780,00:10:48.460,How much do you love science?,0.6369
00:10:48.460,00:10:49.440,to the moon and back,0.0
00:10:49.440,00:10:51.340,How many hours of sleep do you get,0.0
00:10:51.340,00:10:53.530,Not enough. Not.. Enough,0.0
00:10:53.530,00:10:55.930,"If not youtube, what would you be today?",0.0
00:10:55.930,00:10:58.370,"I think probably a teacher of some sort, maybe a professor",0.0
00:11:00.980,00:11:02.700,How big is your team?,0.0
00:11:02.700,00:11:06.900,because the production value of your videos has been so awesome these days,0.8244
00:11:06.900,00:11:08.370,well thank you for noticing,0.5574
00:11:08.370,00:11:10.690,and yes there has been a team being built,0.4019
00:11:10.690,00:11:16.820,"Johnny Hyman who can animate edit write music, write programs",0.0
00:11:16.820,00:11:20.290,He's also working on a channel of his own called verse you should check it out,0.0
00:11:20.290,00:11:23.260,My wife Raquel is frequently behind the camera,0.0
00:11:23.260,00:11:26.300,I'm so incredibly appreciative of that,0.6335
00:11:26.300,00:11:27.600,thank you thank you thank you,0.7579
00:11:27.600,00:11:30.050,Yvonne Tello is my animator,0.0
00:11:30.050,00:11:33.240,He's been doing lots of great work in all sorts of different styles,0.6249
00:11:33.240,00:11:36.320,Peter Lebedev who's been helping me with research and writing,0.296
00:11:36.320,00:11:39.140,and doing everything that possibly needs doing,0.0
00:11:39.140,00:11:42.570,My former professor of general relativity at the university of Sydney,0.0
00:11:42.570,00:11:46.040,Grant Lewis has been an advisor on many of these videos,0.3612
00:11:46.040,00:11:47.540,a huge thank you to Alice,0.5859
00:11:47.540,00:11:51.250,for managing everything that's happening in Chinese Veritasium,0.0
00:11:51.250,00:11:53.920,There's Veritasium dubbed in spanish,0.0
00:11:53.920,00:11:55.920,"in arabic, in russian,",0.0
00:11:55.920,00:11:58.120,We're working on a Veritasium hindi,0.0
00:11:58.120,00:12:02.580,and I gotta say paying people would not really be possible without the sponsors,0.0
00:12:02.580,00:12:04.970,"so I gotta say thank you for being okay with it,",0.5267
00:12:04.970,00:12:07.570,because that's what allowed me to have a rocket built,0.0
00:12:07.570,00:12:10.930,or build an eight foot tall optical illusion,0.0
00:12:10.930,00:12:13.450,those are things I just never would have dreamed of doing in the past,0.0
00:12:13.450,00:12:18.080,because my investment in every video was essentially only my time,0.0
00:12:18.080,00:12:21.600,and now I feel like I can try lots of different things,0.3612
00:12:21.600,00:12:26.010,so this is a q&amp;a video but the final q is for you,0.0
00:12:26.010,00:12:32.090,"Which is, what do you want to see more of on this channel in 2021 and in the future?",0.0772
00:12:32.090,00:12:34.520,What have you enjoyed the most in the past?,0.5106
00:12:34.520,00:12:37.170,I just want to know what I can do for you,0.0772
00:12:37.170,00:12:40.380,what is the thing that really adds the most value to your life,0.4005
00:12:40.380,00:12:42.930,uh that's it for me,0.0
00:12:42.930,00:12:46.380,"I guess, thank you seriously thank you",0.5106
