Start Time,End Time,Text,sentiment-score
00:00:00.160,00:00:03.120,I made a video about a gigantic circuit,0.0
00:00:03.120,00:00:05.760,with light-second long wires,0.0
00:00:05.760,00:00:07.840,"that connect up to a light bulb,",0.0
00:00:07.840,00:00:11.600,"which is just one meter away from the battery and switch,",0.0
00:00:11.600,00:00:13.840,"and I asked you, after I closed the switch,",0.0
00:00:13.840,00:00:16.160,how long will it take for us to get light,0.0
00:00:16.160,00:00:17.040,from that light bulb?,0.0
00:00:17.680,00:00:20.560,And my answer was 1/c seconds.,0.0
00:00:20.560,00:00:22.560,- And his answer is wrong.,-0.4767
00:00:22.560,00:00:24.400,- We would be able to communicate,0.0
00:00:24.400,00:00:25.840,faster than the speed of light.,0.0
00:00:25.840,00:00:28.240,- That violates causality and common sense.,-0.5106
00:00:28.240,00:00:30.560,- This is actually a bit misleading.,-0.4019
00:00:30.560,00:00:31.280,- Misleading.,-0.4019
00:00:31.280,00:00:32.240,- Misleading in a way.,-0.4019
00:00:32.240,00:00:33.520,- Extremely unconvinced.,-0.4391
00:00:33.520,00:00:38.160,- Naughty Mr. Veritasium has stirred up a right hornet's nest.,0.0
00:00:38.160,00:00:41.840,- Clearly I did not do a good job of explaining,0.0757
00:00:41.840,00:00:43.680,what was really going on in the last video.,0.0
00:00:43.680,00:00:47.520,So I wanna clear up any confusion that I created.,0.3947
00:00:47.520,00:00:52.480,"So behind me, we have a scaled down model of this circuit.",0.0
00:00:53.040,00:00:56.160,It is only 10 meters in length on either side.,0.0
00:00:56.720,00:00:59.440,"Obviously that's a lot shorter than one light-second,",0.0
00:00:59.440,00:01:01.360,"but for the first 30 nanoseconds,",0.0
00:01:01.360,00:01:04.480,"this model should be identical to the big circuit,",0.0
00:01:04.480,00:01:06.720,"and Caltech has very fast scopes,",0.0
00:01:06.720,00:01:09.760,so we'll be able to see what's going on in this time.,0.0
00:01:09.760,00:01:12.160,"I got a ton of help on this from Richard Abbott,",0.4019
00:01:12.160,00:01:15.360,"who works on LIGO, the gravitational wave detector.",0.0
00:01:15.360,00:01:18.320,"Over here, we are going to put a little resistor,",0.0
00:01:18.320,00:01:20.800,"which is gonna be the stand in for our light bulb,",0.0
00:01:20.800,00:01:25.920,"and we're going to measure it with a scope and see essentially,",0.0
00:01:25.920,00:01:28.960,what is the time delay between applying a pulse,-0.3182
00:01:28.960,00:01:31.040,"on the other side, basically flicking the switch,",0.0
00:01:31.040,00:01:34.400,for us to get a voltage across our resistor.,0.0
00:01:34.960,00:01:37.680,And the magnitude of that voltage is really important.,0.2716
00:01:37.680,00:01:39.320,A lot of people thought it would be negligible.,0.0
00:01:39.320,00:01:42.480,- The amount of energy supplied by this is so minuscule.,0.2732
00:01:42.480,00:01:44.880,"- A tiny, tiny effect, right?",0.0
00:01:44.880,00:01:46.800,- The amount of power you're getting,0.0
00:01:46.800,00:01:49.360,"to the lamp over here, it's nuff-all",0.0
00:01:49.360,00:01:51.760,- He meant the light turns on,0.0
00:01:51.760,00:01:53.840,at any current level immediately.,0.0
00:01:53.840,00:01:55.280,- That is not what I meant.,0.0
00:01:55.280,00:01:57.680,"- Well, actually, with that assumption,",0.2732
00:01:57.680,00:01:59.040,Derek's answer is wrong.,-0.4767
00:01:59.040,00:02:00.880,The light never turns off,0.0
00:02:00.880,00:02:02.880,no matter the state of the switch.,-0.0191
00:02:02.880,00:02:07.040,Some electrons will jump the gap and result in an extremely,0.0
00:02:07.040,00:02:09.120,small continuous leakage current.,0.0
00:02:09.120,00:02:11.600,- Let me be clear about what I am claiming.,0.3818
00:02:11.600,00:02:14.400,"Okay, it is my claim that we will see voltage",0.2263
00:02:14.400,00:02:17.040,and current through the load that is many orders,0.0
00:02:17.040,00:02:19.440,"of magnitude greater than leakage current,",0.3612
00:02:19.440,00:02:20.480,an amount of power,0.0
00:02:20.480,00:02:22.320,that would actually produce visible light,0.0
00:02:22.320,00:02:24.800,"if you put it through an appropriate device,",0.0
00:02:24.800,00:02:26.480,and we will see that power there,0.0
00:02:26.480,00:02:28.160,in roughly the time it takes the light,0.0
00:02:28.160,00:02:29.760,"to cross the one meter gap,",0.0
00:02:30.320,00:02:32.160,"but to understand why this happens,",0.0
00:02:32.160,00:02:34.320,we first have to clear up some misconceptions,0.3818
00:02:34.320,00:02:36.320,that I saw in responses.,0.0
00:02:36.320,00:02:39.520,Misconception number one is thinking that electrons,0.0772
00:02:39.520,00:02:42.000,carry the energy from the battery to the bulb.,0.2732
00:02:43.760,00:02:46.400,Let's say we have a simple circuit with a battery and a bulb,0.0
00:02:46.400,00:02:48.080,operating at steady state.,0.0
00:02:48.080,00:02:50.160,"If you zoom in on the light bulb filament,",0.0
00:02:50.160,00:02:53.600,"you'd see a lattice of positively charged cores of atoms,",0.3818
00:02:53.600,00:02:56.000,"the nucleus and lowest shells of electrons,",-0.3818
00:02:56.000,00:02:58.800,"surrounded by a sea of negative electrons,",-0.5719
00:02:58.800,00:03:01.120,which are free to move around the lattice.,0.5106
00:03:01.120,00:03:04.480,"The actual speed of these electrons is very fast,",0.0
00:03:04.480,00:03:06.880,"around a million meters per second,",0.0
00:03:06.880,00:03:08.400,but all in random directions.,0.0
00:03:08.960,00:03:11.440,The average drift velocity of an electron,0.0
00:03:11.440,00:03:14.480,is less than 0.1 millimeters per second.,0.0
00:03:15.120,00:03:18.240,"Now frequently, an electron will bump into a metal ion,",0.0
00:03:18.240,00:03:21.040,and transfer some or all of its kinetic energy,0.2732
00:03:21.040,00:03:21.760,to the lattice.,0.0
00:03:22.320,00:03:24.880,The electron slows down and the metal lattice,0.0
00:03:24.880,00:03:26.160,starts wiggling more.,0.0
00:03:26.160,00:03:26.880,It heats up.,0.0
00:03:27.440,00:03:30.080,And ultimately this is what causes the filament,0.0
00:03:30.080,00:03:31.920,to glow and emit light.,0.0
00:03:31.920,00:03:34.400,So a lot of people will look at this and conclude,0.0
00:03:34.400,00:03:38.000,the electron carried the energy from the battery to the bulb,0.2732
00:03:38.000,00:03:40.560,"where it dissipated its kinetic energy as heat,",0.2732
00:03:41.280,00:03:44.560,"but consider, where did the electron get its kinetic energy",0.3919
00:03:44.560,00:03:45.840,from before the collision?,-0.3612
00:03:46.640,00:03:49.040,It didn't carry that energy from the battery.,-0.2057
00:03:49.040,00:03:51.520,"In fact, if the circuit has only been on for a short time,",0.0
00:03:51.520,00:03:54.400,that electron hasn't been anywhere near the battery.,0.0
00:03:54.400,00:03:57.040,So how was it accelerated before the collision?,-0.3612
00:03:57.600,00:04:01.680,"The answer is, it was by an electric field in the wire.",0.0
00:04:02.320,00:04:05.280,"The electron repeatedly collides with the lattice,",-0.2732
00:04:05.280,00:04:06.400,and loses energy.,-0.0516
00:04:06.400,00:04:07.840,"And after each collision,",-0.3612
00:04:07.840,00:04:10.640,it is again accelerated by the electric field.,0.0
00:04:11.360,00:04:13.920,So although it is the electron that transfers energy,0.2732
00:04:13.920,00:04:17.360,"to the lattice, the energy came from the electric field.",0.2732
00:04:18.320,00:04:20.720,So where does that electric field come from?,0.0
00:04:20.720,00:04:23.360,"Well, a lot of animations make it look like the electrons",0.5574
00:04:23.360,00:04:25.040,push each other through the circuit,0.0
00:04:25.040,00:04:27.120,via their mutual repulsion.,0.0
00:04:27.120,00:04:28.800,So you might think the electric field,0.0
00:04:28.800,00:04:30.880,comes from the electron behind it.,0.0
00:04:30.880,00:04:33.440,"There is the analogy of water flowing through a hose,",0.0
00:04:33.440,00:04:34.960,or marbles in a tube.,0.0
00:04:35.600,00:04:39.440,"This is misconception two, thinking that mobile electrons",0.0
00:04:39.440,00:04:41.520,push each other through the circuit.,0.0
00:04:41.520,00:04:44.640,That is not how electrons flow in circuits.,0.0
00:04:45.200,00:04:48.000,"The truth is if you average over a few atoms,",0.3182
00:04:48.000,00:04:49.520,you find the charge density,0.0
00:04:49.520,00:04:51.680,everywhere inside a conductor is zero.,0.0
00:04:52.240,00:04:54.880,The negative charge of electrons and the positive cores,-0.0258
00:04:54.880,00:04:57.120,of atoms perfectly cancel out.,0.4939
00:04:57.680,00:05:00.320,"So for each repulsive force between electrons,",0.0
00:05:00.320,00:05:03.520,there is an equal and opposite force from the positive ion,0.5574
00:05:03.520,00:05:04.080,next to it.,0.0
00:05:04.640,00:05:06.080,These forces cancel out.,-0.25
00:05:06.080,00:05:09.840,So mobile electrons cannot push each other through the wire.,0.0
00:05:10.560,00:05:13.120,So where does the electric field come from?,0.0
00:05:13.760,00:05:15.920,Misconception number three is that it comes,0.0772
00:05:15.920,00:05:17.280,entirely from the battery.,0.0
00:05:17.840,00:05:19.200,"This makes intuitive sense,",0.0
00:05:19.200,00:05:22.000,"since the battery is the active element in the circuit,",0.4019
00:05:22.000,00:05:24.240,it has a positive side and a negative side.,-0.0258
00:05:24.240,00:05:26.080,"So it has an electric field,",0.0
00:05:26.640,00:05:29.600,but this is not the electric field that all the electrons,0.0
00:05:29.600,00:05:31.040,within the wire experience.,0.0
00:05:31.680,00:05:33.040,Consider that the electric field,0.0
00:05:33.040,00:05:36.240,of the battery is much larger close to the battery.,0.0
00:05:36.240,00:05:38.400,So if its field were really what's pushing,0.0
00:05:38.400,00:05:39.840,"the electrons around,",0.0
00:05:39.840,00:05:42.160,"then if you brought the light bulb close to the battery,",0.0
00:05:42.160,00:05:44.480,then the bulb would glow much brighter.,0.3818
00:05:44.480,00:05:45.120,And it doesn't.,0.0
00:05:45.680,00:05:48.000,The truth is that the electric field in the wire,0.3182
00:05:48.000,00:05:51.120,comes both from the battery and from charges,-0.2732
00:05:51.120,00:05:53.280,on the surface of the wires of the circuit.,0.0
00:05:54.240,00:05:56.160,As you go along the wire from the negative end,-0.5719
00:05:56.160,00:05:57.920,"of the battery to the positive end,",0.5574
00:05:57.920,00:06:01.280,"there is a gradient of charge built up on its surface,",0.0
00:06:01.280,00:06:03.840,"starting with an excess of electrons,",0.0
00:06:03.840,00:06:06.560,"through to roughly no charge in the middle,",-0.296
00:06:06.560,00:06:08.960,as we'll see the steepest charge gradient is actually,0.0
00:06:08.960,00:06:12.320,"across the load to a deficiency of electrons,",0.0
00:06:12.320,00:06:15.600,the exposed positive cores of atoms on the surface,0.5106
00:06:15.600,00:06:17.280,of the positive end of the wire.,0.5574
00:06:18.240,00:06:20.720,All these charges and the charges on the battery,-0.4939
00:06:20.720,00:06:24.080,create the electric field everywhere inside the wires.,0.2732
00:06:24.640,00:06:26.400,They also create an electric field,0.2732
00:06:26.400,00:06:28.160,in the space around the wires.,0.0
00:06:29.120,00:06:32.400,These surface charges were set up almost instantaneously,-0.2732
00:06:32.400,00:06:34.960,when the battery was inserted into the circuit.,0.0
00:06:34.960,00:06:36.960,You might think you'd have to move electrons,0.0
00:06:36.960,00:06:40.240,"a significant distance to create this charge distribution,",0.4404
00:06:40.240,00:06:42.000,but that is not the case.,0.0
00:06:42.720,00:06:46.480,"Even a slight expansion or contraction of the electron sea,",0.0
00:06:46.480,00:06:49.840,"with electrons moving on average, the radius of a proton,",0.0
00:06:49.840,00:06:52.720,can establish the surface charges you see.,-0.2732
00:06:53.520,00:06:55.200,So the time for the charges to move,-0.2732
00:06:55.200,00:06:57.280,is completely negligible.,0.0
00:06:57.280,00:06:59.200,The speed of the setup process is limited,-0.2263
00:06:59.200,00:07:02.000,only by the speed of light.,0.0
00:07:02.000,00:07:04.960,"Once that surface charge distribution has been established,",0.0
00:07:04.960,00:07:08.080,"the battery does continuous work to maintain it,",0.0
00:07:08.080,00:07:10.400,by moving electrons through the battery,0.0
00:07:10.400,00:07:11.920,against the Coulomb force.,0.0
00:07:12.720,00:07:14.640,"In the load, the electric field",0.0
00:07:14.640,00:07:18.080,"created by all the surface charges, accelerates electrons,",-0.0258
00:07:18.080,00:07:21.280,which dissipate their energy in collisions with the lattice.,0.0
00:07:21.280,00:07:24.560,"So the battery is putting energy into the field,",0.2732
00:07:24.560,00:07:27.840,which electrons take out and transfer to the load.,0.0
00:07:28.480,00:07:30.720,"An electrical engineer who made a response video,",0.0
00:07:30.720,00:07:33.360,"Ben Watson, came up with a good analogy.",0.4404
00:07:33.360,00:07:36.000,The battery is like a shepherd.,0.3612
00:07:36.000,00:07:38.160,The surface charges are the sheep dogs,-0.2732
00:07:38.160,00:07:39.840,responding to his orders.,0.0
00:07:39.840,00:07:42.320,"And the mobile electrons are the sheep,",0.0
00:07:42.320,00:07:44.400,guided by those barking dogs.,0.0
00:07:45.440,00:07:47.840,The surface charge description of electric circuits,0.0
00:07:47.840,00:07:49.840,"is omitted from most textbooks,",0.0
00:07:49.840,00:07:51.520,but there is a great treatment of it,0.7684
00:07:51.520,00:07:54.480,in Matter and Interactions by Chabay and Sherwood.,0.0258
00:07:55.360,00:07:58.320,They also have a VPython simulation where you can see,0.0
00:07:58.320,00:08:00.400,"the positive surface charge in red,",0.5574
00:08:00.400,00:08:02.400,and negative surface charge in blue.,-0.5719
00:08:03.040,00:08:05.600,You can see how this entire charge distribution,0.0
00:08:05.600,00:08:08.880,"creates a net electric field shown by the orange arrow,",0.2732
00:08:09.520,00:08:12.080,"everywhere in and around the circuit,",0.0
00:08:12.080,00:08:13.840,"everywhere inside the wire,",0.0
00:08:13.840,00:08:16.240,the electric field has the same magnitude,0.0
00:08:16.240,00:08:18.480,and its direction is along the wire.,0.0
00:08:19.040,00:08:20.880,This is really showing you the electric field,0.0
00:08:20.880,00:08:23.840,"in the center of the wire, but it's depicted on the surface",0.0
00:08:23.840,00:08:24.800,so you can see it.,0.0
00:08:25.680,00:08:26.800,"In this circuit,",0.0
00:08:26.800,00:08:28.960,"all the conductors are made of the same material,",0.0
00:08:28.960,00:08:30.320,but the segment at the bottom,0.0
00:08:30.320,00:08:32.320,has a much narrower cross section.,0.0
00:08:32.320,00:08:33.920,So it represents a resistor.,0.0
00:08:34.640,00:08:37.200,"Since the cross sectional area is smaller,",0.0
00:08:37.200,00:08:39.600,the electron drift velocity through the resistor,0.0
00:08:39.600,00:08:43.040,has to be higher so that it can carry the same current,0.0
00:08:43.040,00:08:44.720,as everywhere else in the circuit.,0.0
00:08:45.360,00:08:47.920,"Now, drift velocity is directly proportional",0.0
00:08:47.920,00:08:49.440,to electric field.,0.0
00:08:49.440,00:08:52.800,So the electric field must be largest inside the resistor.,0.0
00:08:53.360,00:08:55.920,And this is achieved by having the steepest gradient,0.0
00:08:55.920,00:08:57.200,of surface charges here.,-0.2732
00:08:58.480,00:09:01.600,You can also see the contribution to the net electric field,0.0
00:09:01.600,00:09:03.520,"from the battery in magenta,",0.0
00:09:03.520,00:09:06.160,and the contribution from surface charges in green.,-0.2732
00:09:06.960,00:09:08.080,"Far from the battery,",0.0
00:09:08.080,00:09:10.880,"most of the electric field is due to surface charges,",-0.2732
00:09:10.880,00:09:14.080,"whereas close to the battery, it has a greater contribution",0.3612
00:09:14.080,00:09:15.520,and the field due to surface charges,-0.2732
00:09:15.520,00:09:17.520,is actually in the opposite direction,0.0
00:09:17.520,00:09:18.960,to the field from the battery.,0.0
00:09:19.760,00:09:22.640,"So to sum up, electrons don't carry the energy",-0.2057
00:09:22.640,00:09:24.240,"from battery to bulb,",0.0
00:09:24.240,00:09:26.400,nor do they push each other through the wire.,0.0
00:09:27.040,00:09:29.600,"They are pushed along by an electric field,",0.0
00:09:29.600,00:09:31.840,"which is created by charges on the battery,",-0.0258
00:09:31.840,00:09:34.000,and charges on the surface of the wires.,-0.2732
00:09:34.640,00:09:36.240,"With this view of circuits,",0.0
00:09:36.240,00:09:38.720,"things that might have previously seemed mysterious,",0.0
00:09:38.720,00:09:39.840,make a lot more sense.,0.0
00:09:40.400,00:09:43.360,"Like if electrons leave a battery at the same rate,",0.3182
00:09:43.360,00:09:45.600,"and with the same drift velocity as they return,",0.0
00:09:46.160,00:09:48.400,how do they carry energy from the battery?,0.2732
00:09:49.120,00:09:50.720,The answer is they don't.,0.0
00:09:51.280,00:09:53.600,They are accelerated by the electric field,0.0
00:09:53.600,00:09:55.520,before each collision with the lattice.,-0.3612
00:09:56.560,00:09:59.760,"At a junction, how do the correct number of electrons",0.0772
00:09:59.760,00:10:00.960,go down each path?,0.0
00:10:01.600,00:10:04.000,"Well, they're guided by the electric field,",0.2732
00:10:04.000,00:10:06.480,which extends everywhere throughout the circuit.,0.128
00:10:07.040,00:10:09.120,"The fields are the main actors,",0.0
00:10:09.120,00:10:11.200,"extending everywhere throughout the circuit,",0.0
00:10:11.200,00:10:13.520,and the electrons are just their pawns.,0.0
00:10:15.200,00:10:17.680,So how does this apply to the big circuit?,0.0
00:10:17.680,00:10:19.920,"When the battery is connected into the circuit,",0.0
00:10:19.920,00:10:23.360,"even with the switch open, charges rearrange themselves.",-0.2732
00:10:23.360,00:10:24.720,"On the negative side of the battery,",-0.5719
00:10:24.720,00:10:26.320,there is an excess of electrons,0.0
00:10:26.320,00:10:28.080,on the surface of the wires and the switch.,0.0
00:10:28.720,00:10:31.680,"On the positive side, there is a deficiency of electrons.",0.5574
00:10:31.680,00:10:34.960,So positive charges built up on the surface of the wires.,0.3642
00:10:35.600,00:10:38.560,The charges rearrange themselves until the electric field,-0.2732
00:10:38.560,00:10:41.280,is zero everywhere inside the conductor.,0.0
00:10:42.000,00:10:44.960,This electric field is due to all the surface charges,-0.2732
00:10:44.960,00:10:46.400,and the charges on the battery.,-0.2732
00:10:47.120,00:10:49.200,There is an electric field outside the wires,0.0
00:10:49.200,00:10:52.480,"due to these charges, but it's zero inside the wires.",-0.1406
00:10:53.200,00:10:55.040,We now have the full potential difference,0.0
00:10:55.040,00:10:56.640,of the battery across the switch.,0.0
00:10:56.640,00:10:59.920,"And no current is full flowing, except for leakage current,",-0.296
00:10:59.920,00:11:01.440,which I'll assume is negligible.,0.0
00:11:02.400,00:11:04.000,"When we close the switch,",0.0
00:11:04.000,00:11:06.480,the surface charges on both sides of the switch,-0.2732
00:11:06.480,00:11:08.720,neutralize each other on contact.,0.0
00:11:08.720,00:11:10.160,"And at that instant,",0.0
00:11:10.160,00:11:14.160,"the electric field inside the conductor is no longer zero,",-0.296
00:11:14.160,00:11:16.480,and current starts flowing through the switch.,0.0
00:11:17.120,00:11:19.680,"Simultaneously, the new electric field",0.0
00:11:19.680,00:11:21.600,from the modified surface charges,-0.2732
00:11:21.600,00:11:24.560,radiates outwards at essentially the speed of light.,0.0
00:11:24.560,00:11:26.320,"And when it reaches the bulb,",0.0516
00:11:26.320,00:11:29.600,the electric field inside it is no longer zero.,-0.296
00:11:29.600,00:11:31.520,So current starts to flow here too.,0.0
00:11:32.160,00:11:35.360,"This is why I said the bulb lights up in 1/c seconds,",0.0
00:11:35.360,00:11:38.080,"because the bulb was one meter from the switch,",0.0
00:11:38.080,00:11:40.480,and the change in the electric field travels out,0.0
00:11:40.480,00:11:41.840,at the speed of light.,0.0
00:11:41.840,00:11:42.960,"As some of you pointed out,",0.0
00:11:42.960,00:11:45.760,the answer should have been one meter divided by C.,0.0
00:11:46.320,00:11:49.360,And I apologize for the casual use of units.,0.296
00:11:50.080,00:11:52.160,"If you were to move the switch,",0.0
00:11:52.160,00:11:53.200,then the bulb would take,0.0
00:11:53.200,00:11:55.440,"a different amount of time to emit light,",0.0
00:11:55.440,00:11:56.960,which just depends on the distance,0.0
00:11:56.960,00:11:58.640,between the switch and the bulb.,0.0
00:11:59.680,00:12:01.440,"In response to my original video,",0.3182
00:12:01.440,00:12:04.000,Ben Watson simulated a model of the circuit,0.0
00:12:04.000,00:12:07.360,using software from Ansys called HFSS.,0.0
00:12:07.360,00:12:10.320,It provides a complete solution to Maxwell's equations,0.3182
00:12:10.320,00:12:11.280,in three dimensions.,0.0
00:12:11.920,00:12:13.920,Now have worked with Ben and Ansys,0.0
00:12:13.920,00:12:15.760,to make these simulations.,0.0
00:12:16.320,00:12:17.680,"When the switch is closed,",0.0
00:12:17.680,00:12:20.560,"you can see the electric field radiate out,",0.0
00:12:20.560,00:12:24.000,"and as it hits the far wire, it generates current.",0.0
00:12:24.000,00:12:25.680,The electric field is to the right.,0.0
00:12:25.680,00:12:27.600,So the electrons flow to the left.,0.0
00:12:28.640,00:12:32.000,"This simulation shows the magnitude of the magnetic field,",0.0
00:12:32.000,00:12:34.800,which falls off pretty rapidly as it crosses the gap.,0.4939
00:12:35.440,00:12:39.360,"But then a magnetic field appears around the far wire,",0.0
00:12:39.360,00:12:41.120,and this magnetic field is created,0.25
00:12:41.120,00:12:42.960,by the current in that wire.,0.0
00:12:43.680,00:12:46.640,"To me, this suggests that it really is the electric field,",0.0
00:12:46.640,00:12:48.560,and not the changing magnetic field,0.0
00:12:48.560,00:12:51.840,that creates the current through the load.,0.2732
00:12:51.840,00:12:53.680,Some commenters on the original video,0.3182
00:12:53.680,00:12:56.560,claimed my answer of three or four nanoseconds,0.0
00:12:56.560,00:12:58.080,violates causality.,-0.5106
00:12:58.080,00:12:59.440,I guess they were thinking that the bulb,0.0
00:12:59.440,00:13:01.680,would only go on if the circuit were complete.,0.0
00:13:01.680,00:13:03.920,"And it wouldn't if the circuit were broken somewhere,",-0.4767
00:13:03.920,00:13:06.240,which could be up to half a light second away.,0.0
00:13:06.800,00:13:08.560,"So it seemed like I was saying,",0.4144
00:13:08.560,00:13:10.240,we could get information about the status,0.0
00:13:10.240,00:13:13.120,"of the whole circuit, even half a light second away,",0.0
00:13:13.120,00:13:15.200,in just nanosecond seconds.,0.0
00:13:15.200,00:13:17.200,But that is not what I was saying.,0.0
00:13:17.840,00:13:19.440,"What I should have stated explicitly,",0.0
00:13:19.440,00:13:20.960,is that the bulb goes on,0.0
00:13:20.960,00:13:24.000,regardless of whether the circuit is complete or not.,0.0
00:13:24.560,00:13:26.080,The current flows through the load,0.0
00:13:26.080,00:13:28.480,due to the electric field it experiences.,0.0
00:13:29.280,00:13:32.000,"To illustrate this, Ben added a wire below the circuit",0.0
00:13:32.000,00:13:34.000,that is completely disconnected from it.,0.0
00:13:34.640,00:13:36.480,You can see is that its response,0.0
00:13:36.480,00:13:39.040,to the changing electric field is virtually identical,0.0
00:13:39.040,00:13:40.720,"to that of the top wire,",0.2023
00:13:40.720,00:13:43.120,at least up until the signal reaches the far end,0.0516
00:13:43.120,00:13:44.080,and reflects back.,0.0
00:13:44.960,00:13:47.600,This is why my answer doesn't break causality.,0.0
00:13:47.600,00:13:50.560,"At least initially, connected and disconnected wires",0.0
00:13:50.560,00:13:52.080,behave exactly the same.,0.0
00:13:53.200,00:13:54.320,"Using this software,",0.0
00:13:54.320,00:13:56.480,you can also simulate the Poynting vector,0.0
00:13:56.480,00:13:59.840,that is the cross product of electric and magnetic fields.,0.0
00:13:59.840,00:14:02.080,"In the last video, I showed how the Poynting vector",0.0
00:14:02.080,00:14:04.480,indicates the direction of energy flow.,0.2732
00:14:04.480,00:14:06.320,"And after the switch is closed,",0.0
00:14:06.320,00:14:08.640,"the Poynting vector points out of the battery,",0.0
00:14:08.640,00:14:12.080,"across the gap to the other wire, whether connected or not,",0.0
00:14:12.800,00:14:16.320,"because energy is carried by fields and not electrons,",0.2732
00:14:16.320,00:14:18.720,it can go straight across the gap.,0.2263
00:14:19.440,00:14:21.760,"So you might ask, why do we need wires at all?",0.0
00:14:22.320,00:14:25.040,"Well, we don't, I mean, phones and toothbrushes",0.2732
00:14:25.040,00:14:26.560,charge without wires connecting them,0.0
00:14:26.560,00:14:28.320,"to a stream of electrons,",0.0
00:14:28.320,00:14:30.880,and researchers have demonstrated remote charging,0.0
00:14:30.880,00:14:33.120,using the energy from WiFi signals.,0.2732
00:14:33.840,00:14:36.880,Wires are more efficient because they channel the fields,0.4754
00:14:36.880,00:14:39.200,and hence the energy from source to load.,0.2732
00:14:39.920,00:14:42.000,Here's another angle on the Poynting vector.,0.0
00:14:42.000,00:14:44.960,"And you can see once there is current in the top wire,",0.2023
00:14:44.960,00:14:48.640,the fields around it carry energy in both directions.,0.2732
