Start Time,End Time,Text,sentiment-score
00:14:48.640,00:14:50.880,"Now, of course, the Poynting vector also points",0.0
00:14:50.880,00:14:52.560,"parallel to the first wire,",0.0
00:14:52.560,00:14:54.080,carrying the energy around the circuit,0.2732
00:14:54.080,00:14:55.840,as most people would expect.,0.0
00:14:55.840,00:14:59.280,"But again, note how the energy is carried outside the wires,",0.3919
00:14:59.280,00:15:00.720,not in the wires.,0.0
00:15:01.760,00:15:04.560,"Now admittedly, thinking about circuits this way",0.0
00:15:04.560,00:15:05.760,is complicated.,0.0
00:15:05.760,00:15:08.320,And since nobody wants to solve Maxwell's equations,0.2023
00:15:08.320,00:15:10.960,"in three dimensions just to analyze a basic circuit,",0.0
00:15:10.960,00:15:13.520,scientists and engineers have worked out shortcuts.,0.0
00:15:14.080,00:15:15.680,"For example, Ohm's law,",0.0
00:15:15.680,00:15:18.080,"voltage equals current times resistance,",0.0
00:15:18.080,00:15:21.760,"is just the macroscopic result of all the surface charges,",-0.2732
00:15:21.760,00:15:24.880,their electric fields and zillions of electrons,0.0
00:15:24.880,00:15:27.120,bumping into zillions of metal ions.,0.0
00:15:27.760,00:15:29.680,You can simplify all that physics,0.0
00:15:29.680,00:15:32.560,"into a single circuit element, a resistor,",0.0
00:15:32.560,00:15:35.040,and the basic quantities of current and voltage.,0.0
00:15:35.600,00:15:38.240,"This is called the lumped element model,",0.0
00:15:38.240,00:15:41.040,lump all the spread-out multi particle and field,0.0
00:15:41.040,00:15:44.880,interactions into a few discrete circuit elements.,0.0
00:15:44.880,00:15:46.160,And we use this technique,0.0
00:15:46.160,00:15:48.240,every time we draw a circuit diagram.,0.0
00:15:48.960,00:15:52.080,So our original diagram of the big circuit is flawed,-0.1335
00:15:52.080,00:15:54.000,because fields between the wires,0.0
00:15:54.000,00:15:56.000,"are important to the problem,",-0.2263
00:15:56.000,00:15:57.520,but there are no circuit elements,-0.4215
00:15:57.520,00:15:59.280,to indicate these interactions.,0.0
00:16:00.000,00:16:03.760,"To fix it, we need to add capacitors all down the wires.",0.0
00:16:04.320,00:16:06.800,These capture the effect charges on one wire,-0.2732
00:16:06.800,00:16:08.320,have on the other.,0.0
00:16:08.320,00:16:09.920,If there are negative charges on the surface,-0.7003
00:16:09.920,00:16:11.520,"of the bottom wire, for example,",0.0
00:16:11.520,00:16:13.120,they'll induce positive charges,0.3612
00:16:13.120,00:16:14.560,on the surface of the top wire.,0.2023
00:16:15.440,00:16:17.280,"Also, since these wires are long,",0.0
00:16:17.280,00:16:19.440,they're gonna create significant magnetic fields,0.4404
00:16:19.440,00:16:22.320,"around them, which resist changes in current.",0.0
00:16:22.320,00:16:26.000,So we model this with inductors all the way down the wires.,0.0
00:16:26.640,00:16:28.480,"We could also add resistors,",0.0
00:16:28.480,00:16:30.720,making what electrical engineers would recognize,0.0
00:16:30.720,00:16:34.720,as the distributed element model for a transmission line.,0.0
00:16:34.720,00:16:37.920,But we're assuming that these wires are super conducting.,0.7469
00:16:37.920,00:16:40.000,So this is how we could model,0.0
00:16:40.000,00:16:41.920,a super conducting transmission line.,0.5994
00:16:43.200,00:16:45.760,This diagram offers another way of understanding,0.0
00:16:45.760,00:16:48.560,why current flows through the load almost immediately.,0.0
00:16:49.200,00:16:52.320,"When you first apply a voltage across a capacitor,",0.0
00:16:52.320,00:16:54.880,current flows as opposite charge builds up,0.0
00:16:54.880,00:16:56.240,on the two plates.,0.0
00:16:56.240,00:16:59.760,"In the short time limit, a capacitor is a short circuit.",0.0
00:16:59.760,00:17:01.920,It acts just like an ordinary wire.,0.3612
00:17:02.560,00:17:05.520,"Once it's charged up, no more current flows,",-0.4588
00:17:05.520,00:17:08.400,"but by this point, the next capacitor is charging up.",0.0
00:17:08.400,00:17:10.640,"And then the next one, and then the next one.",0.0
00:17:10.640,00:17:14.560,And so we have a loop of current that is expanding out,0.0
00:17:14.560,00:17:16.080,at roughly the speed of light.,0.0
00:17:16.720,00:17:18.560,"This is of course, just another way of talking",0.0
00:17:18.560,00:17:20.400,about the effect the electric field,0.0
00:17:20.400,00:17:22.640,that the bottom wire has on the top wire.,0.2023
00:17:23.280,00:17:25.760,"One reason it's useful to look at the circuit this way,",0.4404
00:17:25.760,00:17:28.240,is because you can use the values of inductance,0.4019
00:17:28.240,00:17:31.600,and capacitance to calculate the characteristic impedance,0.0
00:17:31.600,00:17:33.280,of the transmission lines.,0.0
00:17:33.280,00:17:35.040,You can think of this as the resistance,0.0
00:17:35.040,00:17:37.600,to alternating current that a source would see,0.0
00:17:37.600,00:17:39.360,when sending a signal down the wires.,0.0
00:17:39.920,00:17:42.800,The characteristic impedance is equal to the square root,0.0
00:17:42.800,00:17:45.520,of inductance divided by capacitance.,0.0
00:17:45.520,00:17:46.480,"And for our circuit,",0.0
00:17:46.480,00:17:51.040,"I measured the capacitance and the inductance of the lines,",0.0
00:17:51.040,00:17:53.360,"- 11.85, call it, micro Henry's.",0.0
00:17:53.360,00:17:57.520,- So we got a characteristic impedance of about 550 Ohms.,0.0
00:17:58.240,00:18:00.880,"To maximize the power delivered to our load,",0.0
00:18:00.880,00:18:03.760,we want its resistance to equal the sum of the other,0.0772
00:18:03.760,00:18:05.440,impedances in the circuit.,0.0
00:18:05.440,00:18:09.280,So that's why we picked a 1.1 kilo-Ohm resistor.,0.0
00:18:09.280,00:18:11.600,"Now, I hope you're convinced that current will flow",0.6808
00:18:11.600,00:18:14.160,as soon as the electric field reaches the far wire.,0.0516
00:18:14.160,00:18:16.080,"The question is, how much?",0.0
00:18:16.080,00:18:18.000,Are we gonna see an appreciable voltage,0.0
00:18:18.640,00:18:21.840,even with these lines a meter apart?,0.0
00:18:21.840,00:18:24.240,That's what it seemed like a lot of people were doubting,0.0258
00:18:24.880,00:18:25.760,in the last video.,0.0
00:18:25.760,00:18:27.840,So that's really what we want to find out here.,0.144
00:18:30.560,00:18:33.080,"Okay, so now we're putting a pulse in there.",0.2263
00:18:33.080,00:18:34.400,- Yep.,0.296
00:18:35.120,00:18:36.480,"Well looky, looky, Derek.",0.2732
00:18:37.080,00:18:40.080,- So what do we got that yellow one is our-,0.0
00:18:40.080,00:18:43.120,- Got a fraction of the applied voltage overshoot.,0.0
00:18:43.120,00:18:43.440,And then-,0.0
00:18:43.440,00:18:45.600,- So it looks to me like the initial voltage,0.3612
00:18:45.600,00:18:46.560,that we're getting is about-,0.0
00:18:46.560,00:18:47.920,- Five volts per division.,0.0
00:18:47.920,00:18:49.360,"So it looks like about five volts,",0.4144
00:18:50.080,00:18:51.280,roughly four or five volts.,0.0
00:18:51.280,00:18:54.800,- The green curve rising up to around 18 volts,0.0
00:18:54.800,00:18:56.160,is the source voltage.,0.0
00:18:56.160,00:18:59.360,And the yellow line is the voltage across the resistor.,0.0
00:18:59.360,00:19:01.280,"So after just a few nanoseconds,",0.0
00:19:01.280,00:19:04.240,this voltage rises to around four volts.,0.0
00:19:04.800,00:19:06.560,"Since the resistor was a kilo-Ohm,",0.0
00:19:06.560,00:19:08.800,that means four milliamps of current,0.0
00:19:08.800,00:19:10.080,"are flowing in the resistor,",0.0
00:19:10.080,00:19:12.880,before the signal goes all the way around the circuit.,0.0
00:19:12.880,00:19:16.240,So we were transferring about 14 milliwatts of power.,0.0
00:19:16.880,00:19:20.640,This is what 14 milliwatts of light actually looks like.,0.3612
00:19:20.640,00:19:22.560,"So, yeah, it's not a fully on bulb,",0.296
00:19:22.560,00:19:25.600,but it is visible light and way more than you would get,0.0
00:19:25.600,00:19:27.360,from just leakage current.,0.0
00:19:27.360,00:19:28.640,"Now, some of you may argue,",-0.34
00:19:28.640,00:19:32.320,it's unfair to use a little LED when I showed a bulb,-0.4767
00:19:32.320,00:19:34.320,"and car battery in the original video,",0.3182
00:19:34.880,00:19:37.840,but those items were for illustrative purposes only.,0.0
00:19:38.480,00:19:41.040,The clue that this is actually a thought experiment,0.0
00:19:41.040,00:19:44.240,is the two light-seconds of super conducting wire,0.5994
00:19:44.240,00:19:45.760,that stretch out into space.,0.0
00:19:46.400,00:19:49.440,This is not an engineering question about how best,0.6369
00:19:49.440,00:19:52.080,to wire up a light bulb in your bedroom.,0.0
00:19:52.080,00:19:54.160,The question was intentionally vague.,-0.1027
00:19:54.160,00:19:56.320,And if you want to choose circuit components,0.0772
00:19:56.320,00:19:58.160,"such that the bulb never goes on,",0.0
00:19:58.160,00:19:59.520,you are welcome to do that,0.4588
00:19:59.520,00:20:01.200,and I support your conclusion.,0.4019
00:20:01.760,00:20:03.600,"Just to me, the most interesting way",0.4576
00:20:03.600,00:20:04.960,"to approach this problem is to ask,",-0.481
00:20:05.520,00:20:07.920,how could you make the light go on fastest?,0.0
00:20:08.560,00:20:11.520,I was worried that those long wires would pick up,-0.296
00:20:11.520,00:20:14.000,"all the radio waves passing through,",0.0
00:20:14.000,00:20:15.760,and we wouldn't even be able to see,0.0
00:20:15.760,00:20:17.280,"the signal for that noise,",0.0
00:20:17.280,00:20:19.200,but you can see clearly on the graph,0.5499
00:20:19.200,00:20:22.400,that the signal is way above the noise level.,0.0
00:20:22.960,00:20:25.360,Alpha Phoenix set up a kilometer of wire,0.0
00:20:25.360,00:20:26.880,and got a very similar result.,0.0
00:20:26.880,00:20:30.320,"- So the light bulb turns on a little bit,",0.0
00:20:30.960,00:20:32.560,"and then after one light-speed delay,",-0.3182
00:20:32.560,00:20:34.280,the light bulb turns on the rest of the way.,0.0
00:20:34.280,00:20:38.240,"- YouTuber, ZY, simulated the transmission line circuit,",0.0
00:20:38.240,00:20:40.640,"and found that even with realistic assumptions,",0.0
00:20:40.640,00:20:43.600,he transferred 12 milliwatts to the load straight away.,0.2263
00:20:43.600,00:20:45.520,- Derek is actually more correct,0.0
00:20:45.520,00:20:46.560,than we give him credit for.,0.3818
00:20:46.560,00:20:48.240,"So, I believe that he's correct on all counts.",0.0
00:20:48.240,00:20:49.840,And the question is neither deceptive,0.0
00:20:49.840,00:20:51.360,or requires like technicalities.,0.3612
00:20:51.360,00:20:54.960,"- So everyone agrees that a steady, small,",0.2682
00:20:54.960,00:20:57.040,but way-bigger-than-leakage-current signal,0.0
00:20:57.040,00:20:59.200,flows through the load in the first second,0.0
00:20:59.200,00:21:01.040,after the switch is closed.,0.0
00:21:01.040,00:21:02.400,Is it enough to emit light?,0.0
00:21:03.200,00:21:05.200,"Yes, if you use an LED.",0.4019
00:21:05.920,00:21:07.840,But the point of the thought experiment,0.0
00:21:07.840,00:21:10.160,was to reveal something that's normally hidden,0.0
00:21:10.160,00:21:13.280,by the way that we think about and teach electric circuits.,0.0
00:21:13.280,00:21:16.160,"You know, we use voltage and current and lumped elements",0.0
00:21:16.160,00:21:17.840,because they're more convenient,0.0
00:21:17.840,00:21:20.080,"than working with Maxwell's equations,",0.0
00:21:20.080,00:21:23.040,but we shouldn't forget that the main actors,0.2498
00:21:23.040,00:21:24.640,are actually the fields.,0.0
00:21:25.200,00:21:26.960,"They are what carry the energy,",0.2732
00:21:27.680,00:21:29.680,and you don't have to take my word for it.,0.0
00:21:29.680,00:21:31.120,"This is Rick Hartley,",0.0
00:21:31.120,00:21:33.120,a veteran printed circuit board designer.,0.0
00:21:33.120,00:21:36.160,- I used to think in terms of voltage and current.,0.0
00:21:36.160,00:21:38.400,And I used to think that the energy in the circuit,0.2732
00:21:38.400,00:21:41.120,"was in the voltage and current, but it's not.",0.0
00:21:41.120,00:21:43.840,The energy in the circuit is in the fields.,0.2732
00:21:44.400,00:21:46.720,The most important thing you need to know,0.2716
00:21:47.280,00:21:49.040,"is that when you route a trace,",0.0
00:21:49.040,00:21:52.480,"you better define the other side of that transmission line,",0.4404
00:21:53.040,00:21:56.320,"because if you don't, those fields are gonna spread",0.0
00:21:56.320,00:21:59.280,and they're gonna leave you an unhappy individual.,-0.4588
00:21:59.280,00:22:02.640,- I think one of the things that I'm most excited,0.4005
00:22:02.640,00:22:05.600,about the circuit's video was the response videos,0.0
00:22:05.600,00:22:07.280,"I saw by so many people,",0.0
00:22:07.280,00:22:09.840,especially people with far better credentials,0.4404
00:22:09.840,00:22:11.840,in electrical engineering than me.,0.0
00:22:12.560,00:22:14.960,I really enjoyed watching those videos.,0.5563
00:22:14.960,00:22:18.160,"So I feel like my circuits video was kind of like,",0.6086
00:22:18.160,00:22:20.480,a mistake on my part in certain ways,-0.0772
00:22:20.480,00:22:22.160,that I didn't delve deep enough,0.0
00:22:22.160,00:22:23.920,into this part of the problem.,-0.4019
00:22:23.920,00:22:25.520,I honestly didn't think that this,0.4588
00:22:25.520,00:22:27.040,"was the focus of the video,",0.0
00:22:27.040,00:22:32.160,"but clearly everyone who watched it did, so that's on me,",0.5499
00:22:32.160,00:22:33.840,"but by making that mistake,",-0.4767
00:22:33.840,00:22:36.160,"and by not going deep into my explanation,",0.0
00:22:36.160,00:22:39.120,I invited seemingly a whole bunch of other people,0.0
00:22:39.120,00:22:41.120,"to make explanations, which I thought were great.",0.6249
00:22:41.120,00:22:43.760,And some people like Alpha Phoenix even took up,0.3612
00:22:43.760,00:22:47.040,the challenge and set up his own version of the experiment.,0.0772
00:22:47.680,00:22:52.800,"So, frankly, I'm just really excited at what came about,",0.4005
00:22:52.800,00:22:56.400,even though I do acknowledge that this was my fault,-0.4019
00:22:56.400,00:22:57.040,in the first place.,0.0
00:22:57.040,00:22:58.640,"Like I should have done a better explanation,",0.6597
00:22:59.920,00:23:01.280,"but by not doing so, you know,",0.0
00:23:01.920,00:23:03.600,there are a lot of great explanations out there.,0.6249
00:23:03.600,00:23:05.520,And that's what I love.,0.6369
00:23:05.520,00:23:06.880,So I'm gonna recommend a whole bunch,0.4144
00:23:06.880,00:23:08.720,of electrical engineering YouTubers to you,0.0
00:23:08.720,00:23:10.720,in case you wanna check those out,0.0
00:23:10.720,00:23:12.480,"because they're a lot of great channels,",0.6249
00:23:12.480,00:23:16.400,"and you should really see how they think about electronics,",0.0
00:23:16.400,00:23:21.840,and how they explain this circuit.,0.0
00:23:21.840,00:23:24.080,"Hey, this video was sponsored by Brilliant,",0.5859
00:23:24.080,00:23:26.080,the website and app that gets you thinking deeply,0.0
00:23:26.080,00:23:29.200,"about concepts in math, science, and computer science.",0.0
00:23:29.200,00:23:31.440,"Brilliant is sponsoring a lot of our videos this year,",0.5859
00:23:31.440,00:23:33.600,because they know someone who makes it to the end,0.0
00:23:33.600,00:23:36.480,of a Veritasium video is exactly the sort of person,0.0
00:23:36.480,00:23:38.160,who would love to learn with Brilliant.,0.8402
00:23:38.160,00:23:40.640,"And they have a great course on electricity and magnetism,",0.6249
00:23:40.640,00:23:42.720,which methodically steps you through an introduction,0.0
00:23:42.720,00:23:47.200,"to E&amp;M with questions, simulations, videos, and experiments.",0.0
00:23:47.200,00:23:49.120,I really think this is the best way to learn,0.6369
00:23:49.120,00:23:51.920,because the sequence of steps is so well thought out.,0.4101
00:23:51.920,00:23:53.600,The difficulty builds gradually.,-0.34
00:23:53.600,00:23:55.200,"And by asking you questions,",0.0
00:23:55.200,00:23:58.080,you are forced to check your understanding at each step.,-0.4588
00:23:58.080,00:23:58.800,"If you need help,",0.4019
00:23:58.800,00:24:01.280,there's always a useful hint or explanation.,0.4404
00:24:01.280,00:24:04.560,You know what sets Brilliant apart is their interactivity.,0.5859
00:24:04.560,00:24:06.480,You can learn calculus or machine learning,0.0
00:24:06.480,00:24:08.080,or computer science fundamentals,0.0
00:24:08.080,00:24:10.240,all in this very active way.,0.4576
00:24:10.240,00:24:13.680,So I encourage you to go over to brilliant.org/veritasium,0.5542
00:24:13.680,00:24:15.680,and just take a look at their courses.,0.0
00:24:15.680,00:24:18.000,I will put that link down in the description.,0.0
00:24:18.000,00:24:19.440,"And if you click through right now,",0.0
00:24:19.440,00:24:21.120,Brilliant are offering 20% off,0.5859
00:24:21.120,00:24:22.640,an annual premium subscription,0.0
00:24:22.640,00:24:24.800,to the first 200 people to sign up.,0.0
00:24:24.800,00:24:27.760,So I want to thank Brilliant for supporting Veritasium.,0.8683
00:24:27.760,00:24:29.840,And I wanna thank you for watching.,0.3612
