Start Time,End Time,Text,sentiment-score
00:00:00.000,00:00:03.180,I am about to get buried in concrete.,0.0
00:00:03.180,00:00:04.410,"And while that's happening,",0.0
00:00:04.410,00:00:07.410,I'm going to explain everything you need to know,0.0
00:00:07.410,00:00:09.360,about this substance.,0.0
00:00:09.360,00:00:11.970,So the first thing that I want to clear up is the difference,0.4404
00:00:11.970,00:00:13.920,"between cement and concrete,",0.0
00:00:13.920,00:00:15.870,"because people often mix these up, okay?",0.2263
00:00:15.870,00:00:17.820,Cement is like the glue.,0.3612
00:00:17.820,00:00:20.280,It's the matrix of stuff.,0.0
00:00:20.280,00:00:21.810,"Oh there, I feel it.",0.0
00:00:21.810,00:00:23.850,"Okay, that feels good.",0.5859
00:00:23.850,00:00:27.570,"Now concrete is cement plus aggregate,",0.0
00:00:27.570,00:00:30.060,so plus gravel and sand.,-0.197
00:00:30.060,00:00:33.810,And this is filling up really rather quickly.,0.0
00:00:33.810,00:00:36.840,Cement is the most important man-made substance,0.2716
00:00:36.840,00:00:37.890,on the planet.,0.0
00:00:37.890,00:00:42.360,We use more of it than any other substance apart from water.,0.0
00:00:42.360,00:00:46.800,"Every year, 500 kilograms of cement are created",0.25
00:00:46.800,00:00:49.890,"for every man, woman, and child on earth.",0.0
00:00:49.890,00:00:53.700,And that amount of cement can make two cubic meters,0.0
00:00:53.700,00:00:58.233,"of concrete, which is about two of these big fishbowls.",0.0
00:00:59.160,00:01:00.993,This video is sponsored by Wren.,0.0
00:01:01.920,00:01:04.710,I don't think people realize just how important concrete is.,0.2023
00:01:04.710,00:01:07.020,So here's another way to think about it.,0.0
00:01:07.020,00:01:10.650,"Every year, we make a certain weight of goods out of copper,",0.2732
00:01:10.650,00:01:12.360,"more out of aluminum,",0.0
00:01:12.360,00:01:16.110,"and then you have glass, asphalt, lime,",0.0
00:01:16.110,00:01:18.780,"iron is a big one for all the steel,",0.0
00:01:18.780,00:01:21.660,and then there's ceramic and wood.,0.0
00:01:21.660,00:01:24.600,"But by far, the solid product we make the most of,",0.2263
00:01:24.600,00:01:28.320,"is cementitious material, essentially cement.",0.0
00:01:28.320,00:01:33.320,We use as much of it as we do all other materials combined.,0.0
00:01:33.450,00:01:35.730,And it's easy to see why.,0.4404
00:01:35.730,00:01:38.040,Concrete is liquid rock.,0.0
00:01:38.040,00:01:40.770,You can pour it into any shape you like.,0.3612
00:01:40.770,00:01:43.920,It's strong and durable and inexpensive.,0.5106
00:01:43.920,00:01:45.870,And it is so easy to produce,0.5777
00:01:45.870,00:01:47.610,that people have been making a version of it,0.0
00:01:47.610,00:01:49.740,for thousands of years.,0.0
00:01:52.030,00:01:53.290,"To make primitive cement,",0.0
00:01:53.290,00:01:55.570,"the key ingredient is limestone,",0.0
00:01:55.570,00:01:57.610,which is basically calcium carbonate.,0.0
00:01:57.610,00:02:00.430,"If you heat it up to around 1,000 degrees Celsius,",0.0
00:02:00.430,00:02:03.280,"that drives off CO2 out of the rock,",0.0
00:02:03.280,00:02:07.180,"leaving calcium oxide, which is also known as quicklime.",0.0
00:02:07.180,00:02:10.930,"Now if you grind up the calcium oxide and mix it with water,",0.0
00:02:10.930,00:02:12.550,you get an exothermic reaction,0.0
00:02:12.550,00:02:14.830,"that creates calcium hydroxide,",0.2732
00:02:14.830,00:02:17.440,which you can pour into a mold.,0.0
00:02:17.440,00:02:21.400,"And over a time, it will absorb CO2 from the atmosphere,",0.0
00:02:21.400,00:02:26.400,turning back into calcium carbonate as the water evaporates.,0.0
00:02:26.620,00:02:28.420,"Now, that's a pretty good primitive cement.",0.7269
00:02:28.420,00:02:31.060,"It's the first way that people ever made cement,",0.0
00:02:31.060,00:02:32.860,but there are several drawbacks to it.,0.0
00:02:32.860,00:02:35.800,"I mean, for one thing, you can't make the molds very big",0.0
00:02:35.800,00:02:39.490,"because otherwise, CO2 can't penetrate all of the material",0.0
00:02:39.490,00:02:40.510,and harden it.,0.0
00:02:40.510,00:02:42.340,"Plus, it's not gonna work underwater",0.0
00:02:42.340,00:02:45.433,where there is no CO2 to harden your mixture.,-0.296
00:02:46.270,00:02:49.150,The Romans discovered the solution to these problems.,-0.1027
00:02:49.150,00:02:51.640,They added volcanic ash called pozzolana,0.0
00:02:51.640,00:02:54.100,to the crushed limestone before heating it up.,-0.4215
00:02:54.100,00:02:56.770,And they discovered this cement was much stronger,0.3818
00:02:56.770,00:02:58.390,and much more durable.,0.0
00:02:58.390,00:02:59.223,They used it,0.0
00:02:59.223,00:03:02.080,to create the largest unreinforced concrete dome,0.2732
00:03:02.080,00:03:07.080,"in the world, the Pantheon, which has stood for 2,000 years.",0.0
00:03:07.360,00:03:10.060,"And they built concrete piers into the sea,",0.0
00:03:10.060,00:03:12.130,which hardened underwater.,0.0
00:03:12.130,00:03:14.353,Some of which are still standing today.,0.0
00:03:15.850,00:03:18.460,"I did not expect it to feel this heavy,",0.0
00:03:18.460,00:03:20.410,like it's already really weighing down my feet,0.3612
00:03:20.410,00:03:21.580,and making me slightly concerned,0.0
00:03:21.580,00:03:23.770,about being able to get out.,0.0
00:03:23.770,00:03:27.700,What I can tell you is that concrete is about three times,0.0
00:03:27.700,00:03:29.830,as dense as water.,0.0
00:03:29.830,00:03:30.970,- Are you able to lift a leg?,0.0
00:03:30.970,00:03:31.803,I just wanna make sure,0.3182
00:03:31.803,00:03:33.220,that you're not gonna have like some suction.,-0.2755
00:03:33.220,00:03:35.050,"- Yeah, okay, I'm gonna try to lift a leg",0.4767
00:03:35.050,00:03:36.460,just to see how bad it's gonna be.,-0.5423
00:03:36.460,00:03:38.110,What I like is having my feet on the bottom,0.3612
00:03:38.110,00:03:39.550,and I'm not sure I can get them back down there,-0.2411
00:03:39.550,00:03:40.383,"after I lift it up,",0.0
00:03:40.383,00:03:41.500,"but oh, boy.",0.0
00:03:41.500,00:03:43.240,"Okay, so that was like...",0.5667
00:03:43.240,00:03:45.590,I'm gonna try to lifting this leg pretty slowly,0.4939
00:03:46.600,00:03:48.100,and I was able to lift it.,0.0
00:03:48.100,00:03:49.210,- Right.,0.0
00:03:49.210,00:03:51.940,"- So at least up to this point, I am able to get out.",0.0
00:03:51.940,00:03:54.040,My fear is that the concrete is so dense,-0.4939
00:03:54.040,00:03:55.510,"that when it gets up around my chest,",0.0
00:03:55.510,00:03:57.040,"it may apply a lot of pressure,",-0.296
00:03:57.040,00:03:57.873,making it hard to breathe.,-0.1027
00:03:57.873,00:03:59.890,Yeah. - It's like being in a trench,0.5719
00:03:59.890,00:04:01.387,and having it cave in on you.,0.0
00:04:01.387,00:04:04.240,"You cave in your lungs so you can't breathe,",0.0
00:04:04.240,00:04:05.470,so that once they contract,0.0
00:04:05.470,00:04:07.423,and the weight gets against your lungs.,0.0
00:04:08.350,00:04:09.220,- That's gonna be hard.,-0.1027
00:04:09.220,00:04:10.900,- Have you thought about that?,0.0
00:04:10.900,00:04:12.550,"- Well, now that you mention it.",0.2732
00:04:12.550,00:04:15.550,"But we do have oxygen on hand, just in case.",0.6486
00:04:15.550,00:04:18.190,"Earlier, I practiced how I could get out of the bowl",0.0
00:04:18.190,00:04:19.600,if I'm in trouble.,-0.4019
00:04:19.600,00:04:20.590,- Do you feel that's okay?,0.2263
00:04:20.590,00:04:21.541,- That's no problem.,0.3089
00:04:21.541,00:04:22.461,"- Okay, great.",0.7184
00:04:22.461,00:04:25.711,(truck signal beeping),0.0
00:04:31.630,00:04:34.510,So how did Roman concrete harden underwater?,0.0
00:04:34.510,00:04:38.593,And in thick slabs that CO2 couldn't possibly penetrate?,0.0
00:04:40.000,00:04:44.260,There is a claim that it was superior to modern concrete.,0.5423
00:04:44.260,00:04:45.523,"So, was it?",0.0
00:04:46.360,00:04:49.600,"For centuries, the Roman recipe was lost.",-0.3182
00:04:49.600,00:04:51.280,It was only discovered in a book,0.0
00:04:51.280,00:04:53.800,in a Swiss monastery in the 1400s.,0.0
00:04:53.800,00:04:56.260,"And since then, architects, scientists,",0.0
00:04:56.260,00:04:58.330,and engineers have been experimenting,0.0
00:04:58.330,00:05:00.340,with different cement recipes to try,0.0
00:05:00.340,00:05:02.470,to achieve the best result.,0.6369
00:05:02.470,00:05:05.230,"Now it turns out that that incredible strength,",0.5413
00:05:05.230,00:05:07.870,"durability, and ability to set underwater",0.3182
00:05:07.870,00:05:09.160,"of the Roman cement,",0.0
00:05:09.160,00:05:10.840,"that came from the pozzolana,",0.0
00:05:10.840,00:05:13.060,that volcanic ash that was added.,0.0
00:05:13.060,00:05:15.340,"And nearly 2,000 years later,",0.0
00:05:15.340,00:05:18.580,people discovered that adding clay or shale to the limestone,0.0
00:05:18.580,00:05:22.540,"before it was crushed and heated, produced the same effect.",-0.4215
00:05:22.540,00:05:26.080,And the reason is that all of these materials contain silica,0.0
00:05:26.080,00:05:30.190,and silica totally changes the chemistry of the cement.,0.0
00:05:30.190,00:05:34.030,It means that it doesn't need to dry in order to harden.,0.0
00:05:34.030,00:05:38.170,"In fact, the water becomes an integral part",0.0
00:05:38.170,00:05:39.850,of that hardened concrete,0.0
00:05:39.850,00:05:42.610,so that it actually achieves maximum strength,0.4939
00:05:42.610,00:05:44.473,when it sets underwater.,0.0
00:05:46.270,00:05:49.150,- So this is the compressive cylinder curing room.,0.0
00:05:49.150,00:05:51.910,We're required to maintain the concrete samples,0.0
00:05:51.910,00:05:53.050,in 100% humidity.,0.0
00:05:53.050,00:05:56.950,So we've chose to submerge them in water in a lime bath.,0.0
00:05:56.950,00:05:59.140,- Every time concrete suppliers pour concrete,0.0
00:05:59.140,00:06:00.250,"on a job site,",0.0
00:06:00.250,00:06:02.380,they cast sample cylinders of the material,0.0
00:06:02.380,00:06:03.640,so they can later test it,0.0
00:06:03.640,00:06:06.010,to ensure it has the strength required.,0.7003
00:06:06.010,00:06:07.570,- So we actually intercept a little bit,0.0
00:06:07.570,00:06:08.410,of the concrete going,0.0
00:06:08.410,00:06:09.880,into whatever structure they're pouring:,0.0
00:06:09.880,00:06:10.900,"a slab, a wall.",0.0
00:06:10.900,00:06:12.850,"We'll intercept it into a wheelbarrow,",0.0
00:06:12.850,00:06:14.770,"take the wheelbarrow over to our testing station,",0.0
00:06:14.770,00:06:17.350,and start casting these compressive cylinders.,0.0
00:06:17.350,00:06:18.910,"Every day we're breaking these cylinders,",0.0
00:06:18.910,00:06:19.930,checking it for strength.,0.4939
00:06:19.930,00:06:21.910,You can see these have been broken today.,-0.4767
00:06:21.910,00:06:24.100,"- This strength increases over time,",0.4939
00:06:24.100,00:06:28.480,"so samples are tested at 7, 14, and 28 days",0.0
00:06:28.480,00:06:31.480,when the concrete is said to have reached full strength.,0.5574
00:06:31.480,00:06:33.940,- So what we do is we list the date,0.0
00:06:33.940,00:06:35.950,that there will be placed in the compression machine,0.0
00:06:35.950,00:06:37.450,on top of every cylinder.,0.2023
00:06:37.450,00:06:39.970,"- In reality, it will continue strengthening",0.4939
00:06:39.970,00:06:40.843,after that.,0.0
00:06:42.790,00:06:45.160,Samples are placed in a hydraulic press,0.0
00:06:45.160,00:06:48.610,and then the pressure is increased on them until they fail.,-0.5574
00:06:48.610,00:06:49.443,"- All right, ready? - Yeah, let's do it.",0.5719
00:06:49.443,00:06:51.070,- I'll start loading. - Sure.,0.3182
00:06:51.070,00:06:53.650,- We want to maintain around 30 psi per second.,0.0772
00:06:53.650,00:06:55.570,- And it's important to load at that rate.,0.2023
00:06:55.570,00:06:56.890,"- Yeah, you don't want to shock it.",0.4874
00:06:56.890,00:06:57.760,You don't want to shock it,0.2411
00:06:57.760,00:06:59.890,by applying too much load too fast.,0.0
00:06:59.890,00:07:01.901,This middle number is showing us our strength,0.5423
00:07:01.901,00:07:04.150,in pounds per square inch.,0.0
00:07:04.150,00:07:05.080,"And then the top number,",0.2732
00:07:05.080,00:07:06.940,the big number is showing us the force,0.0772
00:07:06.940,00:07:08.260,of pounds we're applying.,0.0
00:07:08.260,00:07:10.413,"- What are we gonna get up to, like 7,000 psi?",0.3612
00:07:10.413,00:07:11.246,"- 10,000.",0.0
00:07:11.246,00:07:12.400,"- 10,000.",0.0
00:07:12.400,00:07:13.780,So this is gonna be really strong.,0.5563
00:07:13.780,00:07:14.770,- Very strong.,0.5563
00:07:14.770,00:07:15.730,- Okay. - Yeah.,0.4767
00:07:15.730,00:07:16.840,- It's always fun when we get something,0.5106
00:07:16.840,00:07:19.960,"over 10,000 in a free show.",0.5106
00:07:19.960,00:07:20.793,Bang!,0.0
00:07:20.793,00:07:22.680,- It'll shake this room.,-0.1779
00:07:22.680,00:07:24.393,- And it has reinforced concrete walls.,0.0
00:07:27.040,00:07:31.960,- It's amazingly just like you can't see anything happening,0.4173
00:07:31.960,00:07:33.613,even under all that pressure.,-0.296
00:07:34.450,00:07:35.786,- It's still holding.,0.0
00:07:35.786,00:07:36.877,"- I know, right?",0.0
00:07:36.877,00:07:37.710,"- Oh, here it goes.",0.0
00:07:37.710,00:07:38.543,- It's starting to dry. - Really?,0.0
00:07:38.543,00:07:39.830,"- Here it goes. - 11,000.",0.0
00:07:39.830,00:07:40.663,- Mm-hmm.,0.0
00:07:41.890,00:07:43.543,"- Over 11,000 now.",0.0
00:07:45.091,00:07:47.170,(cement cylinder pops),0.0
00:07:47.170,00:07:48.689,Oh yeah!,0.3595
00:07:48.689,00:07:49.522,- It still got a life.,0.0
00:07:49.522,00:07:51.539,"Having it, it didn't even- - Fun.",-0.4023
00:07:51.539,00:07:52.453,(Derek laughs),0.4939
00:07:52.453,00:07:53.762,- It's my favorite part.,0.4588
00:07:53.762,00:07:57.095,(cement cylinder blows),0.0
00:07:59.722,00:08:01.719,"- Yeah, that's cool!",0.5848
00:08:01.719,00:08:02.863,"- Let's see. - Yeah, I like that.",0.5719
00:08:02.863,00:08:05.230,- Like the strongest concrete in the world.,0.6597
00:08:05.230,00:08:06.063,"- Well, the strongest concrete",0.6124
00:08:06.063,00:08:08.980,in the world is gonna be like a lab-only thing.,0.3612
00:08:08.980,00:08:13.210,"- In a competition, it was above 100,000 psi.",0.0
00:08:13.210,00:08:15.250,"- Today, virtually all concrete is made",0.0
00:08:15.250,00:08:17.950,with a cement formulation discovered in the 1840s.,0.0
00:08:17.950,00:08:20.110,"It's known as Portland cement,",0.0
00:08:20.110,00:08:22.690,but the name is really just a marketing term.,0.0
00:08:22.690,00:08:24.910,"You know, they claimed that the gray color",0.0
00:08:24.910,00:08:28.540,"of the cement would resemble these very desirable rocks,",0.3804
00:08:28.540,00:08:32.050,"which were quarried near the town of Portland, England.",0.0
00:08:32.050,00:08:35.620,But the Portland cement was made by crushing up limestone,-0.5023
00:08:35.620,00:08:37.720,and then mixing it with a certain percentage,0.2732
00:08:37.720,00:08:40.900,of shale or clay to provide the silicates.,0.0
00:08:40.900,00:08:43.450,And that was all ground up into a fine powder,0.2023
00:08:43.450,00:08:46.990,and put in a kiln and heated to very high temperatures.,0.0
00:08:46.990,00:08:51.340,And what comes out are these nodules that are really hard.,-0.1761
00:08:51.340,00:08:52.870,They're called clinker.,0.0
00:08:52.870,00:08:54.490,"Now, it's suspected that cement chemists",-0.2263
00:08:54.490,00:08:56.980,in the past may have produced clinker by accident,-0.4767
00:08:56.980,00:08:59.530,when they overcooked their lime mixtures.,0.0
00:08:59.530,00:09:03.070,"But since this clinker is so hard to grind down,",-0.3181
00:09:03.070,00:09:05.380,they just considered it waste.,-0.4215
00:09:05.380,00:09:07.120,"But if you do grind it down,",0.0
00:09:07.120,00:09:10.210,the cement that it produces is far superior,0.5423
00:09:10.210,00:09:12.970,"to basically any other chemistry we've discovered,",0.0
00:09:12.970,00:09:15.820,which is why it is so commonly used today.,0.0
00:09:15.820,00:09:18.910,Now there are lots of compounds inside Portland cement.,0.0
00:09:18.910,00:09:22.333,The most common one is tricalcium silicate.,0.0
00:09:23.590,00:09:26.500,"I'm now feeling incredibly buoyant,",0.4005
00:09:26.500,00:09:29.020,"like I am now floating in concrete,",0.3612
00:09:29.020,00:09:30.220,which is pretty ridiculous,0.1779
00:09:30.220,00:09:33.790,because most of my body is out of the material.,0.0
00:09:33.790,00:09:36.160,"But because it's three times as dense as water,",0.0
00:09:36.160,00:09:39.250,you can float just up to your waist.,0.0
00:09:39.250,00:09:40.750,This is totally unexpected.,0.0
00:09:40.750,00:09:43.960,"I did not expect to be able to, like, float in concrete.",0.3612
00:09:43.960,00:09:45.250,My feet are off the floor.,0.0
00:09:45.250,00:09:47.337,That's where my feet are.,0.0
00:09:47.337,00:09:48.880,- My feet are here and my shoulders are up,0.0
00:09:48.880,00:09:52.780,and I'm just being pushed up out of this.,0.0
00:09:52.780,00:09:54.340,"Once you have the cement powder,",0.0
00:09:54.340,00:09:55.960,the other things you need to make concrete,0.0
00:09:55.960,00:09:58.714,"are the aggregates, sand, and gravel.",-0.128
00:09:58.714,00:10:00.730,(quarry blasting),0.0
00:10:00.730,00:10:03.043,These are blasted out of a quarry.,0.0
00:10:04.600,00:10:07.690,Then they're ground up to be particular sizes.,0.0
00:10:07.690,00:10:10.000,There are very strict requirements about the sizes,0.0
00:10:10.000,00:10:11.830,"and shapes of the aggregate,",0.0
00:10:11.830,00:10:13.210,which is gonna get poured into the concrete,0.0
00:10:13.210,00:10:16.240,"because, of course, that will affect the strength",0.4939
00:10:16.240,00:10:17.770,of the concrete that results.,0.0
00:10:17.770,00:10:21.880,"- Yeah, this is a just a well-grated concrete sand.",0.296
00:10:21.880,00:10:24.790,The most well-rounded material helps the contractor,0.4336
00:10:24.790,00:10:27.333,as far as their finishability goes.,0.0
00:10:27.333,00:10:28.840,"- You know when they're running that trowel over that slab,",0.0
00:10:28.840,00:10:30.490,"they want a rounded particle,",0.0772
00:10:30.490,00:10:32.410,not a jagged crushed particle.,0.3252
00:10:32.410,00:10:34.660,- Do you really want like a spherical sand?,0.5222
00:10:34.660,00:10:35.493,"- Around it, yeah,",0.296
00:10:35.493,00:10:36.326,"a spherical sand,",0.0
00:10:36.326,00:10:37.930,"like a river stone,",0.3612
00:10:37.930,00:10:39.490,like a river sand.,0.3612
00:10:39.490,00:10:42.520,Designers on the strip want to pour concrete elevated.,0.0772
00:10:42.520,00:10:44.980,They want to lighten up the load of the deck.,0.0772
00:10:44.980,00:10:47.080,We'll incorporate some lightweight aggregate,0.0
00:10:47.080,00:10:48.642,in place of this normal weight.,0.0
00:10:48.642,00:10:51.250,(rocks rattling),0.0
00:10:51.250,00:10:52.330,3/8 size.,0.0
00:10:52.330,00:10:55.360,"Typical concrete will weigh 150 pounds per cubic foot,",0.0
00:10:55.360,00:10:56.260,normal weight.,0.0
00:10:56.260,00:11:00.010,This gets us about 110 pounds per cubic foot.,0.0
00:11:06.430,00:11:08.380,- The aggregates are hauled to the concrete plant,0.0
00:11:08.380,00:11:09.370,in big trucks.,0.0
00:11:09.370,00:11:10.990,"All right, I'm gonna release the rock,",0.0
00:11:10.990,00:11:13.300,(hydraulics hissing),0.0
00:11:13.300,00:11:14.301,where they're dumped,-0.4019
00:11:14.301,00:11:17.800,(rocks rattling),0.0
00:11:17.800,00:11:18.670,and then they travel,0.0
00:11:18.670,00:11:22.240,on big conveyor belts up into storage piles.,0.0
00:11:22.240,00:11:24.490,These get loaded into big hoppers,0.0
00:11:24.490,00:11:27.340,and then weighed out and poured into the trucks.,0.0
00:11:27.340,00:11:29.230,- Control operators can open this gate,0.0
00:11:29.230,00:11:31.810,"and drop material into this hopper,",-0.2732
00:11:31.810,00:11:33.943,down into the mixer truck below.,0.0
00:11:35.590,00:11:38.743,This is where the batch operator's controlling the plant.,0.0
00:11:40.480,00:11:42.760,"Right here in front of our batch operator, William,",0.0
00:11:42.760,00:11:45.280,is the actual recipe that he's gonna dispense,0.0
00:11:45.280,00:11:46.900,into the concrete mixer.,0.0
00:11:46.900,00:11:50.080,Each line represents a different component in the concrete.,0.0
00:11:50.080,00:11:52.270,That top one there is a 3/4 rock.,0.2023
00:11:52.270,00:11:54.370,We have an intermediate 3/8 rock below it,0.0
00:11:54.370,00:11:55.360,and there's your sand.,0.0
00:11:55.360,00:11:57.070,"Over here in this column,",0.0
00:11:57.070,00:11:59.650,"he's targeting, for instance, 3/4 rock.",0.0
00:11:59.650,00:12:04.480,"He wants to hit 13,000 pounds of material for that load.",0.0
00:12:04.480,00:12:09.373,"The computer's gonna try to hit 13,042 pounds of 3/4 rock.",0.0
00:12:11.680,00:12:13.090,- So everything's...,0.0
00:12:13.090,00:12:13.955,- Everything's weighed up-,0.0
00:12:13.955,00:12:14.943,- Filling up? - Right now.,0.0
00:12:15.880,00:12:17.230,- Now if he goes out tolerance,0.296
00:12:17.230,00:12:18.460,"and he overshoots a target,",0.0
00:12:18.460,00:12:19.990,"it's gonna change the red,",0.0
00:12:19.990,00:12:20.863,a red color.,0.0
00:12:21.790,00:12:22.870,"Up here on this screen,",0.0
00:12:22.870,00:12:25.060,we're actually showing the holding hopper.,0.0
00:12:25.060,00:12:27.310,This material he's weighing is directly,0.0
00:12:27.310,00:12:30.060,above the mixer truck that just pulled under the plant.,0.0
00:12:31.240,00:12:33.100,"- What about the water, William,",0.0
00:12:33.100,00:12:34.510,being orange?,0.0
00:12:34.510,00:12:35.864,"- Yeah, we're a little under on that.",0.296
00:12:35.864,00:12:36.697,- Okay.,0.2263
00:12:36.697,00:12:38.770,- But we can always add little water.,0.0
00:12:38.770,00:12:39.603,- Yeah.,0.296
00:12:39.603,00:12:40.660,- We cannot take it away.,0.0
00:12:42.640,00:12:45.720,"All right, I'm gonna take a look inside the truck here.",0.0
00:12:45.720,00:12:48.340,(rotary gears whining),-0.2263
00:12:48.340,00:12:52.063,That's what it looks like down inside a cement truck.,0.3612
00:12:53.110,00:12:55.390,So I was interested to see what would be the difference,0.4522
00:12:55.390,00:12:58.750,"in strength between pure cement, cement with sand,",0.4939
00:12:58.750,00:13:00.550,and cement with sand and gravel,-0.128
00:13:00.550,00:13:02.740,like the typical concrete mix that they would make.,0.3612
00:13:02.740,00:13:04.930,So I had them make up these special cylinders,0.4019
00:13:04.930,00:13:07.000,and test them in the hydraulic press.,0.0
00:13:07.000,00:13:09.910,"You might think that since pure cement has the most glue,",0.0
00:13:09.910,00:13:11.230,it would be the strongest.,0.4404
00:13:11.230,00:13:13.210,"- Cement's the magic, right?",0.0
00:13:13.210,00:13:14.260,The glue.,0.0
00:13:14.260,00:13:15.490,So if we lessen,0.0
00:13:15.490,00:13:18.070,"or lower the amount of cement per unit volume,",-0.296
00:13:18.070,00:13:19.450,we're gonna have less strength.,0.4417
00:13:19.450,00:13:21.550,"- [Derek] But when we tested the pure cement cylinder,",0.0
00:13:21.550,00:13:24.029,it fractured a lot as the load was applied.,0.0
00:13:24.029,00:13:25.390,(cement cylinder pops),0.0
00:13:25.390,00:13:26.320,Is that it?,0.0
00:13:26.320,00:13:27.153,- No.,0.0
00:13:27.153,00:13:28.390,- Not officially. - Looks like it keep going.,0.3612
00:13:28.390,00:13:29.650,It can take some more pressure.,-0.3597
00:13:29.650,00:13:30.493,What?,0.0
00:13:30.493,00:13:31.630,(cement cylinder pops),0.0
00:13:31.630,00:13:32.770,"- 8,000 psi,",0.0
00:13:32.770,00:13:33.613,now it failed.,-0.5106
00:13:34.570,00:13:36.553,"- Now, cement plus sand.",0.0
00:13:37.389,00:13:40.600,(cement cylinder blows),0.0
00:13:40.600,00:13:43.303,"9,163 psi - Again.",0.0
00:13:43.303,00:13:44.470,Edit the prediction.,0.0
00:13:44.470,00:13:45.760,"Oh, my prediction was based",0.0
00:13:45.760,00:13:49.120,"on the strength it was two weeks ago,",0.4939
00:13:49.120,00:13:51.250,which we have here.,0.0
00:13:51.250,00:13:53.530,"We got 14 days of 6,600.",0.0
00:13:53.530,00:13:55.810,"So, you know, reason would be it'd probably break",0.0
00:13:55.810,00:13:57.310,"another 1000 psi above that,",0.0
00:13:57.310,00:13:59.440,but it definitely gained a lot.,0.7876
00:13:59.440,00:14:02.200,"- And finally, cement plus sand and gravel.",-0.128
00:14:02.200,00:14:04.033,This is the normal concrete mix.,0.0
00:14:04.964,00:14:06.159,(cement cylinder pops),0.0
00:14:06.159,00:14:07.090,Is that it?,0.0
00:14:07.090,00:14:08.466,No?,0.0
00:14:08.466,00:14:09.516,- A part of it.,0.0
00:14:10.917,00:14:11.860,(glass shatters),0.0
00:14:11.860,00:14:12.693,- Whoa!,0.0
00:14:13.720,00:14:14.553,"Okay, so that's it.",0.2263
00:14:14.553,00:14:15.877,- That's it. - We'll take it.,0.0
00:14:15.877,00:14:16.912,- That's it.,0.0
00:14:16.912,00:14:20.245,(cement cylinder blows),0.0
00:14:21.390,00:14:23.683,"- So it did fail at 8,300.",-0.5809
00:14:25.210,00:14:26.200,Okay.,0.2263
00:14:26.200,00:14:28.630,I was surprised to see that all the cylinders broke,-0.2263
00:14:28.630,00:14:30.010,under about the same pressure.,-0.296
00:14:30.010,00:14:31.480,"I think, to me, really interesting",0.4576
00:14:31.480,00:14:34.870,"that you could have all of that cement, right?",0.0
00:14:34.870,00:14:36.820,But you don't get appreciably...,0.0
00:14:36.820,00:14:39.130,- Right. - Stronger than like this,0.6249
00:14:39.130,00:14:40.750,or that.,0.0
00:14:40.750,00:14:43.570,Cement is the most expensive part of concrete.,0.0
00:14:43.570,00:14:45.430,So if you can get away with reducing it down,0.0
00:14:45.430,00:14:46.540,to 30% in the mix,0.0
00:14:46.540,00:14:48.700,"and still get the same strength characteristics,",0.4939
00:14:48.700,00:14:51.160,well then you should definitely do that.,0.5859
