Start Time,End Time,Text,Date
00:19:36.480,00:19:41.520,"Hey, this video is sponsored by Kiwico, which makes awesome hands on projects for kids.",2021-03-31
00:19:41.520,00:19:45.760,And I've actually been using their subscription crates with my kids for over a year now. So,2021-03-31
00:19:45.760,00:19:50.080,"I wanted to reflect on some of the things I really enjoy about them. First of all, my",2021-03-31
00:19:50.080,00:19:54.720,"kids want to do these projects with me. When a crate arrives, they're excited to crack",2021-03-31
00:19:54.720,00:19:59.280,it open and start making and you can do exactly that because everything you need comes right,2021-03-31
00:19:59.280,00:20:00.160,in the box.,2021-03-31
00:20:00.160,00:20:04.560,now my kids are still pretty young but Kiwico has eight different subscription lines targeted,2021-03-31
00:20:04.560,00:20:09.280,at different age groups all the way down to newborns when i was filming for this sponsor,2021-03-31
00:20:09.280,00:20:15.360,segment my four year old completely unprompted proposed doing an experiment “I wonder what,2021-03-31
00:20:15.360,00:20:23.040,we could do… We could do an experiment with this. We could try pushing it and letting,2021-03-31
00:20:23.040,00:20:23.360,it go”,2021-03-31
00:20:23.920,00:20:25.200,that's a good idea let's try it,2021-03-31
00:20:28.640,00:20:33.600,i was so proud that he came up with that all by himself and i want him to keep thinking,2021-03-31
00:20:33.600,00:20:39.040,like this considering the what ifs and asking bigger questions a Kiwico crate is like a,2021-03-31
00:20:39.040,00:20:44.560,thought starter in a box plus it is time to connect have fun and be entertained for hours,2021-03-31
00:20:44.560,00:20:48.240,so if you want to try it out go to Kiwico dot com slash veritasium 50 and you'll get,2021-03-31
00:20:48.240,00:20:53.200,50% off your first month of any crate i'll put that link down in the description so i,2021-03-31
00:20:53.200,00:20:57.280,want to thank Kiwico for sponsoring veritasium and i want to thank you for watching,2021-03-31
