Start Time,End Time,Text,Date
00:00:00.060,00:00:03.420,"There is a riddle that is so counterintuitive,",2022-06-30
00:00:03.420,00:00:06.210,it still seems wrong even if you know the answer.,2022-06-30
00:00:06.210,00:00:08.700,- You'd think it's an almost impossible number.,2022-06-30
00:00:08.700,00:00:11.010,- I feel like you probably hit me with some truth bomb.,2022-06-30
00:00:11.010,00:00:13.080,"- I mean, if you're trying to create controversy",2022-06-30
00:00:13.080,00:00:14.640,"and you're trying to confuse people,",2022-06-30
00:00:14.640,00:00:15.801,you're gonna succeed.,2022-06-30
00:00:15.801,00:00:17.370,(both laughs),2022-06-30
00:00:17.370,00:00:19.410,"- There are a bunch of YouTube videos about it,",2022-06-30
00:00:19.410,00:00:23.310,but I find all of them either incorrect or incomplete.,2022-06-30
00:00:23.310,00:00:25.890,"So in this video, I'm going to dive deeper",2022-06-30
00:00:25.890,00:00:27.600,and explain it fully.,2022-06-30
00:00:27.600,00:00:29.313,Here is the setup.,2022-06-30
00:00:33.357,00:00:35.520,(suspenseful music),2022-06-30
00:00:35.520,00:00:39.390,Say there are 100 prisoners numbered 1 to 100.,2022-06-30
00:00:39.390,00:00:41.670,Slips of paper containing each of their numbers,2022-06-30
00:00:41.670,00:00:46.290,are randomly placed in 100 boxes in a sealed room.,2022-06-30
00:00:46.290,00:00:49.290,"One at a time, each prisoner is allowed to enter the room",2022-06-30
00:00:49.290,00:00:52.260,"and open any 50 of the 100 boxes,",2022-06-30
00:00:52.260,00:00:54.000,searching for their number.,2022-06-30
00:00:54.000,00:00:56.190,"And afterwards, they must leave the room",2022-06-30
00:00:56.190,00:00:57.810,"exactly as they found it,",2022-06-30
00:00:57.810,00:00:59.820,and they can't communicate in any way,2022-06-30
00:00:59.820,00:01:01.770,with the other prisoners.,2022-06-30
00:01:01.770,00:01:04.710,If all 100 prisoners find their own number,2022-06-30
00:01:04.710,00:01:06.180,"during their turn in the room,",2022-06-30
00:01:06.180,00:01:08.400,they will all be freed.,2022-06-30
00:01:08.400,00:01:11.220,"But if even one of them fails to find their number,",2022-06-30
00:01:11.220,00:01:13.770,they will all be executed.,2022-06-30
00:01:13.770,00:01:16.470,The prisoners are allowed to strategize,2022-06-30
00:01:16.470,00:01:19.020,before any of them goes into the room.,2022-06-30
00:01:19.020,00:01:22.020,So what is their best strategy?,2022-06-30
00:01:22.020,00:01:24.660,"If they each search for their own number randomly,",2022-06-30
00:01:24.660,00:01:27.960,then each prisoner has a 50% chance of finding it.,2022-06-30
00:01:27.960,00:01:31.470,So the probability that all 100 prisoners find their numbers,2022-06-30
00:01:31.470,00:01:35.670,is 1/2 times 1/2 times 1/2 a hundred times,2022-06-30
00:01:35.670,00:01:38.250,or 1/2 to the power of 100.,2022-06-30
00:01:38.250,00:01:41.480,"This is equal to 0.00000000 30 zeros,",2022-06-30
00:01:44.310,00:01:46.290,and then an eight.,2022-06-30
00:01:46.290,00:01:48.930,"To put this probability into perspective,",2022-06-30
00:01:48.930,00:01:51.450,two people have a better chance of picking out,2022-06-30
00:01:51.450,00:01:54.180,the same grain of sand from all,2022-06-30
00:01:54.180,00:01:56.910,the beaches and deserts on earth,2022-06-30
00:01:56.910,00:01:59.073,than by escaping this way.,2022-06-30
00:01:59.940,00:02:02.910,"But what have I told you that with the right strategy,",2022-06-30
00:02:02.910,00:02:06.840,there's a way to raise their chances to nearly one in three.,2022-06-30
00:02:06.840,00:02:08.910,It improves their odds of a random chance,2022-06-30
00:02:08.910,00:02:12.000,by nearly 30 orders of magnitude.,2022-06-30
00:02:12.000,00:02:14.490,That's like taking a millimeter and scaling it up,2022-06-30
00:02:14.490,00:02:17.133,to the diameter of the observable universe.,2022-06-30
00:02:19.830,00:02:23.010,- But they can only coordinate this strategy beforehand.,2022-06-30
00:02:23.010,00:02:23.843,- Correct?,2022-06-30
00:02:23.843,00:02:25.050,- Is this true?,2022-06-30
00:02:25.050,00:02:25.953,- Yes.,2022-06-30
00:02:27.720,00:02:28.553,- Teach me.,2022-06-30
00:02:29.700,00:02:32.070,- This is not a trick question.,2022-06-30
00:02:32.070,00:02:35.700,The solution just involves an incredible feature of math.,2022-06-30
00:02:35.700,00:02:38.460,So what is this mathematical strategy?,2022-06-30
00:02:38.460,00:02:40.230,"Well, if you don't already know the answer,",2022-06-30
00:02:40.230,00:02:43.623,feel free to pause the video here and try it for yourself.,2022-06-30
00:02:46.020,00:02:48.360,"And if you don't come up with it, don't worry,",2022-06-30
00:02:48.360,00:02:49.320,you're in good company.,2022-06-30
00:02:49.320,00:02:51.330,"Even the person who came up with this riddle,",2022-06-30
00:02:51.330,00:02:53.280,"computer scientist Peter Bro Miltersen,",2022-06-30
00:02:53.280,00:02:54.870,he didn't even think of this strategy,2022-06-30
00:02:54.870,00:02:57.330,until a colleague pointed it out.,2022-06-30
00:02:57.330,00:03:00.060,"Miltersen, ultimately published this problem in a paper",2022-06-30
00:03:00.060,00:03:02.370,where he generously left the solution,2022-06-30
00:03:02.370,00:03:04.353,as an exercise for the reader.,2022-06-30
00:03:05.790,00:03:08.880,So here is the solution.,2022-06-30
00:03:08.880,00:03:11.520,"Pretend you are one of the prisoners,",2022-06-30
00:03:11.520,00:03:13.170,"when you go into the room,",2022-06-30
00:03:13.170,00:03:16.170,"open the box with your number on it,",2022-06-30
00:03:16.170,00:03:19.170,"the number on the slip inside probably won't be yours,",2022-06-30
00:03:19.170,00:03:20.580,but that's okay.,2022-06-30
00:03:20.580,00:03:23.070,Go to the box with that number on it.,2022-06-30
00:03:23.070,00:03:24.360,"look at the number inside,",2022-06-30
00:03:24.360,00:03:27.810,"then go to the box with that number on it, and so on.",2022-06-30
00:03:27.810,00:03:31.440,Keep doing this until you find the slip with your number.,2022-06-30
00:03:31.440,00:03:32.790,"If you find your number,",2022-06-30
00:03:32.790,00:03:34.140,that essentially tells you,2022-06-30
00:03:34.140,00:03:36.390,to go back to the box where you started.,2022-06-30
00:03:36.390,00:03:39.990,It closes the loop of numbers you've been following.,2022-06-30
00:03:39.990,00:03:42.630,"But if you've found your number, then you're done.",2022-06-30
00:03:42.630,00:03:45.120,You can stop and leave the room.,2022-06-30
00:03:45.120,00:03:48.690,This simple strategy gives over a 30% chance,2022-06-30
00:03:48.690,00:03:51.660,that all the prisoners will find their number.,2022-06-30
00:03:51.660,00:03:53.730,- The entire pool has a 30...,2022-06-30
00:03:53.730,00:03:56.823,- Everyone can find their number 31% of the time.,2022-06-30
00:03:58.200,00:03:59.033,- What?,2022-06-30
00:04:00.630,00:04:02.133,- But how does it work?,2022-06-30
00:04:03.300,00:04:05.760,The first thing to notice is that all boxes,2022-06-30
00:04:05.760,00:04:07.653,become part of a closed loop.,2022-06-30
00:04:08.880,00:04:10.200,The simplest loop would be,2022-06-30
00:04:10.200,00:04:12.240,a box that contains its own number.,2022-06-30
00:04:12.240,00:04:14.730,"If you're prisoner number one and you go to box one,",2022-06-30
00:04:14.730,00:04:17.370,"it contains slip one, then you're done.",2022-06-30
00:04:17.370,00:04:20.580,"Your number was part of a loop of one,",2022-06-30
00:04:20.580,00:04:22.770,but you could also have a loop of two.,2022-06-30
00:04:22.770,00:04:24.810,Say box one points to box seven,2022-06-30
00:04:24.810,00:04:27.870,and box seven points back to box one.,2022-06-30
00:04:27.870,00:04:32.670,"Or you could have a loop of three, or four, or five,",2022-06-30
00:04:32.670,00:04:36.000,or any length all the way up to 100.,2022-06-30
00:04:36.000,00:04:37.800,The longest loop you could have would connect,2022-06-30
00:04:37.800,00:04:40.440,all the numbers in a single loop.,2022-06-30
00:04:40.440,00:04:43.110,"But more generally, any random arrangement",2022-06-30
00:04:43.110,00:04:44.520,of the slips in these boxes,2022-06-30
00:04:44.520,00:04:47.310,will result in a mixture of some shorter,2022-06-30
00:04:47.310,00:04:49.113,and some longer loops.,2022-06-30
00:04:50.220,00:04:52.740,"When you start with a box labeled with your number,",2022-06-30
00:04:52.740,00:04:54.930,you are guaranteed to be on the loop,2022-06-30
00:04:54.930,00:04:56.670,that includes your slip.,2022-06-30
00:04:56.670,00:04:58.590,So the thing that determines whether or not,2022-06-30
00:04:58.590,00:05:01.890,you find your slip is the length of the loop.,2022-06-30
00:05:01.890,00:05:04.440,"If your number is part of a loop that is shorter than 50,",2022-06-30
00:05:04.440,00:05:07.020,then you will definitely find your slip.,2022-06-30
00:05:07.020,00:05:10.050,"But if your number is part of a loop that is 51 or longer,",2022-06-30
00:05:10.050,00:05:11.520,you are in trouble.,2022-06-30
00:05:11.520,00:05:13.740,You won't find it before you've exhausted,2022-06-30
00:05:13.740,00:05:15.993,the 50 boxes you're allowed to search.,2022-06-30
00:05:17.280,00:05:19.710,"When you open the box labeled with your number,",2022-06-30
00:05:19.710,00:05:21.120,you are in fact starting,2022-06-30
00:05:21.120,00:05:23.970,at the farthest point on the loop from your slip.,2022-06-30
00:05:23.970,00:05:27.990,"You wanna know where is the slip that points to this box,",2022-06-30
00:05:27.990,00:05:30.450,"but to find it, you have to follow the loop of numbers",2022-06-30
00:05:30.450,00:05:32.820,all the way around to the end.,2022-06-30
00:05:32.820,00:05:35.520,That means if the prisoners follow this strategy,2022-06-30
00:05:35.520,00:05:37.440,"and the longest loop is 51,",2022-06-30
00:05:37.440,00:05:39.390,not just one or two prisoners,2022-06-30
00:05:39.390,00:05:40.890,"will fail to find their number,",2022-06-30
00:05:40.890,00:05:44.370,but all 51 on this loop won't make it.,2022-06-30
00:05:44.370,00:05:47.580,"They make it to the box just before the box with their slip,",2022-06-30
00:05:47.580,00:05:49.623,but they have to stop searching there.,2022-06-30
00:05:53.225,00:05:55.725,(both laughs),2022-06-30
00:05:57.180,00:06:00.390,So the probability that all of the prisoners succeed,2022-06-30
00:06:00.390,00:06:02.640,is just the probability that a random arrangement,2022-06-30
00:06:02.640,00:06:06.960,of a hundred numbers contains no loops longer than 50.,2022-06-30
00:06:06.960,00:06:09.180,Now I promised that this probability would come out,2022-06-30
00:06:09.180,00:06:10.710,"to around one in three,",2022-06-30
00:06:10.710,00:06:13.080,but how do we calculate it?,2022-06-30
00:06:13.080,00:06:16.080,"Well, imagine writing down all the different ways",2022-06-30
00:06:16.080,00:06:19.920,that you could connect 100 boxes to form a loop,2022-06-30
00:06:19.920,00:06:21.000,of length 100.,2022-06-30
00:06:21.000,00:06:24.180,"So you could have box one points to box two,",2022-06-30
00:06:24.180,00:06:28.110,"box two points to box three to box four, and so on,",2022-06-30
00:06:28.110,00:06:29.817,"all the way to 100,",2022-06-30
00:06:29.817,00:06:33.570,"and then box 100 would point back to box one,",2022-06-30
00:06:33.570,00:06:36.150,or you could have something random.,2022-06-30
00:06:36.150,00:06:40.620,"Box five points to box 99 to box 17 and so on,",2022-06-30
00:06:40.620,00:06:42.720,"and let's pick the last one,",2022-06-30
00:06:42.720,00:06:43.953,is 63.,2022-06-30
00:06:45.060,00:06:47.700,And box 63 points back to box five.,2022-06-30
00:06:47.700,00:06:51.600,So how many different arrangements of these a hundred boxes,2022-06-30
00:06:51.600,00:06:54.390,or permutations could you have?,2022-06-30
00:06:54.390,00:06:56.010,"Well, for the first box,",2022-06-30
00:06:56.010,00:06:59.430,I have 100 different boxes that I could choose from.,2022-06-30
00:06:59.430,00:07:02.610,"The second box, because I've already used one,",2022-06-30
00:07:02.610,00:07:05.100,"I can only pick from 99 boxes,",2022-06-30
00:07:05.100,00:07:08.910,"and the next one, I can pick from 98 boxes, and so on,",2022-06-30
00:07:08.910,00:07:10.800,down to the very last box.,2022-06-30
00:07:10.800,00:07:11.970,I don't really have a choice.,2022-06-30
00:07:11.970,00:07:16.200,There's only one box left I could put in the last position.,2022-06-30
00:07:16.200,00:07:18.270,So the total number of different permutations,2022-06-30
00:07:18.270,00:07:22.770,"would be 100 times 99, times 98, times 97,",2022-06-30
00:07:22.770,00:07:23.970,all the way down to one.,2022-06-30
00:07:23.970,00:07:27.690,That is just 100 factorial.,2022-06-30
00:07:27.690,00:07:31.440,There are 100 factorial different ways,2022-06-30
00:07:31.440,00:07:35.400,that you could create a loop of a hundred boxes.,2022-06-30
00:07:35.400,00:07:37.980,But what we can't forget,2022-06-30
00:07:37.980,00:07:40.890,is that these are not just lines of numbers.,2022-06-30
00:07:40.890,00:07:42.870,They are loops.,2022-06-30
00:07:42.870,00:07:46.590,So some of these lines that look different,2022-06-30
00:07:46.590,00:07:48.603,are actually the same loop.,2022-06-30
00:07:50.820,00:07:53.850,"For example, two, three, four, five, and so on",2022-06-30
00:07:53.850,00:07:55.500,up to 100 and then 1,2022-06-30
00:07:55.500,00:07:59.100,"is the same thing as 1, 2, 3, 4, 5 to 100.",2022-06-30
00:07:59.100,00:08:02.370,You can rearrange the way you write these numbers,2022-06-30
00:08:02.370,00:08:05.250,"a hundred different ways,",2022-06-30
00:08:05.250,00:08:08.640,but they all represent the same loop.,2022-06-30
00:08:08.640,00:08:12.840,So the total number of unique loops of length 100,2022-06-30
00:08:12.840,00:08:16.530,is 100 factorial divided by 100.,2022-06-30
00:08:16.530,00:08:20.190,So what is the probability that any,2022-06-30
00:08:20.190,00:08:22.680,random arrangement of 100 boxes,2022-06-30
00:08:22.680,00:08:24.990,will contain a loop of length 100?,2022-06-30
00:08:24.990,00:08:28.110,"Well, it's just equal to the number of unique such loops",2022-06-30
00:08:28.110,00:08:29.460,"that we just calculated,",2022-06-30
00:08:29.460,00:08:31.200,"100 factorial over 100,",2022-06-30
00:08:31.200,00:08:33.600,divided by the total number of ways,2022-06-30
00:08:33.600,00:08:36.330,"that you could put a hundred slips in 100 boxes,",2022-06-30
00:08:36.330,00:08:38.913,which is 100 factorial.,2022-06-30
00:08:39.840,00:08:43.290,So the answer is 1 over 100.,2022-06-30
00:08:43.290,00:08:46.920,So there is a 1% chance that a random arrangement of slips,2022-06-30
00:08:46.920,00:08:49.350,"results in a loop of length 100,",2022-06-30
00:08:49.350,00:08:51.600,and this is a general result.,2022-06-30
00:08:51.600,00:08:54.570,The probability that you get a loop of length 99,2022-06-30
00:08:54.570,00:08:56.067,is 1 over 99.,2022-06-30
00:08:57.315,00:08:59.883,The probability that you get a loop of length 98,2022-06-30
00:08:59.883,00:09:02.100,is 1 over 98.,2022-06-30
00:09:02.100,00:09:06.270,So the probability that there is a loop longer than 50,2022-06-30
00:09:06.270,00:09:07.900,is 1 over 51 plus 1 over 52,2022-06-30
00:09:09.125,00:09:12.210,"plus one over 53, et cetera.",2022-06-30
00:09:12.210,00:09:15.690,"Add all these up, and it equals .69.",2022-06-30
00:09:15.690,00:09:19.050,"There is a 69% chance of failure for the prisoners,",2022-06-30
00:09:19.050,00:09:21.780,meaning a 31% chance of success,2022-06-30
00:09:21.780,00:09:24.453,where the longest loop is 50 or shorter.,2022-06-30
00:09:27.810,00:09:29.970,- I still find it difficult to believe.,2022-06-30
00:09:29.970,00:09:32.100,- [Derek] This feels a bit like magic.,2022-06-30
00:09:32.100,00:09:33.750,"Using the loop strategy,",2022-06-30
00:09:33.750,00:09:36.330,all the prisoners are more likely to find their numbers,2022-06-30
00:09:36.330,00:09:39.810,than even just two prisoners choosing at random.,2022-06-30
00:09:39.810,00:09:41.880,"So using the loop strategy,",2022-06-30
00:09:41.880,00:09:44.640,what is the probability that each prisoner alone,2022-06-30
00:09:44.640,00:09:46.500,finds their number?,2022-06-30
00:09:46.500,00:09:49.350,It is still 50%.,2022-06-30
00:09:49.350,00:09:52.110,"Each prisoner can still only open half the boxes,",2022-06-30
00:09:52.110,00:09:54.813,"so their individual chance is still 1/2,",2022-06-30
00:09:55.950,00:09:57.300,but these probabilities,2022-06-30
00:09:57.300,00:10:00.450,are no longer independent of each other.,2022-06-30
00:10:00.450,00:10:03.960,Imagine running this experiment a thousand times over.,2022-06-30
00:10:03.960,00:10:05.910,"If everyone is guessing randomly,",2022-06-30
00:10:05.910,00:10:08.670,you'd expect that on most runs around 50 prisoners,2022-06-30
00:10:08.670,00:10:10.170,would find their number.,2022-06-30
00:10:10.170,00:10:12.630,"On lucky runs, the number would be a bit higher,",2022-06-30
00:10:12.630,00:10:14.880,"on unlucky runs, a bit lower.",2022-06-30
00:10:14.880,00:10:17.070,"But using the loop strategy,",2022-06-30
00:10:17.070,00:10:19.380,all of the prisoners would find their numbers,2022-06-30
00:10:19.380,00:10:21.570,31% of the time.,2022-06-30
00:10:21.570,00:10:26.570,"And 69% of the time, fewer than 50 find their number.",2022-06-30
00:10:26.610,00:10:28.680,The prisoners all win together,2022-06-30
00:10:28.680,00:10:31.500,or the majority loses together.,2022-06-30
00:10:31.500,00:10:33.663,That's how this strategy works.,2022-06-30
00:10:35.340,00:10:38.070,- Why are you assuming that your number will always be,2022-06-30
00:10:38.070,00:10:39.390,on the loop that you're on?,2022-06-30
00:10:39.390,00:10:40.830,- I feel like- - I don't understand that.,2022-06-30
00:10:40.830,00:10:42.360,"- This is a key question, right?",2022-06-30
00:10:42.360,00:10:45.780,- 'Cause I feel like it's possible to start,2022-06-30
00:10:45.780,00:10:47.610,and go on a complete loop,2022-06-30
00:10:47.610,00:10:50.400,and not come back to your own number,2022-06-30
00:10:50.400,00:10:52.680,because you got on the wrong loop,2022-06-30
00:10:52.680,00:10:54.330,"and then you'd have to get on another loop,",2022-06-30
00:10:54.330,00:10:56.569,so I don't know that I'd buy this.,2022-06-30
00:10:56.569,00:10:58.500,"- Right, right, right, right, right, right.",2022-06-30
00:10:58.500,00:11:01.170,"Now, the big question everyone asks is",2022-06-30
00:11:01.170,00:11:02.970,how do you know that if you start,2022-06-30
00:11:02.970,00:11:04.860,with a box with your number on it,2022-06-30
00:11:04.860,00:11:07.500,you are guaranteed to be on the loop,2022-06-30
00:11:07.500,00:11:09.690,that contains your slip?,2022-06-30
00:11:09.690,00:11:11.340,"Well, if you think about it,",2022-06-30
00:11:11.340,00:11:15.660,"the slip that says 73, if anyone sees that,",2022-06-30
00:11:15.660,00:11:19.800,they will definitely go to the box with the number 73.,2022-06-30
00:11:19.800,00:11:23.070,So the slip and box with the same number,2022-06-30
00:11:23.070,00:11:25.020,essentially form a unit.,2022-06-30
00:11:25.020,00:11:27.690,They're like a little Lego brick.,2022-06-30
00:11:27.690,00:11:32.617,And then every slip is hidden inside another box.,2022-06-30
00:11:33.480,00:11:37.620,"So as I start laying out slips and boxes randomly,",2022-06-30
00:11:37.620,00:11:39.960,you can see that there's no way,2022-06-30
00:11:39.960,00:11:42.090,that we can end up with a dead end.,2022-06-30
00:11:42.090,00:11:44.400,It's not like you can just get to a box and then stop,2022-06-30
00:11:44.400,00:11:46.770,because every box contains a slip,2022-06-30
00:11:46.770,00:11:49.410,and that points at another box.,2022-06-30
00:11:49.410,00:11:52.830,So the only way for you to see only boxes,2022-06-30
00:11:52.830,00:11:54.450,when you walk into the room,2022-06-30
00:11:54.450,00:11:59.450,"is for every slip to be contained within a box,",2022-06-30
00:12:00.000,00:12:02.220,and that necessarily will mean,2022-06-30
00:12:02.220,00:12:04.950,that we are forming loops.,2022-06-30
00:12:04.950,00:12:07.470,"So when I start with box 73,",2022-06-30
00:12:07.470,00:12:10.230,"I must eventually find slip 73,",2022-06-30
00:12:10.230,00:12:12.510,because then and only then,2022-06-30
00:12:12.510,00:12:15.420,will I be directed to go back to box 73,2022-06-30
00:12:15.420,00:12:17.253,which closes the loop.,2022-06-30
00:12:19.440,00:12:21.900,- Who is the warden to this prison?,2022-06-30
00:12:21.900,00:12:25.050,And what kind of sadistic mathematical warden,2022-06-30
00:12:25.050,00:12:26.070,are you dealing with here?,2022-06-30
00:12:26.070,00:12:27.090,This is awful.,2022-06-30
00:12:27.090,00:12:29.880,"- Now, what if there is a sympathetic prison guard",2022-06-30
00:12:29.880,00:12:33.660,who sneaks into the room before any of the prisoners go in?,2022-06-30
00:12:33.660,00:12:36.900,"Well, then they can guarantee success for the prisoners",2022-06-30
00:12:36.900,00:12:40.620,by swapping the contents of just two boxes.,2022-06-30
00:12:40.620,00:12:43.410,That's because there can be at most one loop,2022-06-30
00:12:43.410,00:12:45.570,"that is longer than 50,",2022-06-30
00:12:45.570,00:12:47.940,and you can break it in half,2022-06-30
00:12:47.940,00:12:51.600,just by swapping the contents of two boxes.,2022-06-30
00:12:51.600,00:12:53.010,And now I have two separate loops,2022-06-30
00:12:53.010,00:12:55.323,that are each shorter than 50.,2022-06-30
00:12:56.880,00:12:59.190,But what if there was a malicious guard,2022-06-30
00:12:59.190,00:13:00.570,who figured out that the prisoners,2022-06-30
00:13:00.570,00:13:02.970,were going to use this loop strategy?,2022-06-30
00:13:02.970,00:13:04.830,"Well, then they could put the numbers in boxes",2022-06-30
00:13:04.830,00:13:08.370,to ensure they formed a loop longer than 50.,2022-06-30
00:13:08.370,00:13:10.860,"In this case, are the prisoners doomed?",2022-06-30
00:13:10.860,00:13:13.290,"Surprisingly, no.",2022-06-30
00:13:13.290,00:13:17.610,They can counter by arbitrarily renumbering the boxes.,2022-06-30
00:13:17.610,00:13:20.913,"They could, for example, add five to each box number.",2022-06-30
00:13:21.780,00:13:25.590,The loops are set both by the locations of the slips,2022-06-30
00:13:25.590,00:13:27.333,and by the box numbers.,2022-06-30
00:13:28.350,00:13:30.690,Renumbering the boxes is essentially the same,2022-06-30
00:13:30.690,00:13:32.940,as redistributing the slips.,2022-06-30
00:13:32.940,00:13:35.850,"So the problem is back to a random arrangement of loops,",2022-06-30
00:13:35.850,00:13:37.410,meaning the prisoners are back to their,2022-06-30
00:13:37.410,00:13:39.603,31% chance of survival.,2022-06-30
00:13:41.280,00:13:45.150,"Now, what happens if you increase the number of prisoners?",2022-06-30
00:13:45.150,00:13:47.880,"- Fun fact, nobody knows if",2022-06-30
00:13:47.880,00:13:49.500,as you have more and more prisoners,2022-06-30
00:13:49.500,00:13:50.940,"it's going towards a limit,",2022-06-30
00:13:50.940,00:13:53.550,"or if it'll eventually go down to zero, or what?",2022-06-30
00:13:53.550,00:13:55.770,"- That is my friend Matt Parker,",2022-06-30
00:13:55.770,00:13:57.540,and I think what he meant to say,2022-06-30
00:13:57.540,00:13:59.550,is we know exactly what happens,2022-06-30
00:13:59.550,00:14:01.920,as you increase the number of prisoners.,2022-06-30
00:14:01.920,00:14:05.760,"With a thousand prisoners each allowed to check 500 boxes,",2022-06-30
00:14:05.760,00:14:07.530,you might expect their chance of success,2022-06-30
00:14:07.530,00:14:09.180,"to drop dramatically,",2022-06-30
00:14:09.180,00:14:11.700,"but you can calculate it like we did before,",2022-06-30
00:14:11.700,00:14:15.030,"and it comes out to 30.74%,",2022-06-30
00:14:15.030,00:14:18.870,only half a percentage point lower than for 100 prisoners.,2022-06-30
00:14:18.870,00:14:20.550,"For 1 million prisoners,",2022-06-30
00:14:20.550,00:14:24.660,"the probability of success is 30.685%,",2022-06-30
00:14:24.660,00:14:27.570,which is only a little higher than for 1 billion.,2022-06-30
00:14:27.570,00:14:29.040,"Of course, their bigger problem would be",2022-06-30
00:14:29.040,00:14:31.590,the time it takes to open all the boxes.,2022-06-30
00:14:31.590,00:14:33.990,So your probability of winning this game,2022-06-30
00:14:33.990,00:14:36.510,does indeed approach a limit.,2022-06-30
00:14:36.510,00:14:38.343,So what is that limit?,2022-06-30
00:14:39.480,00:14:41.190,The formula we've been using,2022-06-30
00:14:41.190,00:14:43.530,"is one minus the chance of failure,",2022-06-30
00:14:43.530,00:14:47.307,"which is the series 1 over 51 plus 1 over 52,",2022-06-30
00:14:47.307,00:14:50.400,"and so on, up to 1 over 100.",2022-06-30
00:14:50.400,00:14:55.350,"We can depict this series as the sum of areas of rectangles,",2022-06-30
00:14:55.350,00:14:57.480,and there is a curve that follows,2022-06-30
00:14:57.480,00:14:59.100,the heights of these blocks.,2022-06-30
00:14:59.100,00:15:01.500,That curve is one over X.,2022-06-30
00:15:01.500,00:15:05.100,The area under that curve from 50 to 100,2022-06-30
00:15:05.100,00:15:08.370,approximates the area of all the rectangles.,2022-06-30
00:15:08.370,00:15:11.370,"And as the number of prisoners goes to infinity,",2022-06-30
00:15:11.370,00:15:14.550,it becomes a better and better approximation.,2022-06-30
00:15:14.550,00:15:16.800,"So to find the probability of failure,",2022-06-30
00:15:16.800,00:15:19.560,we can just take the integral of one over X,2022-06-30
00:15:19.560,00:15:21.240,from n to 2n.,2022-06-30
00:15:21.240,00:15:25.620,And we find that it's equal to the natural logarithm of two.,2022-06-30
00:15:25.620,00:15:27.600,This gives a probability of success,2022-06-30
00:15:27.600,00:15:29.970,"of one minus the natural log of two,",2022-06-30
00:15:29.970,00:15:33.780,which is about 30.7%.,2022-06-30
