Start Time,End Time,Text,Date
00:17:27.360,00:17:30.800,unexplained intellectual disability. According to a,2022-04-22
00:17:30.800,00:17:34.560,"study published in 2022, more than half of the current",2022-04-22
00:17:34.560,00:17:39.040,"US population, that's 170 million people were exposed to",2022-04-22
00:17:39.040,00:17:42.320,high levels of lead in early childhood. Those born between,2022-04-22
00:17:42.320,00:17:45.840,"1951 and 1980, are disproportionately affected.",2022-04-22
00:17:46.480,00:17:49.920,The author's estimate that in aggregate lead caused a loss,2022-04-22
00:17:49.920,00:17:54.720,of more than 800 million IQ points. The world is less,2022-04-22
00:17:54.720,00:17:59.280,intelligent today because of leaded gasoline. But there are,2022-04-22
00:17:59.280,00:18:03.200,even more troubling correlations. The US saw a,2022-04-22
00:18:03.200,00:18:09.040,"steady rise in crime from the 1970s to the 1990s, then it",2022-04-22
00:18:09.040,00:18:13.760,abruptly declined. This graph looks eerily similar to a plot,2022-04-22
00:18:13.760,00:18:18.960,of preschool blood lead levels just offset by 20 years. The,2022-04-22
00:18:18.960,00:18:22.160,obvious question is did kids who were exposed to higher,2022-04-22
00:18:22.160,00:18:25.200,levels of lead grow up to commit more crimes than they,2022-04-22
00:18:25.200,00:18:28.240,otherwise would have? You might think this is just a,2022-04-22
00:18:28.240,00:18:31.040,spurious correlation. But the same pattern appears in many,2022-04-22
00:18:31.040,00:18:34.720,"countries, including Britain, Canada, and Australia. And we",2022-04-22
00:18:34.720,00:18:36.800,know there's a causal connection between lead,2022-04-22
00:18:36.800,00:18:40.640,exposure and antisocial or violent behavior. A study of,2022-04-22
00:18:40.640,00:18:44.400,340 Teenagers found that those who were arrested were four,2022-04-22
00:18:44.400,00:18:46.960,times as likely to have elevated lead in their bones,2022-04-22
00:18:46.960,00:18:49.720,than similar demographic controls who didn't have run,2022-04-22
00:18:49.720,00:18:52.400,"ins with the law. Now, this doesn't mean that lead is",2022-04-22
00:18:52.400,00:18:55.280,"responsible for all of the increase in crime, but it's",2022-04-22
00:18:55.280,00:18:57.200,very likely responsible for some of it.,2022-04-22
00:18:59.120,00:19:02.400,"Now, it's tough to estimate the precise death toll of",2022-04-22
00:19:02.400,00:19:05.680,lead. One of its lesser known effects is a hardening of the,2022-04-22
00:19:05.680,00:19:10.080,"arteries, leading to increased cardiovascular disease. A",2022-04-22
00:19:10.080,00:19:14.720,"study from 2018 found lead was likely responsible for 250,000",2022-04-22
00:19:15.440,00:19:19.760,"heart disease deaths per year in the US, assuming a constant",2022-04-22
00:19:19.760,00:19:23.360,"rate over the past century, that amounts to 25 million",2022-04-22
00:19:23.360,00:19:27.360,"deaths in the US alone. Globally, the figure may",2022-04-22
00:19:27.360,00:19:30.960,approach 100 million. Most of those deaths are due to,2022-04-22
00:19:30.960,00:19:34.960,"Midgley's decision to put lead in gasoline, as substance he",2022-04-22
00:19:34.960,00:19:38.880,"knew firsthand was toxic, but he did it anyway to maximize",2022-04-22
00:19:38.880,00:19:43.120,profits. And the problem is not over. Current estimates of,2022-04-22
00:19:43.120,00:19:47.680,deaths caused by lead range from 500 to 900 thousand per,2022-04-22
00:19:47.680,00:19:51.360,year. The 2020 UNICEF report warns that one in three,2022-04-22
00:19:51.360,00:19:55.680,"children globally, that's over 800 million children have",2022-04-22
00:19:55.680,00:19:59.520,blood lead levels at or above five micrograms per deciliter.,2022-04-22
00:20:00.320,00:20:03.600,A lot of this lead now comes from batteries and industrial,2022-04-22
00:20:03.600,00:20:08.160,"processes, but some is still due to Midgley's invention.",2022-04-22
00:20:11.200,00:20:14.080,"After Midgley's success with Ethyl, he was put in charge of",2022-04-22
00:20:14.080,00:20:17.920,another engineering project. GM wasn't just making cars but,2022-04-22
00:20:17.920,00:20:22.160,also household appliances and fridges had a problem. The two,2022-04-22
00:20:22.160,00:20:24.960,most common gases used as refrigerants were methyl,2022-04-22
00:20:24.960,00:20:29.280,"formate and sulfur dioxide. One is highly toxic, the other",2022-04-22
00:20:29.280,00:20:33.280,is flammable. Midgley was tasked with creating a safer,2022-04-22
00:20:33.280,00:20:37.000,"alternative and in 1928, he developed a non toxic and non",2022-04-22
00:20:37.000,00:20:41.760,"flammable refrigerant dichlorodifluoromethane, GM",2022-04-22
00:20:41.760,00:20:45.120,called this new product Freon and to demonstrate Freon's,2022-04-22
00:20:45.120,00:20:47.680,"safety, during the unveiling at the American Chemical",2022-04-22
00:20:47.680,00:20:51.920,"Society, Midgley inhaled a lung full of this gas and blew",2022-04-22
00:20:51.920,00:20:57.040,out a candle. In the following decades CFCs like Freon became,2022-04-22
00:20:57.040,00:21:01.360,very popular and were used as solvents and aerosols. The,2022-04-22
00:21:01.360,00:21:05.920,problem is CFCs are light and stable. When released into the,2022-04-22
00:21:05.920,00:21:09.840,"atmosphere, they climb up into the stratosphere where they",2022-04-22
00:21:09.840,00:21:14.320,can remain for 50 to 100 years. But if a CFC molecule,2022-04-22
00:21:14.320,00:21:16.720,is hit by an ultraviolet photon of just the right,2022-04-22
00:21:16.720,00:21:20.960,"energy, it breaks apart, releasing a chlorine atom and",2022-04-22
00:21:20.960,00:21:24.640,"this chlorine atom can then react with ozone, breaking it",2022-04-22
00:21:24.640,00:21:29.280,apart into chlorine monoxide and oxygen gas. The results,2022-04-22
00:21:29.280,00:21:32.080,was another environmental disaster: the hole in the,2022-04-22
00:21:32.080,00:21:35.760,ozone layer. With less ozone more UV light penetrates the,2022-04-22
00:21:35.760,00:21:38.400,atmosphere increasing the rates of skin cancer and,2022-04-22
00:21:38.400,00:21:43.040,cataracts. Plus CFCs are potent greenhouse gases per,2022-04-22
00:21:43.040,00:21:47.440,"kilogram they produce 10,000 times more warming than CO2.",2022-04-22
00:21:47.440,00:21:50.480,The historian John McNeil wrote that Midgley had more,2022-04-22
00:21:50.480,00:21:54.080,impact on the atmosphere than any other single organism in,2022-04-22
00:21:54.080,00:21:58.080,Earth's history. An agreement to phase out CFCs the Montreal,2022-04-22
00:21:58.080,00:22:02.240,Protocol went into effect in 1989. And the ozone layer is,2022-04-22
00:22:02.240,00:22:05.040,"now showing signs of recovery, although it will take many",2022-04-22
00:22:05.040,00:22:07.200,more decades to fully recover.,2022-04-22
00:22:08.080,00:22:10.480,"In 1940, at the age of 51,",2022-04-22
00:22:10.480,00:22:14.160,"Midgley contracted polio and became physically disabled, so",2022-04-22
00:22:14.160,00:22:17.360,"to help him get up, he devised a mechanical bed controlled by",2022-04-22
00:22:17.360,00:22:22.000,"a series of ropes and pulleys. On November 2 1944, while",2022-04-22
00:22:22.000,00:22:25.520,"using the contraption, he became tangled in the ropes",2022-04-22
00:22:25.520,00:22:27.360,and died of strangulation.,2022-04-22
00:22:30.000,00:22:32.960,"Thanks to the work of Clair Patterson, it became clear",2022-04-22
00:22:32.960,00:22:35.600,that the lead in our environment is not natural.,2022-04-22
00:22:36.160,00:22:39.040,Burning lead and combustion engines spread the toxic,2022-04-22
00:22:39.040,00:22:43.520,"elements across the planet. Into the air, oceans, the snow",2022-04-22
00:22:43.520,00:22:48.320,at the South Pole and even our bones. Japan was the first to,2022-04-22
00:22:48.320,00:22:52.240,ban leaded fuel and cars in 1986. But other countries soon,2022-04-22
00:22:52.240,00:22:58.480,followed suit. Algeria was the last to do so in 2021. The UN,2022-04-22
00:22:58.480,00:23:01.040,calculates that the elimination of lead from gas,2022-04-22
00:23:01.040,00:23:06.240,"saves over a million lives per year, and $2.45 trillion",2022-04-22
00:23:06.240,00:23:07.840,dollars.,2022-04-22
00:23:08.640,00:23:12.880,"But leaded gas is still used, by the way in piston driven",2022-04-22
00:23:12.880,00:23:15.840,airplane engines. That's now the largest source of lead,2022-04-22
00:23:15.840,00:23:17.840,emissions into the air in the US.,2022-04-22
00:23:18.960,00:23:23.680,You will observe with concern how long a useful truth may be known and exist,2022-04-22
00:23:23.680,00:23:35.920,before it is generally received and practiced on.,2022-04-22
00:23:35.920,00:23:38.560,When I first learned about Thomas Midgley and Clair,2022-04-22
00:23:38.560,00:23:42.480,"Patterson, I was amazed by how much harm or how much good a",2022-04-22
00:23:42.480,00:23:45.280,single person could do to the environment. Which brings me,2022-04-22
00:23:45.280,00:23:48.320,"to the sponsor of this video Wren, an organization that's",2022-04-22
00:23:48.320,00:23:51.280,taking action on climate change. I think it's important,2022-04-22
00:23:51.280,00:23:54.000,that we tackle the climate crisis both by lobbying for,2022-04-22
00:23:54.000,00:23:57.280,systemic change. And by making more environmentally friendly,2022-04-22
00:23:57.280,00:24:00.640,"choices ourselves. On Wren's website, you can calculate how",2022-04-22
00:24:00.640,00:24:03.760,much carbon you emit and which activities have the greatest,2022-04-22
00:24:03.760,00:24:06.960,impact. And if you like you can offset your emissions,2022-04-22
00:24:06.960,00:24:09.680,through a monthly subscription. The funds raised,2022-04-22
00:24:09.680,00:24:12.000,go to support a variety of projects that reduce,2022-04-22
00:24:12.000,00:24:14.960,greenhouse gases in the atmosphere. One project I,2022-04-22
00:24:14.960,00:24:17.920,particularly like involves collecting up flammable dead,2022-04-22
00:24:17.920,00:24:22.160,wood from California forests. This helps prevent wildfires.,2022-04-22
00:24:22.160,00:24:25.520,"Plus the collected wood is converted into biochar, a",2022-04-22
00:24:25.520,00:24:29.040,material that locks up the carbon inside for 1000s of,2022-04-22
00:24:29.040,00:24:32.080,"years. Once you sign up to offset your carbon footprint,",2022-04-22
00:24:32.080,00:24:35.360,you'll receive monthly updates from the projects you support.,2022-04-22
00:24:35.360,00:24:38.640,It's completely transparent with photos and details of,2022-04-22
00:24:38.640,00:24:42.400,every tree planted every acre reforested every tonne of,2022-04-22
00:24:42.400,00:24:45.360,"carbon offset, and for the first 100 People who sign up",2022-04-22
00:24:45.360,00:24:48.240,using the link in the description. I will personally,2022-04-22
00:24:48.240,00:24:51.280,pay for the first month of your subscription. So I want,2022-04-22
00:24:51.280,00:24:54.240,to thank Wren for supporting Veritasium and I want to,2022-04-22
00:24:54.240,00:24:56.320,thank you for watching.,2022-04-22
