Start Time,End Time,Text,Date
00:15:33.780,00:15:34.800,The bottom line is,2022-06-30
00:15:34.800,00:15:37.110,"that no matter how many prisoners you have,",2022-06-30
00:15:37.110,00:15:39.810,you'll always end up with above a 30% chance,2022-06-30
00:15:39.810,00:15:41.610,of escaping using this strategy.,2022-06-30
00:15:41.610,00:15:43.470,And that feels really wrong.,2022-06-30
00:15:43.470,00:15:45.270,"I mean, at first it seemed essentially impossible",2022-06-30
00:15:45.270,00:15:47.670,for all 100 prisoners to find their numbers.,2022-06-30
00:15:47.670,00:15:49.020,But now we're seeing that you could have,2022-06-30
00:15:49.020,00:15:50.220,"a hundred, a million,",2022-06-30
00:15:50.220,00:15:53.190,or any arbitrarily large number of prisoners,2022-06-30
00:15:53.190,00:15:56.880,with at least a 30% chance that they all find their numbers.,2022-06-30
00:15:56.880,00:15:58.530,The beauty of the loop strategy,2022-06-30
00:15:58.530,00:16:01.440,"is linking everyone's outcomes together,",2022-06-30
00:16:01.440,00:16:03.090,instead of each prisoner walking in,2022-06-30
00:16:03.090,00:16:05.010,with their own 50-50 shot.,2022-06-30
00:16:05.010,00:16:07.230,Following the same loops means that they have,2022-06-30
00:16:07.230,00:16:09.480,the exact same chance of finding their number,2022-06-30
00:16:09.480,00:16:11.280,as everyone else in their loop.,2022-06-30
00:16:11.280,00:16:13.590,"And once the boxes and slips are arranged,",2022-06-30
00:16:13.590,00:16:17.961,that chance is set at either 100% or 0%.,2022-06-30
00:16:17.961,00:16:20.670,"With this strategy, you can't ever get close to winning",2022-06-30
00:16:20.670,00:16:22.770,with only a few people missing their numbers.,2022-06-30
00:16:22.770,00:16:26.793,You can only fail hard or succeed completely.,2022-06-30
00:16:33.990,00:16:35.640,"Now, if you like solving puzzles",2022-06-30
00:16:35.640,00:16:38.490,"even outside of life-threatening prison situations,",2022-06-30
00:16:38.490,00:16:41.370,"well, you'll love Brilliant, these sponsor of this video.",2022-06-30
00:16:41.370,00:16:42.930,Brilliant is a website and app,2022-06-30
00:16:42.930,00:16:44.790,that builds problem-solving skills,2022-06-30
00:16:44.790,00:16:47.310,and guides you through engaging interactive lessons,2022-06-30
00:16:47.310,00:16:48.750,in math and science.,2022-06-30
00:16:48.750,00:16:50.730,"They have great courses on tons of topics,",2022-06-30
00:16:50.730,00:16:53.730,from statistics to astrophysics to logic.,2022-06-30
00:16:53.730,00:16:55.080,"Now, if you liked this riddle",2022-06-30
00:16:55.080,00:16:56.400,"and you want more just like it,",2022-06-30
00:16:56.400,00:16:59.370,"I'd recommend their perplexing probability course,",2022-06-30
00:16:59.370,00:17:02.040,featuring other seemingly impossible odds,2022-06-30
00:17:02.040,00:17:05.580,and even another mathematically inclined prison warden.,2022-06-30
00:17:05.580,00:17:08.070,They've also got a joy of problem solving course,2022-06-30
00:17:08.070,00:17:09.390,to take you through some of their,2022-06-30
00:17:09.390,00:17:11.760,most delightful math puzzles.,2022-06-30
00:17:11.760,00:17:14.070,Every lesson builds on what you learned previously,2022-06-30
00:17:14.070,00:17:15.930,to give you an in-depth understanding,2022-06-30
00:17:15.930,00:17:17.640,with any course you take.,2022-06-30
00:17:17.640,00:17:19.200,Your knowledge is constantly developed,2022-06-30
00:17:19.200,00:17:22.080,and tested through interactive experiments and quizzes.,2022-06-30
00:17:22.080,00:17:25.200,"And if you get stuck, there's always a helpful hint.",2022-06-30
00:17:25.200,00:17:28.080,Head over to brilliant.org/veritasium,2022-06-30
00:17:28.080,00:17:29.700,to check out all these courses,2022-06-30
00:17:29.700,00:17:31.440,and test your instincts after learning about,2022-06-30
00:17:31.440,00:17:33.720,the 100 prisoners riddle.,2022-06-30
00:17:33.720,00:17:36.300,"If you click through right now, Brilliant are offering",2022-06-30
00:17:36.300,00:17:38.490,20% off an annual premium subscription,2022-06-30
00:17:38.490,00:17:40.350,to the first 200 people to sign up.,2022-06-30
00:17:40.350,00:17:42.870,"So I wanna thank brilliant for supporting Veritasium,",2022-06-30
00:17:42.870,00:17:44.763,and I want to thank you for watching.,2022-06-30
