Start Time,End Time,Text,Date
00:13:43.303,00:13:44.470,Edit the prediction.,2023-04-14
00:13:44.470,00:13:45.760,"Oh, my prediction was based",2023-04-14
00:13:45.760,00:13:49.120,"on the strength it was two weeks ago,",2023-04-14
00:13:49.120,00:13:51.250,which we have here.,2023-04-14
00:13:51.250,00:13:53.530,"We got 14 days of 6,600.",2023-04-14
00:13:53.530,00:13:55.810,"So, you know, reason would be it'd probably break",2023-04-14
00:13:55.810,00:13:57.310,"another 1000 psi above that,",2023-04-14
00:13:57.310,00:13:59.440,but it definitely gained a lot.,2023-04-14
00:13:59.440,00:14:02.200,"- And finally, cement plus sand and gravel.",2023-04-14
00:14:02.200,00:14:04.033,This is the normal concrete mix.,2023-04-14
00:14:04.964,00:14:06.159,(cement cylinder pops),2023-04-14
00:14:06.159,00:14:07.090,Is that it?,2023-04-14
00:14:07.090,00:14:08.466,No?,2023-04-14
00:14:08.466,00:14:09.516,- A part of it.,2023-04-14
00:14:10.917,00:14:11.860,(glass shatters),2023-04-14
00:14:11.860,00:14:12.693,- Whoa!,2023-04-14
00:14:13.720,00:14:14.553,"Okay, so that's it.",2023-04-14
00:14:14.553,00:14:15.877,- That's it. - We'll take it.,2023-04-14
00:14:15.877,00:14:16.912,- That's it.,2023-04-14
00:14:16.912,00:14:20.245,(cement cylinder blows),2023-04-14
00:14:21.390,00:14:23.683,"- So it did fail at 8,300.",2023-04-14
00:14:25.210,00:14:26.200,Okay.,2023-04-14
00:14:26.200,00:14:28.630,I was surprised to see that all the cylinders broke,2023-04-14
00:14:28.630,00:14:30.010,under about the same pressure.,2023-04-14
00:14:30.010,00:14:31.480,"I think, to me, really interesting",2023-04-14
00:14:31.480,00:14:34.870,"that you could have all of that cement, right?",2023-04-14
00:14:34.870,00:14:36.820,But you don't get appreciably...,2023-04-14
00:14:36.820,00:14:39.130,- Right. - Stronger than like this,2023-04-14
00:14:39.130,00:14:40.750,or that.,2023-04-14
00:14:40.750,00:14:43.570,Cement is the most expensive part of concrete.,2023-04-14
00:14:43.570,00:14:45.430,So if you can get away with reducing it down,2023-04-14
00:14:45.430,00:14:46.540,to 30% in the mix,2023-04-14
00:14:46.540,00:14:48.700,"and still get the same strength characteristics,",2023-04-14
00:14:48.700,00:14:51.160,well then you should definitely do that.,2023-04-14
00:14:51.160,00:14:53.410,The other thing that was interesting was pure cement seemed,2023-04-14
00:14:53.410,00:14:56.770,to flake and chip more as it was loaded.,2023-04-14
00:14:56.770,00:14:58.420,So it seemed like adding the aggregate,2023-04-14
00:14:58.420,00:15:00.520,actually helped the sample cohere,2023-04-14
00:15:00.520,00:15:03.533,and stay together even under all that load.,2023-04-14
00:15:03.533,00:15:06.866,(cement cylinder blows),2023-04-14
00:15:07.780,00:15:12.010,So was Roman concrete superior to modern concrete?,2023-04-14
00:15:12.010,00:15:14.560,"Well, the answer is no in short.",2023-04-14
00:15:14.560,00:15:17.050,I mean there were some surprising advantages,2023-04-14
00:15:17.050,00:15:18.070,that Roman concrete had.,2023-04-14
00:15:18.070,00:15:18.903,"For example,",2023-04-14
00:15:18.903,00:15:21.910,it was actually less well-mixed than modern concrete.,2023-04-14
00:15:21.910,00:15:26.770,So there were little blocks of undissolved calcium oxide,2023-04-14
00:15:26.770,00:15:30.340,or quicklime that remained inside Roman concrete.,2023-04-14
00:15:30.340,00:15:32.530,And then what happened is when the concrete cracked,2023-04-14
00:15:32.530,00:15:33.730,"and water got in there,",2023-04-14
00:15:33.730,00:15:36.130,"it would dissolve that calcium oxide,",2023-04-14
00:15:36.130,00:15:37.660,"forming calcium hydroxide,",2023-04-14
00:15:37.660,00:15:41.560,and then you would get the new growth of calcium carbonate.,2023-04-14
00:15:41.560,00:15:45.130,So Roman concrete was actually self-healing.,2023-04-14
00:15:45.130,00:15:48.070,That's kind of a fascinating advantage.,2023-04-14
00:15:48.070,00:15:49.930,"But I would say by and large, you know,",2023-04-14
00:15:49.930,00:15:51.400,"when we look back at the Roman structures,",2023-04-14
00:15:51.400,00:15:53.290,we only see the ones that have survived to this day.,2023-04-14
00:15:53.290,00:15:55.510,So there is a survivor bias.,2023-04-14
00:15:55.510,00:15:57.460,"And finally, there's the issue of cost.",2023-04-14
00:15:57.460,00:15:59.320,We could make very strong concretes,2023-04-14
00:15:59.320,00:16:01.660,that could last an incredibly long time,2023-04-14
00:16:01.660,00:16:04.540,but we choose not to because it's just cheaper,2023-04-14
00:16:04.540,00:16:07.113,and we don't expect our buildings to last that long.,2023-04-14
00:16:08.530,00:16:10.450,"Before the concrete goes out on site,",2023-04-14
00:16:10.450,00:16:12.370,they have to make sure it's the right consistency,2023-04-14
00:16:12.370,00:16:13.240,for the customer;,2023-04-14
00:16:13.240,00:16:15.880,not too dry and not too runny.,2023-04-14
00:16:15.880,00:16:17.800,This can be adjusted with water,2023-04-14
00:16:17.800,00:16:19.330,but you don't really wanna do that,2023-04-14
00:16:19.330,00:16:21.460,because that can also affect the strength.,2023-04-14
00:16:21.460,00:16:25.660,"So here, they use modern chemicals like superplasticizers.",2023-04-14
00:16:25.660,00:16:26.830,"- Up here on the top left,",2023-04-14
00:16:26.830,00:16:28.690,you have our dispensing units,2023-04-14
00:16:28.690,00:16:31.180,for all our chemical add mixtures.,2023-04-14
00:16:31.180,00:16:32.620,- And that's what they're adding now,2023-04-14
00:16:32.620,00:16:33.850,of superplasticizer.,2023-04-14
00:16:33.850,00:16:36.640,It makes the concrete easier to work and spread around,2023-04-14
00:16:36.640,00:16:39.730,without really changing the water content very much.,2023-04-14
00:16:39.730,00:16:41.410,"To check that the consistency is right,",2023-04-14
00:16:41.410,00:16:44.770,they perform something called a slump test or spread test.,2023-04-14
00:16:44.770,00:16:48.883,"- We're gonna fill the cone to the top nice and level,",2023-04-14
00:16:50.140,00:16:52.450,and we're gonna pull that metal cone off.,2023-04-14
00:16:52.450,00:16:54.910,Measure the distance it travels on the board.,2023-04-14
00:16:54.910,00:16:56.800,- The concrete they're pouring on me,2023-04-14
00:16:56.800,00:16:59.203,should have a spread of 27 inches.,2023-04-14
00:17:00.730,00:17:02.121,- We're gonna measure it both sides.,2023-04-14
00:17:02.121,00:17:02.954,(crew member cheering),2023-04-14
00:17:02.954,00:17:05.026,Right on a 27 on that one.,2023-04-14
00:17:05.026,00:17:05.859,- Yeah.,2023-04-14
00:17:05.859,00:17:07.450,"- And go this way,",2023-04-14
00:17:07.450,00:17:09.283,right on a 27 on that one.,2023-04-14
00:17:10.270,00:17:11.260,- So why is it so important,2023-04-14
00:17:11.260,00:17:13.390,that you got the right consistency of concrete?,2023-04-14
00:17:13.390,00:17:14.980,- You don't want it too dry.,2023-04-14
00:17:14.980,00:17:17.020,You want it wet enough to flow,2023-04-14
00:17:17.020,00:17:19.840,"and fill up whatever container you're trying to fill,",2023-04-14
00:17:19.840,00:17:23.140,"in this case, the sphere with you in it.",2023-04-14
00:17:23.140,00:17:24.850,"- So the question you're probably wondering is,",2023-04-14
00:17:24.850,00:17:28.450,how long can I stay in here before the concrete hardens?,2023-04-14
00:17:28.450,00:17:32.140,The usual answer is about four hours without agitation.,2023-04-14
00:17:32.140,00:17:34.270,And that's why when you see concrete trucks driving,2023-04-14
00:17:34.270,00:17:36.580,"down the road, that drum has to be turning",2023-04-14
00:17:36.580,00:17:38.170,to keep the concrete agitated,2023-04-14
00:17:38.170,00:17:40.000,and prevent it from setting up.,2023-04-14
00:17:40.000,00:17:42.340,But what happens if the truck breaks down,2023-04-14
00:17:42.340,00:17:45.340,"or there's a traffic jam or something breaks,",2023-04-14
00:17:45.340,00:17:48.700,"then, at times, concrete does harden inside the drum",2023-04-14
00:17:48.700,00:17:51.670,of these trucks and that is a terrible outcome.,2023-04-14
00:17:51.670,00:17:53.440,But there is one thing you can do,2023-04-14
00:17:53.440,00:17:56.350,to slow the concrete down from setting,2023-04-14
00:17:56.350,00:18:01.240,and that is to add some regular pop like Coke.,2023-04-14
00:18:02.140,00:18:04.570,The sugars inside this coke,2023-04-14
00:18:04.570,00:18:09.010,actually prevent the setting up process from happening,2023-04-14
00:18:09.010,00:18:11.680,and that can buy you a few hours.,2023-04-14
00:18:11.680,00:18:13.690,"So apparently these truck drivers,",2023-04-14
00:18:13.690,00:18:17.140,they drive around with a few two-liter bottles of pop,2023-04-14
00:18:17.140,00:18:18.610,inside their cab,2023-04-14
00:18:18.610,00:18:21.640,and so they can dump it in their load if they have to,2023-04-14
00:18:21.640,00:18:22.810,to prevent it from setting up.,2023-04-14
00:18:22.810,00:18:26.473,So hopefully that means I'll get out okay too.,2023-04-14
00:18:28.240,00:18:31.150,But how does concrete actually harden?,2023-04-14
00:18:31.150,00:18:34.090,"Well, you have the dry mixture of gravel, sand,",2023-04-14
00:18:34.090,00:18:37.660,and cement powder and then you add water.,2023-04-14
00:18:37.660,00:18:40.810,"The water starts dissolving the cement powder grains,",2023-04-14
00:18:40.810,00:18:43.090,"so ions enter solution,",2023-04-14
00:18:43.090,00:18:46.390,and some of those ions are calcium hydroxide.,2023-04-14
00:18:46.390,00:18:49.843,So that's what makes concrete a very basic solution.,2023-04-14
00:18:50.800,00:18:52.120,What do you see?,2023-04-14
00:18:52.120,00:18:55.180,"- We're approaching 12, 11.8.",2023-04-14
00:18:55.180,00:18:59.620,- So the pH of concrete can get up to 12 or 13.,2023-04-14
00:18:59.620,00:19:03.910,"The pH of this is 11.8 and that's incredibly basic,",2023-04-14
00:19:03.910,00:19:06.130,"which means if it's on your skin, if it's on your body,",2023-04-14
00:19:06.130,00:19:10.210,it can be dissolving your skin and cells.,2023-04-14
00:19:10.210,00:19:12.760,Being buried in concrete is sort of like jumping,2023-04-14
00:19:12.760,00:19:14.260,in a bath of bleach.,2023-04-14
00:19:14.260,00:19:16.540,And that's why I'm actually wearing a dry suit,2023-04-14
00:19:16.540,00:19:18.100,and some latex gloves.,2023-04-14
00:19:18.100,00:19:19.960,"Yeah, it's not something you want to try at home.",2023-04-14
00:19:19.960,00:19:23.800,So do not try swimming in concrete.,2023-04-14
00:19:23.800,00:19:26.860,So now the ions are dissolved in the solution.,2023-04-14
00:19:26.860,00:19:28.510,"And remember, the most common compound",2023-04-14
00:19:28.510,00:19:31.480,in cement is tricalcium silicate.,2023-04-14
00:19:31.480,00:19:33.370,"As it reacts with the water,",2023-04-14
00:19:33.370,00:19:37.480,"crystals start to form of calcium silicate hydrates,",2023-04-14
00:19:37.480,00:19:39.700,plus other hydrate minerals.,2023-04-14
00:19:39.700,00:19:43.690,"And all these crystals grow and become interlocking,",2023-04-14
00:19:43.690,00:19:46.000,causing the concrete to harden.,2023-04-14
00:19:46.000,00:19:47.740,Note that the water is essential,2023-04-14
00:19:47.740,00:19:49.930,to the formation of these crystals.,2023-04-14
00:19:49.930,00:19:52.030,"So water is not evaporating,",2023-04-14
00:19:52.030,00:19:53.680,it's not drying out.,2023-04-14
00:19:53.680,00:19:57.760,It's actually becoming part of the solid concrete material.,2023-04-14
00:19:57.760,00:20:01.210,And that's why this chemistry is called cement hydration.,2023-04-14
00:20:01.210,00:20:03.670,It's also why freshly poured concrete should be kept,2023-04-14
00:20:03.670,00:20:05.953,in as damp an environment as possible.,2023-04-14
00:20:08.620,00:20:11.320,Las Vegas is so dry they frequently set up misters,2023-04-14
00:20:11.320,00:20:13.360,to spray around new concrete,2023-04-14
00:20:13.360,00:20:15.463,to ensure the humidity was high enough.,2023-04-14
00:20:16.450,00:20:19.150,One of the things I realized while making this video is,2023-04-14
00:20:19.150,00:20:23.770,"that limestone, the core component of cement and concrete,",2023-04-14
00:20:23.770,00:20:26.380,well it comes from ancient sea life.,2023-04-14
00:20:26.380,00:20:30.460,Limestone is formed from the skeletons and shells,2023-04-14
00:20:30.460,00:20:33.580,"of ancient sea organisms that, you know, died millions",2023-04-14
00:20:33.580,00:20:34.413,"of years ago,",2023-04-14
00:20:34.413,00:20:36.700,and then all of that got compressed.,2023-04-14
00:20:36.700,00:20:39.883,And now we use that to make huge skyscrapers,2023-04-14
00:20:39.883,00:20:41.200,"and, you know, overpasses,",2023-04-14
00:20:41.200,00:20:43.510,"basically every huge piece of infrastructure,",2023-04-14
00:20:43.510,00:20:45.040,it's made with concrete.,2023-04-14
00:20:45.040,00:20:47.920,"And so now when you look at a beautiful city skyline,",2023-04-14
00:20:47.920,00:20:51.700,what you're really seeing is ancient marine life.,2023-04-14
00:20:51.700,00:20:55.033,Skyscrapers are made of seashells.,2023-04-14
00:20:56.844,00:21:01.375,♪ Skyscrapers are made seashells ♪,2023-04-14
00:21:01.375,00:21:05.458,♪ Skyscrapers are made seashells ♪,2023-04-14
00:21:08.800,00:21:10.546,"- Yeah, this is wild.",2023-04-14
00:21:10.546,00:21:11.620,This is hilarious.,2023-04-14
00:21:11.620,00:21:12.453,"I like,",2023-04-14
00:21:12.453,00:21:13.330,I have no words.,2023-04-14
00:21:13.330,00:21:15.370,- I'm like trying to push myself down into it,2023-04-14
00:21:15.370,00:21:16.900,"but it's like,",2023-04-14
00:21:16.900,00:21:18.160,it pushes me up.,2023-04-14
00:21:18.160,00:21:20.470,"Like I'm pushing down into the concrete,",2023-04-14
00:21:20.470,00:21:21.760,but it's like bop!,2023-04-14
00:21:21.760,00:21:23.290,I'm getting pushed out of this thing.,2023-04-14
00:21:23.290,00:21:26.242,I'm just gonna try to push myself down in here.,2023-04-14
00:21:26.242,00:21:27.790,Ooh!,2023-04-14
00:21:27.790,00:21:28.810,Like that is it.,2023-04-14
00:21:28.810,00:21:29.829,There is no...,2023-04-14
00:21:29.829,00:21:30.662,- You can use that.,2023-04-14
00:21:30.662,00:21:32.217,- You cannot get buried in concrete.,2023-04-14
00:21:32.217,00:21:33.550,Okay?,2023-04-14
00:21:33.550,00:21:37.270,I'm doing my best right now to like sink down,2023-04-14
00:21:37.270,00:21:38.230,and it is not happening.,2023-04-14
00:21:38.230,00:21:41.113,But I'm gonna use my arms to push myself in.,2023-04-14
00:21:42.351,00:21:43.519,(Derek grunts),2023-04-14
00:21:43.519,00:21:45.880,(Derek exclaims),2023-04-14
00:21:45.880,00:21:47.800,Working against buoyancy.,2023-04-14
00:21:47.800,00:21:49.240,This is hard.,2023-04-14
00:21:49.240,00:21:51.190,"We were worried about getting me out,",2023-04-14
00:21:51.190,00:21:53.380,but like I can't stay in.,2023-04-14
00:21:53.380,00:21:54.520,I'm gonna try to jump in.,2023-04-14
00:21:54.520,00:21:55.353,Here we go.,2023-04-14
00:21:56.980,00:21:57.940,That's it. (crew members laughing),2023-04-14
00:21:57.940,00:21:58.900,"All right, here we go.",2023-04-14
00:21:58.900,00:22:00.613,"One, two, three.",2023-04-14
00:22:06.040,00:22:06.873,That's great.,2023-04-14
00:22:07.764,00:22:10.514,(Derek exclaims),2023-04-14
00:22:13.360,00:22:15.280,That feels so good.,2023-04-14
00:22:15.280,00:22:16.480,"I, like, don't wanna get out.",2023-04-14
00:22:16.480,00:22:18.850,This is so nice.,2023-04-14
00:22:18.850,00:22:20.950,Has anyone had a time check?,2023-04-14
00:22:20.950,00:22:23.150,"This stuff is not gonna set up on me, is it?",2023-04-14
00:22:28.090,00:22:28.960,"So as we've seen,",2023-04-14
00:22:28.960,00:22:31.090,concrete is one of the most important materials,2023-04-14
00:22:31.090,00:22:31.930,in the world.,2023-04-14
00:22:31.930,00:22:33.250,It's made possible most,2023-04-14
00:22:33.250,00:22:35.710,"of the large-scale infrastructure we rely on,",2023-04-14
00:22:35.710,00:22:38.230,"but it also creates a lot of CO2,",2023-04-14
00:22:38.230,00:22:41.050,an estimated 8% of the global total.,2023-04-14
00:22:41.050,00:22:43.990,That is more than the entire aviation sector.,2023-04-14
00:22:43.990,00:22:46.510,"But together, we can do something about that.",2023-04-14
00:22:46.510,00:22:47.590,I would personally like,2023-04-14
00:22:47.590,00:22:49.750,to offset one month of your carbon emissions.,2023-04-14
00:22:49.750,00:22:52.930,"And I will do that through this video sponsor, Wren.",2023-04-14
00:22:52.930,00:22:53.830,Wren is a website,2023-04-14
00:22:53.830,00:22:55.810,"where you can calculate your carbon footprint,",2023-04-14
00:22:55.810,00:22:57.160,see which aspects of your lifestyle,2023-04-14
00:22:57.160,00:22:58.300,"make the biggest contribution,",2023-04-14
00:22:58.300,00:23:00.700,and learn how to reduce your impact.,2023-04-14
00:23:00.700,00:23:03.160,"And then if you like, you can offset your carbon footprint",2023-04-14
00:23:03.160,00:23:06.160,by funding a diverse mix of carbon reduction projects,2023-04-14
00:23:06.160,00:23:08.260,"like tree planting, mineral weathering,",2023-04-14
00:23:08.260,00:23:09.880,and rainforest protection.,2023-04-14
00:23:09.880,00:23:11.560,"For the first hundred people to sign up,",2023-04-14
00:23:11.560,00:23:14.530,I will personally offset your first month of emissions.,2023-04-14
00:23:14.530,00:23:16.690,Just click on the link in the description.,2023-04-14
00:23:16.690,00:23:19.060,"Now, I don't think we're going to solve climate change",2023-04-14
00:23:19.060,00:23:20.980,using individual action alone.,2023-04-14
00:23:20.980,00:23:23.410,"If you can change your light bulbs or install solar,",2023-04-14
00:23:23.410,00:23:24.243,that is great.,2023-04-14
00:23:24.243,00:23:27.340,But what we really need is change on a systemic scale.,2023-04-14
00:23:27.340,00:23:29.050,And that's what I like about Wren's approach.,2023-04-14
00:23:29.050,00:23:31.480,"They not only plant trees and protect rainforests,",2023-04-14
00:23:31.480,00:23:34.870,"they also support policy groups lobbying for change,",2023-04-14
00:23:34.870,00:23:36.460,"like the Clean Air Task Force,",2023-04-14
00:23:36.460,00:23:38.980,which advocates for new technologies and policies,2023-04-14
00:23:38.980,00:23:41.380,to get to a zero-emissions economy.,2023-04-14
00:23:41.380,00:23:42.400,"The way I see it,",2023-04-14
00:23:42.400,00:23:44.170,there are moneyed interests lobbying,2023-04-14
00:23:44.170,00:23:45.610,to keep things the way they are.,2023-04-14
00:23:45.610,00:23:46.900,So we need to band together,2023-04-14
00:23:46.900,00:23:49.540,through organizations like Wren to lobby for change.,2023-04-14
00:23:49.540,00:23:50.770,"And if you agree with me,",2023-04-14
00:23:50.770,00:23:52.870,then I invite you to click the link in the description,2023-04-14
00:23:52.870,00:23:55.270,and join me in offsetting our carbon emissions,2023-04-14
00:23:55.270,00:23:58.060,and investing in large-scale systemic change.,2023-04-14
00:23:58.060,00:24:00.250,"So I want to thank Wren for sponsoring Veritasium,",2023-04-14
00:24:00.250,00:24:02.113,and I want to thank you for watching.,2023-04-14
