Start Time,End Time,Text,Date
00:00:00.000,00:00:03.180,I am about to get buried in concrete.,2023-04-14
00:00:03.180,00:00:04.410,"And while that's happening,",2023-04-14
00:00:04.410,00:00:07.410,I'm going to explain everything you need to know,2023-04-14
00:00:07.410,00:00:09.360,about this substance.,2023-04-14
00:00:09.360,00:00:11.970,So the first thing that I want to clear up is the difference,2023-04-14
00:00:11.970,00:00:13.920,"between cement and concrete,",2023-04-14
00:00:13.920,00:00:15.870,"because people often mix these up, okay?",2023-04-14
00:00:15.870,00:00:17.820,Cement is like the glue.,2023-04-14
00:00:17.820,00:00:20.280,It's the matrix of stuff.,2023-04-14
00:00:20.280,00:00:21.810,"Oh there, I feel it.",2023-04-14
00:00:21.810,00:00:23.850,"Okay, that feels good.",2023-04-14
00:00:23.850,00:00:27.570,"Now concrete is cement plus aggregate,",2023-04-14
00:00:27.570,00:00:30.060,so plus gravel and sand.,2023-04-14
00:00:30.060,00:00:33.810,And this is filling up really rather quickly.,2023-04-14
00:00:33.810,00:00:36.840,Cement is the most important man-made substance,2023-04-14
00:00:36.840,00:00:37.890,on the planet.,2023-04-14
00:00:37.890,00:00:42.360,We use more of it than any other substance apart from water.,2023-04-14
00:00:42.360,00:00:46.800,"Every year, 500 kilograms of cement are created",2023-04-14
00:00:46.800,00:00:49.890,"for every man, woman, and child on earth.",2023-04-14
00:00:49.890,00:00:53.700,And that amount of cement can make two cubic meters,2023-04-14
00:00:53.700,00:00:58.233,"of concrete, which is about two of these big fishbowls.",2023-04-14
00:00:59.160,00:01:00.993,This video is sponsored by Wren.,2023-04-14
00:01:01.920,00:01:04.710,I don't think people realize just how important concrete is.,2023-04-14
00:01:04.710,00:01:07.020,So here's another way to think about it.,2023-04-14
00:01:07.020,00:01:10.650,"Every year, we make a certain weight of goods out of copper,",2023-04-14
00:01:10.650,00:01:12.360,"more out of aluminum,",2023-04-14
00:01:12.360,00:01:16.110,"and then you have glass, asphalt, lime,",2023-04-14
00:01:16.110,00:01:18.780,"iron is a big one for all the steel,",2023-04-14
00:01:18.780,00:01:21.660,and then there's ceramic and wood.,2023-04-14
00:01:21.660,00:01:24.600,"But by far, the solid product we make the most of,",2023-04-14
00:01:24.600,00:01:28.320,"is cementitious material, essentially cement.",2023-04-14
00:01:28.320,00:01:33.320,We use as much of it as we do all other materials combined.,2023-04-14
00:01:33.450,00:01:35.730,And it's easy to see why.,2023-04-14
00:01:35.730,00:01:38.040,Concrete is liquid rock.,2023-04-14
00:01:38.040,00:01:40.770,You can pour it into any shape you like.,2023-04-14
00:01:40.770,00:01:43.920,It's strong and durable and inexpensive.,2023-04-14
00:01:43.920,00:01:45.870,And it is so easy to produce,2023-04-14
00:01:45.870,00:01:47.610,that people have been making a version of it,2023-04-14
00:01:47.610,00:01:49.740,for thousands of years.,2023-04-14
00:01:52.030,00:01:53.290,"To make primitive cement,",2023-04-14
00:01:53.290,00:01:55.570,"the key ingredient is limestone,",2023-04-14
00:01:55.570,00:01:57.610,which is basically calcium carbonate.,2023-04-14
00:01:57.610,00:02:00.430,"If you heat it up to around 1,000 degrees Celsius,",2023-04-14
00:02:00.430,00:02:03.280,"that drives off CO2 out of the rock,",2023-04-14
00:02:03.280,00:02:07.180,"leaving calcium oxide, which is also known as quicklime.",2023-04-14
00:02:07.180,00:02:10.930,"Now if you grind up the calcium oxide and mix it with water,",2023-04-14
00:02:10.930,00:02:12.550,you get an exothermic reaction,2023-04-14
00:02:12.550,00:02:14.830,"that creates calcium hydroxide,",2023-04-14
00:02:14.830,00:02:17.440,which you can pour into a mold.,2023-04-14
00:02:17.440,00:02:21.400,"And over a time, it will absorb CO2 from the atmosphere,",2023-04-14
00:02:21.400,00:02:26.400,turning back into calcium carbonate as the water evaporates.,2023-04-14
00:02:26.620,00:02:28.420,"Now, that's a pretty good primitive cement.",2023-04-14
00:02:28.420,00:02:31.060,"It's the first way that people ever made cement,",2023-04-14
00:02:31.060,00:02:32.860,but there are several drawbacks to it.,2023-04-14
00:02:32.860,00:02:35.800,"I mean, for one thing, you can't make the molds very big",2023-04-14
00:02:35.800,00:02:39.490,"because otherwise, CO2 can't penetrate all of the material",2023-04-14
00:02:39.490,00:02:40.510,and harden it.,2023-04-14
00:02:40.510,00:02:42.340,"Plus, it's not gonna work underwater",2023-04-14
00:02:42.340,00:02:45.433,where there is no CO2 to harden your mixture.,2023-04-14
00:02:46.270,00:02:49.150,The Romans discovered the solution to these problems.,2023-04-14
00:02:49.150,00:02:51.640,They added volcanic ash called pozzolana,2023-04-14
00:02:51.640,00:02:54.100,to the crushed limestone before heating it up.,2023-04-14
00:02:54.100,00:02:56.770,And they discovered this cement was much stronger,2023-04-14
00:02:56.770,00:02:58.390,and much more durable.,2023-04-14
00:02:58.390,00:02:59.223,They used it,2023-04-14
00:02:59.223,00:03:02.080,to create the largest unreinforced concrete dome,2023-04-14
00:03:02.080,00:03:07.080,"in the world, the Pantheon, which has stood for 2,000 years.",2023-04-14
00:03:07.360,00:03:10.060,"And they built concrete piers into the sea,",2023-04-14
00:03:10.060,00:03:12.130,which hardened underwater.,2023-04-14
00:03:12.130,00:03:14.353,Some of which are still standing today.,2023-04-14
00:03:15.850,00:03:18.460,"I did not expect it to feel this heavy,",2023-04-14
00:03:18.460,00:03:20.410,like it's already really weighing down my feet,2023-04-14
00:03:20.410,00:03:21.580,and making me slightly concerned,2023-04-14
00:03:21.580,00:03:23.770,about being able to get out.,2023-04-14
00:03:23.770,00:03:27.700,What I can tell you is that concrete is about three times,2023-04-14
00:03:27.700,00:03:29.830,as dense as water.,2023-04-14
00:03:29.830,00:03:30.970,- Are you able to lift a leg?,2023-04-14
00:03:30.970,00:03:31.803,I just wanna make sure,2023-04-14
00:03:31.803,00:03:33.220,that you're not gonna have like some suction.,2023-04-14
00:03:33.220,00:03:35.050,"- Yeah, okay, I'm gonna try to lift a leg",2023-04-14
00:03:35.050,00:03:36.460,just to see how bad it's gonna be.,2023-04-14
00:03:36.460,00:03:38.110,What I like is having my feet on the bottom,2023-04-14
00:03:38.110,00:03:39.550,and I'm not sure I can get them back down there,2023-04-14
00:03:39.550,00:03:40.383,"after I lift it up,",2023-04-14
00:03:40.383,00:03:41.500,"but oh, boy.",2023-04-14
00:03:41.500,00:03:43.240,"Okay, so that was like...",2023-04-14
00:03:43.240,00:03:45.590,I'm gonna try to lifting this leg pretty slowly,2023-04-14
00:03:46.600,00:03:48.100,and I was able to lift it.,2023-04-14
00:03:48.100,00:03:49.210,- Right.,2023-04-14
00:03:49.210,00:03:51.940,"- So at least up to this point, I am able to get out.",2023-04-14
00:03:51.940,00:03:54.040,My fear is that the concrete is so dense,2023-04-14
00:03:54.040,00:03:55.510,"that when it gets up around my chest,",2023-04-14
00:03:55.510,00:03:57.040,"it may apply a lot of pressure,",2023-04-14
00:03:57.040,00:03:57.873,making it hard to breathe.,2023-04-14
00:03:57.873,00:03:59.890,Yeah. - It's like being in a trench,2023-04-14
00:03:59.890,00:04:01.387,and having it cave in on you.,2023-04-14
00:04:01.387,00:04:04.240,"You cave in your lungs so you can't breathe,",2023-04-14
00:04:04.240,00:04:05.470,so that once they contract,2023-04-14
00:04:05.470,00:04:07.423,and the weight gets against your lungs.,2023-04-14
00:04:08.350,00:04:09.220,- That's gonna be hard.,2023-04-14
00:04:09.220,00:04:10.900,- Have you thought about that?,2023-04-14
00:04:10.900,00:04:12.550,"- Well, now that you mention it.",2023-04-14
00:04:12.550,00:04:15.550,"But we do have oxygen on hand, just in case.",2023-04-14
00:04:15.550,00:04:18.190,"Earlier, I practiced how I could get out of the bowl",2023-04-14
00:04:18.190,00:04:19.600,if I'm in trouble.,2023-04-14
00:04:19.600,00:04:20.590,- Do you feel that's okay?,2023-04-14
00:04:20.590,00:04:21.541,- That's no problem.,2023-04-14
00:04:21.541,00:04:22.461,"- Okay, great.",2023-04-14
00:04:22.461,00:04:25.711,(truck signal beeping),2023-04-14
00:04:31.630,00:04:34.510,So how did Roman concrete harden underwater?,2023-04-14
00:04:34.510,00:04:38.593,And in thick slabs that CO2 couldn't possibly penetrate?,2023-04-14
00:04:40.000,00:04:44.260,There is a claim that it was superior to modern concrete.,2023-04-14
00:04:44.260,00:04:45.523,"So, was it?",2023-04-14
00:04:46.360,00:04:49.600,"For centuries, the Roman recipe was lost.",2023-04-14
00:04:49.600,00:04:51.280,It was only discovered in a book,2023-04-14
00:04:51.280,00:04:53.800,in a Swiss monastery in the 1400s.,2023-04-14
00:04:53.800,00:04:56.260,"And since then, architects, scientists,",2023-04-14
00:04:56.260,00:04:58.330,and engineers have been experimenting,2023-04-14
00:04:58.330,00:05:00.340,with different cement recipes to try,2023-04-14
00:05:00.340,00:05:02.470,to achieve the best result.,2023-04-14
00:05:02.470,00:05:05.230,"Now it turns out that that incredible strength,",2023-04-14
00:05:05.230,00:05:07.870,"durability, and ability to set underwater",2023-04-14
00:05:07.870,00:05:09.160,"of the Roman cement,",2023-04-14
00:05:09.160,00:05:10.840,"that came from the pozzolana,",2023-04-14
00:05:10.840,00:05:13.060,that volcanic ash that was added.,2023-04-14
00:05:13.060,00:05:15.340,"And nearly 2,000 years later,",2023-04-14
00:05:15.340,00:05:18.580,people discovered that adding clay or shale to the limestone,2023-04-14
00:05:18.580,00:05:22.540,"before it was crushed and heated, produced the same effect.",2023-04-14
00:05:22.540,00:05:26.080,And the reason is that all of these materials contain silica,2023-04-14
00:05:26.080,00:05:30.190,and silica totally changes the chemistry of the cement.,2023-04-14
00:05:30.190,00:05:34.030,It means that it doesn't need to dry in order to harden.,2023-04-14
00:05:34.030,00:05:38.170,"In fact, the water becomes an integral part",2023-04-14
00:05:38.170,00:05:39.850,of that hardened concrete,2023-04-14
00:05:39.850,00:05:42.610,so that it actually achieves maximum strength,2023-04-14
00:05:42.610,00:05:44.473,when it sets underwater.,2023-04-14
00:05:46.270,00:05:49.150,- So this is the compressive cylinder curing room.,2023-04-14
00:05:49.150,00:05:51.910,We're required to maintain the concrete samples,2023-04-14
00:05:51.910,00:05:53.050,in 100% humidity.,2023-04-14
00:05:53.050,00:05:56.950,So we've chose to submerge them in water in a lime bath.,2023-04-14
00:05:56.950,00:05:59.140,- Every time concrete suppliers pour concrete,2023-04-14
00:05:59.140,00:06:00.250,"on a job site,",2023-04-14
00:06:00.250,00:06:02.380,they cast sample cylinders of the material,2023-04-14
00:06:02.380,00:06:03.640,so they can later test it,2023-04-14
00:06:03.640,00:06:06.010,to ensure it has the strength required.,2023-04-14
00:06:06.010,00:06:07.570,- So we actually intercept a little bit,2023-04-14
00:06:07.570,00:06:08.410,of the concrete going,2023-04-14
00:06:08.410,00:06:09.880,into whatever structure they're pouring:,2023-04-14
00:06:09.880,00:06:10.900,"a slab, a wall.",2023-04-14
00:06:10.900,00:06:12.850,"We'll intercept it into a wheelbarrow,",2023-04-14
00:06:12.850,00:06:14.770,"take the wheelbarrow over to our testing station,",2023-04-14
00:06:14.770,00:06:17.350,and start casting these compressive cylinders.,2023-04-14
00:06:17.350,00:06:18.910,"Every day we're breaking these cylinders,",2023-04-14
00:06:18.910,00:06:19.930,checking it for strength.,2023-04-14
00:06:19.930,00:06:21.910,You can see these have been broken today.,2023-04-14
00:06:21.910,00:06:24.100,"- This strength increases over time,",2023-04-14
00:06:24.100,00:06:28.480,"so samples are tested at 7, 14, and 28 days",2023-04-14
00:06:28.480,00:06:31.480,when the concrete is said to have reached full strength.,2023-04-14
00:06:31.480,00:06:33.940,- So what we do is we list the date,2023-04-14
00:06:33.940,00:06:35.950,that there will be placed in the compression machine,2023-04-14
00:06:35.950,00:06:37.450,on top of every cylinder.,2023-04-14
00:06:37.450,00:06:39.970,"- In reality, it will continue strengthening",2023-04-14
00:06:39.970,00:06:40.843,after that.,2023-04-14
00:06:42.790,00:06:45.160,Samples are placed in a hydraulic press,2023-04-14
00:06:45.160,00:06:48.610,and then the pressure is increased on them until they fail.,2023-04-14
00:06:48.610,00:06:49.443,"- All right, ready? - Yeah, let's do it.",2023-04-14
00:06:49.443,00:06:51.070,- I'll start loading. - Sure.,2023-04-14
00:06:51.070,00:06:53.650,- We want to maintain around 30 psi per second.,2023-04-14
00:06:53.650,00:06:55.570,- And it's important to load at that rate.,2023-04-14
00:06:55.570,00:06:56.890,"- Yeah, you don't want to shock it.",2023-04-14
00:06:56.890,00:06:57.760,You don't want to shock it,2023-04-14
00:06:57.760,00:06:59.890,by applying too much load too fast.,2023-04-14
00:06:59.890,00:07:01.901,This middle number is showing us our strength,2023-04-14
00:07:01.901,00:07:04.150,in pounds per square inch.,2023-04-14
00:07:04.150,00:07:05.080,"And then the top number,",2023-04-14
00:07:05.080,00:07:06.940,the big number is showing us the force,2023-04-14
00:07:06.940,00:07:08.260,of pounds we're applying.,2023-04-14
00:07:08.260,00:07:10.413,"- What are we gonna get up to, like 7,000 psi?",2023-04-14
00:07:10.413,00:07:11.246,"- 10,000.",2023-04-14
00:07:11.246,00:07:12.400,"- 10,000.",2023-04-14
00:07:12.400,00:07:13.780,So this is gonna be really strong.,2023-04-14
00:07:13.780,00:07:14.770,- Very strong.,2023-04-14
00:07:14.770,00:07:15.730,- Okay. - Yeah.,2023-04-14
00:07:15.730,00:07:16.840,- It's always fun when we get something,2023-04-14
00:07:16.840,00:07:19.960,"over 10,000 in a free show.",2023-04-14
00:07:19.960,00:07:20.793,Bang!,2023-04-14
00:07:20.793,00:07:22.680,- It'll shake this room.,2023-04-14
00:07:22.680,00:07:24.393,- And it has reinforced concrete walls.,2023-04-14
00:07:27.040,00:07:31.960,- It's amazingly just like you can't see anything happening,2023-04-14
00:07:31.960,00:07:33.613,even under all that pressure.,2023-04-14
00:07:34.450,00:07:35.786,- It's still holding.,2023-04-14
00:07:35.786,00:07:36.877,"- I know, right?",2023-04-14
00:07:36.877,00:07:37.710,"- Oh, here it goes.",2023-04-14
00:07:37.710,00:07:38.543,- It's starting to dry. - Really?,2023-04-14
00:07:38.543,00:07:39.830,"- Here it goes. - 11,000.",2023-04-14
00:07:39.830,00:07:40.663,- Mm-hmm.,2023-04-14
00:07:41.890,00:07:43.543,"- Over 11,000 now.",2023-04-14
00:07:45.091,00:07:47.170,(cement cylinder pops),2023-04-14
00:07:47.170,00:07:48.689,Oh yeah!,2023-04-14
00:07:48.689,00:07:49.522,- It still got a life.,2023-04-14
00:07:49.522,00:07:51.539,"Having it, it didn't even- - Fun.",2023-04-14
00:07:51.539,00:07:52.453,(Derek laughs),2023-04-14
00:07:52.453,00:07:53.762,- It's my favorite part.,2023-04-14
00:07:53.762,00:07:57.095,(cement cylinder blows),2023-04-14
00:07:59.722,00:08:01.719,"- Yeah, that's cool!",2023-04-14
00:08:01.719,00:08:02.863,"- Let's see. - Yeah, I like that.",2023-04-14
00:08:02.863,00:08:05.230,- Like the strongest concrete in the world.,2023-04-14
00:08:05.230,00:08:06.063,"- Well, the strongest concrete",2023-04-14
00:08:06.063,00:08:08.980,in the world is gonna be like a lab-only thing.,2023-04-14
00:08:08.980,00:08:13.210,"- In a competition, it was above 100,000 psi.",2023-04-14
00:08:13.210,00:08:15.250,"- Today, virtually all concrete is made",2023-04-14
00:08:15.250,00:08:17.950,with a cement formulation discovered in the 1840s.,2023-04-14
00:08:17.950,00:08:20.110,"It's known as Portland cement,",2023-04-14
00:08:20.110,00:08:22.690,but the name is really just a marketing term.,2023-04-14
00:08:22.690,00:08:24.910,"You know, they claimed that the gray color",2023-04-14
00:08:24.910,00:08:28.540,"of the cement would resemble these very desirable rocks,",2023-04-14
00:08:28.540,00:08:32.050,"which were quarried near the town of Portland, England.",2023-04-14
00:08:32.050,00:08:35.620,But the Portland cement was made by crushing up limestone,2023-04-14
00:08:35.620,00:08:37.720,and then mixing it with a certain percentage,2023-04-14
00:08:37.720,00:08:40.900,of shale or clay to provide the silicates.,2023-04-14
00:08:40.900,00:08:43.450,And that was all ground up into a fine powder,2023-04-14
00:08:43.450,00:08:46.990,and put in a kiln and heated to very high temperatures.,2023-04-14
00:08:46.990,00:08:51.340,And what comes out are these nodules that are really hard.,2023-04-14
00:08:51.340,00:08:52.870,They're called clinker.,2023-04-14
00:08:52.870,00:08:54.490,"Now, it's suspected that cement chemists",2023-04-14
00:08:54.490,00:08:56.980,in the past may have produced clinker by accident,2023-04-14
00:08:56.980,00:08:59.530,when they overcooked their lime mixtures.,2023-04-14
00:08:59.530,00:09:03.070,"But since this clinker is so hard to grind down,",2023-04-14
00:09:03.070,00:09:05.380,they just considered it waste.,2023-04-14
00:09:05.380,00:09:07.120,"But if you do grind it down,",2023-04-14
00:09:07.120,00:09:10.210,the cement that it produces is far superior,2023-04-14
00:09:10.210,00:09:12.970,"to basically any other chemistry we've discovered,",2023-04-14
00:09:12.970,00:09:15.820,which is why it is so commonly used today.,2023-04-14
00:09:15.820,00:09:18.910,Now there are lots of compounds inside Portland cement.,2023-04-14
00:09:18.910,00:09:22.333,The most common one is tricalcium silicate.,2023-04-14
00:09:23.590,00:09:26.500,"I'm now feeling incredibly buoyant,",2023-04-14
00:09:26.500,00:09:29.020,"like I am now floating in concrete,",2023-04-14
00:09:29.020,00:09:30.220,which is pretty ridiculous,2023-04-14
00:09:30.220,00:09:33.790,because most of my body is out of the material.,2023-04-14
00:09:33.790,00:09:36.160,"But because it's three times as dense as water,",2023-04-14
00:09:36.160,00:09:39.250,you can float just up to your waist.,2023-04-14
00:09:39.250,00:09:40.750,This is totally unexpected.,2023-04-14
00:09:40.750,00:09:43.960,"I did not expect to be able to, like, float in concrete.",2023-04-14
00:09:43.960,00:09:45.250,My feet are off the floor.,2023-04-14
00:09:45.250,00:09:47.337,That's where my feet are.,2023-04-14
00:09:47.337,00:09:48.880,- My feet are here and my shoulders are up,2023-04-14
00:09:48.880,00:09:52.780,and I'm just being pushed up out of this.,2023-04-14
00:09:52.780,00:09:54.340,"Once you have the cement powder,",2023-04-14
00:09:54.340,00:09:55.960,the other things you need to make concrete,2023-04-14
00:09:55.960,00:09:58.714,"are the aggregates, sand, and gravel.",2023-04-14
00:09:58.714,00:10:00.730,(quarry blasting),2023-04-14
00:10:00.730,00:10:03.043,These are blasted out of a quarry.,2023-04-14
00:10:04.600,00:10:07.690,Then they're ground up to be particular sizes.,2023-04-14
00:10:07.690,00:10:10.000,There are very strict requirements about the sizes,2023-04-14
00:10:10.000,00:10:11.830,"and shapes of the aggregate,",2023-04-14
00:10:11.830,00:10:13.210,which is gonna get poured into the concrete,2023-04-14
00:10:13.210,00:10:16.240,"because, of course, that will affect the strength",2023-04-14
00:10:16.240,00:10:17.770,of the concrete that results.,2023-04-14
00:10:17.770,00:10:21.880,"- Yeah, this is a just a well-grated concrete sand.",2023-04-14
00:10:21.880,00:10:24.790,The most well-rounded material helps the contractor,2023-04-14
00:10:24.790,00:10:27.333,as far as their finishability goes.,2023-04-14
00:10:27.333,00:10:28.840,"- You know when they're running that trowel over that slab,",2023-04-14
00:10:28.840,00:10:30.490,"they want a rounded particle,",2023-04-14
00:10:30.490,00:10:32.410,not a jagged crushed particle.,2023-04-14
00:10:32.410,00:10:34.660,- Do you really want like a spherical sand?,2023-04-14
00:10:34.660,00:10:35.493,"- Around it, yeah,",2023-04-14
00:10:35.493,00:10:36.326,"a spherical sand,",2023-04-14
00:10:36.326,00:10:37.930,"like a river stone,",2023-04-14
00:10:37.930,00:10:39.490,like a river sand.,2023-04-14
00:10:39.490,00:10:42.520,Designers on the strip want to pour concrete elevated.,2023-04-14
00:10:42.520,00:10:44.980,They want to lighten up the load of the deck.,2023-04-14
00:10:44.980,00:10:47.080,We'll incorporate some lightweight aggregate,2023-04-14
00:10:47.080,00:10:48.642,in place of this normal weight.,2023-04-14
00:10:48.642,00:10:51.250,(rocks rattling),2023-04-14
00:10:51.250,00:10:52.330,3/8 size.,2023-04-14
00:10:52.330,00:10:55.360,"Typical concrete will weigh 150 pounds per cubic foot,",2023-04-14
00:10:55.360,00:10:56.260,normal weight.,2023-04-14
00:10:56.260,00:11:00.010,This gets us about 110 pounds per cubic foot.,2023-04-14
00:11:06.430,00:11:08.380,- The aggregates are hauled to the concrete plant,2023-04-14
00:11:08.380,00:11:09.370,in big trucks.,2023-04-14
00:11:09.370,00:11:10.990,"All right, I'm gonna release the rock,",2023-04-14
00:11:10.990,00:11:13.300,(hydraulics hissing),2023-04-14
00:11:13.300,00:11:14.301,where they're dumped,2023-04-14
00:11:14.301,00:11:17.800,(rocks rattling),2023-04-14
00:11:17.800,00:11:18.670,and then they travel,2023-04-14
00:11:18.670,00:11:22.240,on big conveyor belts up into storage piles.,2023-04-14
00:11:22.240,00:11:24.490,These get loaded into big hoppers,2023-04-14
00:11:24.490,00:11:27.340,and then weighed out and poured into the trucks.,2023-04-14
00:11:27.340,00:11:29.230,- Control operators can open this gate,2023-04-14
00:11:29.230,00:11:31.810,"and drop material into this hopper,",2023-04-14
00:11:31.810,00:11:33.943,down into the mixer truck below.,2023-04-14
00:11:35.590,00:11:38.743,This is where the batch operator's controlling the plant.,2023-04-14
00:11:40.480,00:11:42.760,"Right here in front of our batch operator, William,",2023-04-14
00:11:42.760,00:11:45.280,is the actual recipe that he's gonna dispense,2023-04-14
00:11:45.280,00:11:46.900,into the concrete mixer.,2023-04-14
00:11:46.900,00:11:50.080,Each line represents a different component in the concrete.,2023-04-14
00:11:50.080,00:11:52.270,That top one there is a 3/4 rock.,2023-04-14
00:11:52.270,00:11:54.370,We have an intermediate 3/8 rock below it,2023-04-14
00:11:54.370,00:11:55.360,and there's your sand.,2023-04-14
00:11:55.360,00:11:57.070,"Over here in this column,",2023-04-14
00:11:57.070,00:11:59.650,"he's targeting, for instance, 3/4 rock.",2023-04-14
00:11:59.650,00:12:04.480,"He wants to hit 13,000 pounds of material for that load.",2023-04-14
00:12:04.480,00:12:09.373,"The computer's gonna try to hit 13,042 pounds of 3/4 rock.",2023-04-14
00:12:11.680,00:12:13.090,- So everything's...,2023-04-14
00:12:13.090,00:12:13.955,- Everything's weighed up-,2023-04-14
00:12:13.955,00:12:14.943,- Filling up? - Right now.,2023-04-14
00:12:15.880,00:12:17.230,- Now if he goes out tolerance,2023-04-14
00:12:17.230,00:12:18.460,"and he overshoots a target,",2023-04-14
00:12:18.460,00:12:19.990,"it's gonna change the red,",2023-04-14
00:12:19.990,00:12:20.863,a red color.,2023-04-14
00:12:21.790,00:12:22.870,"Up here on this screen,",2023-04-14
00:12:22.870,00:12:25.060,we're actually showing the holding hopper.,2023-04-14
00:12:25.060,00:12:27.310,This material he's weighing is directly,2023-04-14
00:12:27.310,00:12:30.060,above the mixer truck that just pulled under the plant.,2023-04-14
00:12:31.240,00:12:33.100,"- What about the water, William,",2023-04-14
00:12:33.100,00:12:34.510,being orange?,2023-04-14
00:12:34.510,00:12:35.864,"- Yeah, we're a little under on that.",2023-04-14
00:12:35.864,00:12:36.697,- Okay.,2023-04-14
00:12:36.697,00:12:38.770,- But we can always add little water.,2023-04-14
00:12:38.770,00:12:39.603,- Yeah.,2023-04-14
00:12:39.603,00:12:40.660,- We cannot take it away.,2023-04-14
00:12:42.640,00:12:45.720,"All right, I'm gonna take a look inside the truck here.",2023-04-14
00:12:45.720,00:12:48.340,(rotary gears whining),2023-04-14
00:12:48.340,00:12:52.063,That's what it looks like down inside a cement truck.,2023-04-14
00:12:53.110,00:12:55.390,So I was interested to see what would be the difference,2023-04-14
00:12:55.390,00:12:58.750,"in strength between pure cement, cement with sand,",2023-04-14
00:12:58.750,00:13:00.550,and cement with sand and gravel,2023-04-14
00:13:00.550,00:13:02.740,like the typical concrete mix that they would make.,2023-04-14
00:13:02.740,00:13:04.930,So I had them make up these special cylinders,2023-04-14
00:13:04.930,00:13:07.000,and test them in the hydraulic press.,2023-04-14
00:13:07.000,00:13:09.910,"You might think that since pure cement has the most glue,",2023-04-14
00:13:09.910,00:13:11.230,it would be the strongest.,2023-04-14
00:13:11.230,00:13:13.210,"- Cement's the magic, right?",2023-04-14
00:13:13.210,00:13:14.260,The glue.,2023-04-14
00:13:14.260,00:13:15.490,So if we lessen,2023-04-14
00:13:15.490,00:13:18.070,"or lower the amount of cement per unit volume,",2023-04-14
00:13:18.070,00:13:19.450,we're gonna have less strength.,2023-04-14
00:13:19.450,00:13:21.550,"- [Derek] But when we tested the pure cement cylinder,",2023-04-14
00:13:21.550,00:13:24.029,it fractured a lot as the load was applied.,2023-04-14
00:13:24.029,00:13:25.390,(cement cylinder pops),2023-04-14
00:13:25.390,00:13:26.320,Is that it?,2023-04-14
00:13:26.320,00:13:27.153,- No.,2023-04-14
00:13:27.153,00:13:28.390,- Not officially. - Looks like it keep going.,2023-04-14
00:13:28.390,00:13:29.650,It can take some more pressure.,2023-04-14
00:13:29.650,00:13:30.493,What?,2023-04-14
00:13:30.493,00:13:31.630,(cement cylinder pops),2023-04-14
00:13:31.630,00:13:32.770,"- 8,000 psi,",2023-04-14
00:13:32.770,00:13:33.613,now it failed.,2023-04-14
00:13:34.570,00:13:36.553,"- Now, cement plus sand.",2023-04-14
00:13:37.389,00:13:40.600,(cement cylinder blows),2023-04-14
00:13:40.600,00:13:43.303,"9,163 psi - Again.",2023-04-14
