Start Time,End Time,Text
00:15:20.040,00:15:22.950,"in how much charge can be absorbed by the screen,"
00:15:22.950,00:15:25.320,"and increasing the light intensity saturates"
00:15:25.320,00:15:27.270,"that component of the circuit."
00:15:27.270,00:15:29.700,"- But what happens if we push image intensification"
00:15:29.700,00:15:31.320,"to its opposite limit,"
00:15:31.320,00:15:34.263,"by using the goggles in a room with no light at all?"
00:15:35.670,00:15:38.070,"If you want to test night vision goggles,"
00:15:38.070,00:15:38.910,"you gotta go to the place"
00:15:38.910,00:15:41.850,"where it is absolutely pitch dark,"
00:15:41.850,00:15:46.080,"underground, all sealed off, basically no photons."
00:15:46.080,00:15:48.210,"It's gonna be completely disorienting."
00:15:48.210,00:15:50.430,"- So we're in an underground range here"
00:15:50.430,00:15:52.110,"at the Navy base, Crane."
00:15:52.110,00:15:56.190,"And this place is usually used to test small arms weapons,"
00:15:56.190,00:15:59.970,"but we can also seal it up and make it very dark,"
00:15:59.970,00:16:00.990,"all the way down to"
00:16:00.990,00:16:03.990,"where there's almost no visible light whatsoever."
00:16:03.990,00:16:07.020,"- So there's basically zero light in here,"
00:16:07.020,00:16:08.087,"almost no photons."
00:16:08.087,00:16:09.960,"- In the visible. That's right."
00:16:09.960,00:16:12.270,"- We are now going to turn off all the lights,"
00:16:12.270,00:16:14.880,"make it completely pitch black in here,"
00:16:14.880,00:16:18.930,"but on top of that, the range is full of smoke."
00:16:18.930,00:16:20.820,"So even with night vision goggles,"
00:16:20.820,00:16:23.460,"we might have no luck at all."
00:16:23.460,00:16:25.620,"If you are in pure darkness for a long period of time,"
00:16:25.620,00:16:27.270,"what happens?"
00:16:27.270,00:16:28.920,"- You start to feel a little strange."
00:16:28.920,00:16:30.450,"Kind of like being in an anechoic chamber,"
00:16:30.450,00:16:31.950,"where you can't hear things."
00:16:31.950,00:16:34.740,"The lack of sensory perception can sometimes start"
00:16:34.740,00:16:39.000,"to give a little bit of vertigo or uneasy feeling to some."
00:16:39.000,00:16:40.380,"- Okay."
00:16:40.380,00:16:42.210,"- Three, two, one."
00:16:43.470,00:16:44.613,"- Pitch darkness."
00:16:46.110,00:16:47.553,"Okay, my night vision's on."
00:16:48.660,00:16:51.540,"- Wow, I actually can't see anything through these."
00:16:51.540,00:16:54.000,"- With PBS-31As in pure darkness,"
00:16:54.000,00:16:58.200,"you mainly just see their analog processing in effect."
00:16:58.200,00:17:00.090,"- Oh my god, it just looks like a blizzard."
00:17:00.090,00:17:04.410,"- When I look that way, I see almost nothing."
00:17:04.410,00:17:06.510,"I just get snow."
00:17:06.510,00:17:08.880,"All this noise comes from electrons getting pulled"
00:17:08.880,00:17:11.010,"through the goggles in two ways."
00:17:11.010,00:17:13.080,"One is thermionic emission."
00:17:13.080,00:17:14.550,"Just due to thermal energy,"
00:17:14.550,00:17:18.270,"some electrons will have enough energy to escape the metal."
00:17:18.270,00:17:20.850,"And the other is due to the electric field."
00:17:20.850,00:17:23.550,"There's such a strong electric field in that tube"
00:17:23.550,00:17:27.600,"that it'll pull some electrons off the photo cathode."
00:17:27.600,00:17:28.433,"Can you make out the face?"
00:17:28.433,00:17:29.370,"'Cause I mean,"
00:17:29.370,00:17:31.260,"there's a little bit of light coming out of the goggles,"
00:17:31.260,00:17:32.790,"which might hit my face."
00:17:32.790,00:17:34.200,"Because image intensification"
00:17:34.200,00:17:36.570,"can only amplify existing light,"
00:17:36.570,00:17:39.600,"its one limitation is that it requires a light source."
00:17:39.600,00:17:43.050,"It can be tiny, but there has to be something."
00:17:43.050,00:17:46.170,"If you're in absolute darkness,"
00:17:46.170,00:17:48.480,"even active illumination is a better bet."
00:17:48.480,00:17:50.220,"Now, this is advantageous"
00:17:50.220,00:17:53.400,"because if you're in a really black room,"
00:17:53.400,00:17:55.980,"then you do kind of need to light it a little bit."
00:17:55.980,00:17:59.400,"Unless you use the final type of night vision:"
00:17:59.400,00:18:00.393,"thermal imaging."
00:18:01.350,00:18:04.710,"With my naked eye, I can't make out the exit sign,"
00:18:04.710,00:18:06.813,"but with the goggles I know it's up there."
00:18:07.950,00:18:09.660,"While image intensification attempts"
00:18:09.660,00:18:11.280,"to match your normal vision,"
00:18:11.280,00:18:13.650,"thermal imaging goes beyond it."
00:18:13.650,00:18:15.720,"In the electromagnetic spectrum,"
00:18:15.720,00:18:18.270,"the infrared range has longer wavelengths"
00:18:18.270,00:18:19.860,"than the visible range."
00:18:19.860,00:18:21.270,"All the shorter wavelengths up"
00:18:21.270,00:18:24.330,"to mid-wave infrared light are reflective,"
00:18:24.330,00:18:27.210,"meaning that everyday objects don't emit these wavelengths"
00:18:27.210,00:18:28.043,"on their own."
00:18:28.043,00:18:29.550,"You need a light source."
00:18:29.550,00:18:32.610,"To see my shirt, we can't be in the dark."
00:18:32.610,00:18:35.880,"You need visible light to reflect the blue to your eyes."
00:18:35.880,00:18:38.130,"And that's why we needed the near-infrared lights"
00:18:38.130,00:18:40.590,"on the active illumination devices."
00:18:40.590,00:18:43.590,"But the long infrared range is actually emissive,"
00:18:43.590,00:18:46.410,"meaning that it doesn't need a light source at all."
00:18:46.410,00:18:49.650,"That's because all objects emit electromagnetic radiation,"
00:18:49.650,00:18:52.740,"and the shape of their spectra follows Planck's law."
00:18:52.740,00:18:55.050,"You can see that only extremely hot objects"
00:18:55.050,00:18:56.970,"like stars have significant emission"
00:18:56.970,00:18:59.130,"in the shorter wavelengths like visible light,"
00:18:59.130,00:19:02.343,"but virtually everything emits in the infrared."
00:19:03.960,00:19:05.730,"Because thermal imaging doesn't require"
00:19:05.730,00:19:08.400,"any external light, like image intensifiers do,"
00:19:08.400,00:19:10.350,"and it doesn't need to create its own light,"
00:19:10.350,00:19:11.970,"like active illuminators do,"
00:19:11.970,00:19:15.030,"it's undefeated in completely black situations"
00:19:15.030,00:19:16.980,"like the underground range."
00:19:16.980,00:19:18.270,"It's also the best choice"
00:19:18.270,00:19:21.450,"when there's fog or smoke obstructing your view."
00:19:21.450,00:19:25.320,"I am about to walk into the fog in this range,"
00:19:25.320,00:19:28.380,"and we'll see if I disappear in the visible,"
00:19:28.380,00:19:29.790,"and then you guys can look and see"
00:19:29.790,00:19:32.880,"if we can pick me up on the infrared cameras."
00:19:32.880,00:19:34.875,"- Yeah, I can't see you at all now."
00:19:34.875,00:19:37.875,"(mischievous music)"
00:19:43.560,00:19:45.210,"Derek's getting his full workout."
00:19:53.159,00:19:57.576,"- Whew. I had no idea we'd be so emissive down there."
00:19:58.470,00:20:01.710,"Thermal imaging also sees things your eyes never could,"
00:20:01.710,00:20:04.590,"like objects that have been buried underground"
00:20:04.590,00:20:07.323,"or recently touched by someone's hand."
00:20:09.660,00:20:11.490,"The last advantage of thermal imaging"
00:20:11.490,00:20:13.230,"is its unbeatable range,"
00:20:13.230,00:20:15.750,"even better than the military night vision goggles."
00:20:15.750,00:20:18.300,"We set up a distance test hundreds of meters away"
00:20:18.300,00:20:21.150,"from the tower to compare the infrared cameras"
00:20:21.150,00:20:23.250,"against the PVS-31As."
00:20:23.250,00:20:25.080,"To the naked eye on a moonless night,"
00:20:25.080,00:20:27.870,"this is what someone holding a cigarette lighter looks like"
00:20:27.870,00:20:29.670,"at that distance."
00:20:29.670,00:20:32.363,"This is how it looks through the night vision goggles."
00:20:33.540,00:20:37.113,"And this is how it looks through the infrared cameras."
00:20:38.190,00:20:41.010,"To get even more subtle and remove all direct light,"
00:20:41.010,00:20:43.200,"this is what a person checking their phone looks like"
00:20:43.200,00:20:44.580,"in those conditions."
00:20:44.580,00:20:46.593,"Totally invisible to the naked eye,"
00:20:47.580,00:20:49.410,"discernible through the night vision goggles,"
00:20:49.410,00:20:53.550,"and perfectly clear through the infrared cameras."
00:20:53.550,00:20:56.550,"But thermal imaging has its weaknesses as well."
00:20:56.550,00:20:58.080,"It's a digital system"
00:20:58.080,00:21:01.080,"with motion delays just like active illumination."
00:21:01.080,00:21:03.120,"Thermal imaging goggles aren't popular"
00:21:03.120,00:21:06.240,"because high-quality infrared cameras are too big"
00:21:06.240,00:21:08.223,"and too power hungry to be portable."
00:21:09.330,00:21:11.880,"And since they only detect thermal radiation,"
00:21:11.880,00:21:14.820,"they can't even see lettering on signs, for example."
00:21:14.820,00:21:16.890,"This is looking at it in the infrared."
00:21:16.890,00:21:21.890,"E, F, P, T, O, Z, L, P, E, D."
00:21:22.050,00:21:23.760,"Anything that is visible solely due"
00:21:23.760,00:21:25.500,"to the way light reflects off it"
00:21:25.500,00:21:27.600,"is invisible to thermal cameras."
00:21:27.600,00:21:31.440,"E, D, F, C. I don't know what that is."
00:21:31.440,00:21:34.525,"Z, F, or Z, P."
00:21:34.525,00:21:36.000,"(bell dinging)"
00:21:36.000,00:21:39.120,"Currently there is no one best type of night vision."
00:21:39.120,00:21:42.000,"They all have trade-offs between things like resolution,"
00:21:42.000,00:21:46.110,"delay, light situation, concealment, and portability."
00:21:46.110,00:21:48.870,"The entire history of night vision has been driven"
00:21:48.870,00:21:51.243,"by trying to minimize these trade-offs."
00:21:52.530,00:21:54.090,"The first night vision technology,"
00:21:54.090,00:21:55.260,"known as Gen 0,"
00:21:55.260,00:21:58.230,"was developed for sniper scopes during World War II"
00:21:58.230,00:21:59.670,"and the Korean War."
00:21:59.670,00:22:02.310,"They used active infrared illumination,"
00:22:02.310,00:22:05.280,"much like the commercial night vision goggles of today."
00:22:05.280,00:22:08.670,"Then Gen 1 night vision was developed for the Vietnam War."
00:22:08.670,00:22:11.340,"These used basic image intensifier tubes"
00:22:11.340,00:22:13.560,"with just a photo cathode and screen."
00:22:13.560,00:22:15.600,"No microchannel plate."
00:22:15.600,00:22:17.550,"They stacked three of them together in a row,"
00:22:17.550,00:22:21.030,"making them extremely bulky and distorted to look through."
00:22:21.030,00:22:23.010,"But the resulting scopes were sensitive enough"
00:22:23.010,00:22:25.920,"to operate just off light from the Moon and stars,"
00:22:25.920,00:22:28.260,"giving them the nickname Starlight."
00:22:28.260,00:22:31.080,"Gen 2 night vision was developed in the '60s and '70s"
00:22:31.080,00:22:32.550,"and added the microchannel plate"
00:22:32.550,00:22:34.410,"to the image intensifier tube,"
00:22:34.410,00:22:36.780,"increasing sensitivity so that they could be used"
00:22:36.780,00:22:40.470,"in dark conditions, like on cloudy or moonless nights."
00:22:40.470,00:22:43.800,"This addition also made the tubes much more compact,"
00:22:43.800,00:22:46.440,"allowing the first sets of handheld night vision goggles"
00:22:46.440,00:22:47.373,"to be created."
00:22:48.300,00:22:50.010,"The last generation, Gen 3,"
00:22:50.010,00:22:52.470,"became available in the late '80s."
00:22:52.470,00:22:54.570,"These changed the photocathode material"
00:22:54.570,00:22:56.670,"into the semiconductor gallium arsenide"
00:22:56.670,00:22:59.670,"in order to better convert photons to electrons."
00:22:59.670,00:23:01.590,"They also coated the microchannel plate"
00:23:01.590,00:23:04.500,"with an ion barrier film to increase the life"
00:23:04.500,00:23:08.490,"of the tube from 3,000 to 10,000 hours."
00:23:08.490,00:23:10.860,"Though there hasn't been an official new generation"
00:23:10.860,00:23:13.080,"of night vision goggles in over 30 years,"
00:23:13.080,00:23:16.680,"researchers are constantly working on new improvements."
00:23:16.680,00:23:19.440,"- Some of the basic research aspects"
00:23:19.440,00:23:21.690,"that I can talk about are looking at"
00:23:21.690,00:23:26.130,"how to extend the infrared regime"
00:23:26.130,00:23:28.560,"of the detectors overall."
00:23:28.560,00:23:31.770,"Looking at areas to have devices"
00:23:31.770,00:23:33.690,"that can see farther into the infrared"
00:23:33.690,00:23:36.000,"with less noise than what we can today."
00:23:36.000,00:23:38.640,"- How did you get into night vision goggles?"
00:23:38.640,00:23:41.490,"- I was in the Marine Corps in infantry in early 2000s,"
00:23:41.490,00:23:43.470,"and we still used a similar model"
00:23:43.470,00:23:46.590,"as this one right here in Operation Iraqi Freedom."
00:23:46.590,00:23:48.420,"That was one of the actually driving factors"
00:23:48.420,00:23:49.590,"of why I got into this field."
00:23:49.590,00:23:51.840,"I was using things like this"
00:23:51.840,00:23:53.610,"that were good, but not great."
00:23:53.610,00:23:54.750,"You know, they could have been better."
00:23:54.750,00:23:56.310,"We were also using infrared systems"
00:23:56.310,00:23:58.800,"that were not good at all."
00:23:58.800,00:24:02.250,"And so kind of using those in the field"
00:24:02.250,00:24:04.530,"and feeling like, you know,"
00:24:04.530,00:24:06.509,"asking that question to yourself,"
00:24:06.509,00:24:08.250,"why is it not better?"
00:24:08.250,00:24:09.960,"- And the value of night vision extends"
00:24:09.960,00:24:12.000,"far beyond the military."
00:24:12.000,00:24:14.460,"What sort of applications would people use"
00:24:14.460,00:24:15.630,"these goggles for?"
00:24:15.630,00:24:18.810,"- Search and rescue or places where maybe there's not power."
00:24:18.810,00:24:20.127,"It's too dark to see,"
00:24:20.127,00:24:22.680,"and you wanna be able to do things quickly."
00:24:22.680,00:24:25.800,"- Thermal imaging has grown to become an entire industry,"
00:24:25.800,00:24:27.840,"with infrared cameras used in everything"
00:24:27.840,00:24:30.390,"from firefighting to building inspections,"
00:24:30.390,00:24:32.430,"to medical imaging."
00:24:32.430,00:24:34.590,"And the microchannel plate first developed"
00:24:34.590,00:24:37.950,"for night vision now sits aboard space telescopes,"
00:24:37.950,00:24:40.230,"like the Chandra X-ray Observatory,"
00:24:40.230,00:24:42.420,"helping us discover the hidden world"
00:24:42.420,00:24:45.240,"beyond what is simply visible by eye."
00:24:45.240,00:24:46.980,"- Wow, that's beautiful."
00:24:46.980,00:24:50.103,"I'm like, there are like, tears in my eyes."
00:24:51.360,00:24:53.520,"Okay, I'm good. (laughs)"
00:24:53.520,00:24:55.350,"I feel like no one can see me 'cause it's in the dark,"
00:24:55.350,00:24:57.630,"but you probably can, if you have night vision on."
00:24:57.630,00:25:01.320,"(gentle piano music)"
00:25:01.320,00:25:05.320,"(machine whirring and trilling)"
00:25:06.930,00:25:10.170,"- Testing this night vision technology perfectly illustrates"
00:25:10.170,00:25:13.260,"how there is no substitute for hands-on exploration"
00:25:13.260,00:25:15.780,"to truly appreciate new innovations."
00:25:15.780,00:25:17.040,"But you don't have to go all the way"
00:25:17.040,00:25:20.760,"to a military base to get hands-on with cutting edge tech."
00:25:20.760,00:25:22.770,"- In fact, you can do it from anywhere"
00:25:22.770,00:25:24.630,"with this video sponsor, Brilliant."
00:25:24.630,00:25:27.000,"And you can get started for free today."
00:25:27.000,00:25:31.050,"Just go to brilliant.org/veritasium."
00:25:31.050,00:25:33.210,"Brilliant is the best way to master key concepts"
00:25:33.210,00:25:35.820,"in everything from technology to math,"
00:25:35.820,00:25:38.700,"data science, programming, you name it."
00:25:38.700,00:25:39.630,"Just set your goal,"
00:25:39.630,00:25:42.390,"and Brilliant will design a path to get you there."
00:25:42.390,00:25:45.052,"And if your goal is keeping pace with the latest tech,"
00:25:45.052,00:25:46.350,"Brilliant's latest course,"
00:25:46.350,00:25:48.120,"How Large Language Models Work,"
00:25:48.120,00:25:50.310,"is the perfect place to start."
00:25:50.310,00:25:52.560,"How Large Language Models Work takes you"
00:25:52.560,00:25:54.600,"under the hood of real language models,"
00:25:54.600,00:25:57.150,"demystifying technologies like ChatGPT"
00:25:57.150,00:25:58.980,"with interactive lessons on everything"
00:25:58.980,00:26:00.960,"from how models build vocabulary"
00:26:00.960,00:26:03.450,"to how they choose their next word."
00:26:03.450,00:26:05.520,"You'll learn how to tune large language models"
00:26:05.520,00:26:07.740,"to your desired flavor of output."
00:26:07.740,00:26:09.120,"And you'll understand why training"
00:26:09.120,00:26:12.060,"is everything by comparing models trained"
00:26:12.060,00:26:13.500,"on Taylor Swift lyrics"
00:26:13.500,00:26:16.620,"and the legalese of big tech's terms and conditions."
00:26:16.620,00:26:18.210,"This isn't just another course."
00:26:18.210,00:26:20.220,"It's an immersive AI workshop"
00:26:20.220,00:26:22.470,"for you to experience and harness the mechanics"
00:26:22.470,00:26:24.630,"of today's most advanced tool."
00:26:24.630,00:26:26.580,"Beyond their courses on the latest tech,"
00:26:26.580,00:26:29.130,"Brilliant has a massive library of content,"
00:26:29.130,00:26:30.660,"all with that hands-on approach"
00:26:30.660,00:26:32.370,"that makes concepts in math, science,"
00:26:32.370,00:26:35.250,"and programming incredibly easy to understand."
00:26:35.250,00:26:38.730,"And the best part is you can learn with Brilliant on the go."
00:26:38.730,00:26:40.860,"It's like having interactive lessons"
00:26:40.860,00:26:42.660,"about our videos in your pocket."
00:26:42.660,00:26:44.640,"They're always coming out with new courses"
00:26:44.640,00:26:46.230,"to cover the latest innovations."
00:26:46.230,00:26:49.170,"So no matter what comes next in the world of tech,"
00:26:49.170,00:26:50.820,"rest assured you'll be able to learn"
00:26:50.820,00:26:52.800,"about it right away on Brilliant."
00:26:52.800,00:26:54.690,"To try everything Brilliant has to offer"
00:26:54.690,00:26:56.160,"for free for 30 days,"
00:26:56.160,00:26:59.070,"visit brilliant.org/veritasium."
00:26:59.070,00:27:01.470,"I will put that link down in the description."
00:27:01.470,00:27:03.390,"And the first 200 of you to sign up"
00:27:03.390,00:27:07.080,"will get 20% off a Brilliant annual premium subscription."
00:27:07.080,00:27:09.360,"So I wanna thank Brilliant for sponsoring this video,"
00:27:09.360,00:27:11.553,"and I want to thank you for watching."
00:27:13.050,00:27:13.900,"Watching. Get it?"
