Start Time,End Time,Text
00:16:44.280,00:16:47.610,"resulting in an atomic explosion."
00:16:47.610,00:16:49.290,"Despite the simple design,"
00:16:49.290,00:16:51.180,"it is not very efficient."
00:16:51.180,00:16:53.818,"Only a small percentage of the uranium undergoes fission,"
00:16:53.818,00:16:57.210,"so the total yield of the bomb is much smaller."
00:16:57.210,00:17:00.090,"You also run into some unexpected problems,"
00:17:00.090,00:17:01.920,"like how do you make sure the uranium"
00:17:01.920,00:17:04.185,"slides smoothly through the barrel?"
00:17:04.185,00:17:08.190,"Well, you use oil to lubricate the barrel,"
00:17:08.190,00:17:10.650,"but all the synthetic oils the scientists tried"
00:17:10.650,00:17:12.120,"would dry up."
00:17:12.120,00:17:12.960,"In the end,"
00:17:12.960,00:17:15.720,"the only oil they could find that would work"
00:17:15.720,00:17:18.393,"was the oil from sperm whales."
00:17:20.400,00:17:25.400,"Only about 0.7% of naturally occurring uranium is U235,"
00:17:25.620,00:17:28.440,"the fissile fuel for nuclear bombs."
00:17:28.440,00:17:31.050,"When U235 absorbs a neutron,"
00:17:31.050,00:17:33.540,"it briefly becomes U236,"
00:17:33.540,00:17:36.300,"and then it rips itself roughly in half"
00:17:36.300,00:17:40.560,"and releases on average 2.4 neutrons per fission."
00:17:40.560,00:17:42.480,"But when you get uranium outta the ground,"
00:17:42.480,00:17:44.490,"most of it is U238,"
00:17:44.490,00:17:46.830,"which doesn't undergo fission."
00:17:46.830,00:17:48.060,"So to make a nuclear bomb,"
00:17:48.060,00:17:51.028,"the scientists use gigantic mass spectrometers"
00:17:51.028,00:17:55.200,"to separate out and concentrate the U235,"
00:17:55.200,00:17:57.960,"and the resulting substance was uranium"
00:17:57.960,00:18:01.290,"with a much higher concentration of U235."
00:18:01.290,00:18:04.320,"In other words, it was enriched."
00:18:04.320,00:18:06.810,"There was another option though."
00:18:06.810,00:18:08.490,"In early 1941,"
00:18:08.490,00:18:12.180,"a new element was discovered or rather synthesized."
00:18:12.180,00:18:15.570,"When a neutron is absorbed by a nucleus of uranium-238,"
00:18:15.570,00:18:18.257,"it turns into uranium-239."
00:18:18.257,00:18:20.580,"U239 is unstable,"
00:18:20.580,00:18:22.620,"so it decays into Neptunium,"
00:18:22.620,00:18:24.573,"which then becomes plutonium."
00:18:25.710,00:18:28.230,"There are three things that matter for this story."
00:18:28.230,00:18:30.022,"First is that plutonium-239"
00:18:30.022,00:18:32.430,"is a great fuel for a nuclear bomb."
00:18:32.430,00:18:35.490,"It has a critical mass of only about 10 kilograms."
00:18:35.490,00:18:39.492,"Second, it is cheaper to make than to separate uranium-235"
00:18:39.492,00:18:42.060,"and third, it reacts too quickly"
00:18:42.060,00:18:44.040,"to be used in a gun type device."
00:18:44.040,00:18:44.873,"It would fizzle,"
00:18:44.873,00:18:46.950,"meaning only a tiny fraction of the fuel"
00:18:46.950,00:18:49.050,"would undergo fission."
00:18:49.050,00:18:51.831,"But there is a way to make a bomb using plutonium."
00:18:51.831,00:18:54.780,"Critical mass changes depending on the density"
00:18:54.780,00:18:56.100,"of the material."
00:18:56.100,00:18:57.745,"Under normal pressure conditions,"
00:18:57.745,00:19:02.010,"six kilograms of plutonium-239 won't explode."
00:19:02.010,00:19:03.990,"But if you compress it,"
00:19:03.990,00:19:07.200,"the atoms get closer together and the chance of a stay"
00:19:07.200,00:19:09.840,"neutron hitting the nucleus increases."
00:19:09.840,00:19:13.662,"So the higher the density, the lower the critical mass."
00:19:13.662,00:19:16.800,"So if you set off conventional explosives"
00:19:16.800,00:19:18.810,"around a ball of plutonium,"
00:19:18.810,00:19:20.340,"you can get it compressed enough"
00:19:20.340,00:19:22.763,"to start a nuclear chain reaction."
00:19:22.763,00:19:25.047,"And this was the whole idea behind"
00:19:25.047,00:19:27.153,"the implosion bomb design."
00:19:29.730,00:19:33.180,"There are a couple ways to cheat lowering the critical mass."
00:19:33.180,00:19:34.050,"For one thing,"
00:19:34.050,00:19:36.390,"you surround the sphere with a material that reflects"
00:19:36.390,00:19:38.850,"neutrons decreasing the amount of nuclear fuel"
00:19:38.850,00:19:41.040,"you need to start a chain reaction."
00:19:41.040,00:19:43.260,"You can also have a neutron source,"
00:19:43.260,00:19:45.601,"something that kick starts the chain reaction."
00:19:45.601,00:19:48.240,"For the first implosion bomb,"
00:19:48.240,00:19:50.970,"scientists created a device called the urchin,"
00:19:50.970,00:19:54.660,"which was a tiny pellet weighing just seven grams,"
00:19:54.660,00:19:57.240,"and it would sit at the heart of the bomb."
00:19:57.240,00:19:59.940,"It was made of beryllium and polonium"
00:19:59.940,00:20:02.850,"separated by a layer of nickel and gold."
00:20:02.850,00:20:05.760,"The idea was that when the explosives detonated,"
00:20:05.760,00:20:09.330,"the shockwave would mix the beryllium and polonium together,"
00:20:09.330,00:20:11.550,"and then the alpha particles from polonium"
00:20:11.550,00:20:15.330,"would cause the beryllium to release a flood of neutrons,"
00:20:15.330,00:20:18.123,"which would set off the nuclear chain reaction."
00:20:19.380,00:20:21.150,"At least that was the hope."
00:20:21.150,00:20:23.213,"An atomic bomb had never been made before."
00:20:23.213,00:20:26.460,"Oppenheimer and the rest of the scientists at Los Alamos"
00:20:26.460,00:20:27.990,"needed to act quickly."
00:20:27.990,00:20:29.910,"It was already 1945,"
00:20:29.910,00:20:32.130,"and Truman wanted to test the weapon"
00:20:32.130,00:20:34.800,"before the start of the Potsdam conference."
00:20:34.800,00:20:36.510,"That's where Truman, Churchill,"
00:20:36.510,00:20:40.170,"and Stalin would come together to plan the post-war piece."
00:20:40.170,00:20:43.740,"The conference began on the 17th of July."
00:20:43.740,00:20:46.140,"The earliest date that everything could be ready"
00:20:46.140,00:20:49.200,"for the bomb was just one day earlier."
00:20:49.200,00:20:52.560,"So that is when the test was scheduled."
00:20:52.560,00:20:54.333,"It was Codenamed Trinity."
00:20:57.780,00:21:00.870,"The night before Oppenheimer was nervous."
00:21:00.870,00:21:03.630,"There were so many things that could go wrong."
00:21:03.630,00:21:06.210,"The last test firing of the explosives"
00:21:06.210,00:21:10.650,"without the actual plutonium core was a failure."
00:21:10.650,00:21:11.850,"To calm himself,"
00:21:11.850,00:21:14.790,"he recited a stanza from the Bhagavad Gita,"
00:21:14.790,00:21:16.830,"the sacred Hindu poem."
00:21:16.830,00:21:19.440,"He had actually translated the Gita from the original"
00:21:19.440,00:21:21.338,"Sanskrit in himself."
00:21:21.338,00:21:23.670,"In battle, in forest,"
00:21:23.670,00:21:25.409,"at the precipice in the mountains,"
00:21:25.409,00:21:28.440,"on the dark great sea,"
00:21:28.440,00:21:29.940,"in the midst of javelins"
00:21:29.940,00:21:31.950,"and arrows in sleep,"
00:21:31.950,00:21:34.902,"in confusion, in the depths of shame,"
00:21:34.902,00:21:39.393,"the good deeds a man has done before defend him."
00:21:41.220,00:21:43.770,"Perhaps more terrifying than the idea of the bomb"
00:21:43.770,00:21:47.223,"not working was that it would work too well."
00:21:50.340,00:21:54.313,"Around 1942, Oppenheimer discussed with Arthur Compton"
00:21:54.313,00:21:58.230,"a terrible possibility that a nuclear test"
00:21:58.230,00:21:59.766,"could end the world."
00:21:59.766,00:22:02.010,"The worry was that the nuclear bomb"
00:22:02.010,00:22:06.423,"would create temperatures so hot that fusion would occur."
00:22:08.310,00:22:10.260,"A tiny fraction of the atmosphere,"
00:22:10.260,00:22:14.520,"just one part in 2 million is hydrogen gas."
00:22:14.520,00:22:16.650,"But the worry was that at high enough temperatures"
00:22:16.650,00:22:20.040,"and pressures that hydrogen could fuse to together"
00:22:20.040,00:22:21.660,"releasing energy,"
00:22:21.660,00:22:23.952,"this energy would fuse more hydrogen."
00:22:23.952,00:22:26.490,"It could also break apart the hydrogen"
00:22:26.490,00:22:30.120,"from water vapor causing that to fuse as well."
00:22:30.120,00:22:31.890,"That would release even more energy"
00:22:31.890,00:22:35.250,"causing yet more fusion until the entirety"
00:22:35.250,00:22:40.140,"of the Earth's atmosphere would become a giant fusion bomb."
00:22:40.140,00:22:43.680,"Recalling his conversations with Oppenheimer in 1959,"
00:22:43.680,00:22:47.146,"Compton said, ""Nor was this all that Oppenheimer feared."
00:22:47.146,00:22:50.520,"The nitrogen in the air is also unstable,"
00:22:50.520,00:22:51.975,"though in less degree."
00:22:51.975,00:22:54.930,"Might not it, too, be set off by an"
00:22:54.930,00:22:57.690,"atomic explosion in the atmosphere."""
00:22:57.690,00:22:59.640,"Most of the scientists quickly realized"
00:22:59.640,00:23:01.530,"how unlikely this scenario was,"
00:23:01.530,00:23:03.630,"and they continued on with the project,"
00:23:03.630,00:23:06.390,"so no one took the idea too seriously."
00:23:06.390,00:23:09.810,"But the thought of starting a fusion reaction with a fission"
00:23:09.810,00:23:13.391,"weapon would become very important after the war."
00:23:13.391,00:23:16.141,"(dramatic music)"
00:23:17.130,00:23:20.108,"The Trinity test was scheduled for 4:00 AM"
00:23:20.108,00:23:23.070,"but it was delayed due to a storm."
00:23:23.070,00:23:27.060,"So at 5:29 and 21 seconds, the gadget,"
00:23:27.060,00:23:30.630,"the world's first nuclear bomb detonated,"
00:23:30.630,00:23:34.504,"the high explosive squeezed the core of plutonium inwards."
00:23:34.504,00:23:37.230,"The shockwave mixed the beryllium and polonium"
00:23:37.230,00:23:40.080,"releasing a flood of neutrons."
00:23:40.080,00:23:41.760,"The urchin worked."
00:23:41.760,00:23:44.100,"It jump started the nuclear reaction,"
00:23:44.100,00:23:46.563,"and now there was no way to stop it."
00:23:47.580,00:23:51.090,"Just six kilograms of plutonium created an explosion"
00:23:51.090,00:23:55.860,"that was equivalent to nearly 25,000 tons of TNT."
00:23:55.860,00:23:57.750,"The New Mexico mountains were illuminated"
00:23:57.750,00:23:59.373,"brighter than in daytime."
00:23:59.373,00:24:04.373,"The shockwave was felt from over 160 kilometers away."
00:24:04.830,00:24:09.270,"The mushroom cloud rose to 12 kilometers into the sky."
00:24:09.270,00:24:12.360,"It was so hot that the desert sand melted"
00:24:12.360,00:24:15.867,"into a glassy mineral, now known as trinitite."
00:24:15.867,00:24:20.013,"Fortunately, the blast did not set fire to the atmosphere."
00:24:24.210,00:24:25.890,"On August 6th, 1945,"
00:24:25.890,00:24:29.970,"the Boeing B29 Flying Fortress dropped little boy,"
00:24:29.970,00:24:33.150,"a gun type nuclear bomb with 64 kilograms"
00:24:33.150,00:24:34.771,"of enriched uranium."
00:24:34.771,00:24:37.650,"The nitro cellulose ignited pushing the slugs"
00:24:37.650,00:24:39.720,"of uranium-235 together,"
00:24:39.720,00:24:41.824,"tipping it over its critical mass."
00:24:41.824,00:24:44.397,"The blast from the explosion equivalent"
00:24:44.397,00:24:48.060,"to 15,000 tons of TNT,"
00:24:48.060,00:24:51.660,"killed nearly 70,000 people."
00:24:51.660,00:24:55.890,"Another 70,000 would die from burns and radiation poisoning"
00:24:55.890,00:24:57.870,"in the following months."
00:24:57.870,00:24:58.800,"Three days later,"
00:24:58.800,00:25:01.290,"an implosion type bomb, like the gadget,"
00:25:01.290,00:25:02.266,"was dropped on Nagasaki"
00:25:02.266,00:25:05.763,"killing an estimated 80,000 more people."
00:25:07.230,00:25:12.210,"More than 95% of the 225,000 people killed"
00:25:12.210,00:25:15.781,"in the bombings of Hiroshima and Nagasaki were civilians."
00:25:15.781,00:25:18.513,"Most were women and children."
00:25:21.090,00:25:25.500,"In 1965, recalling the moments after the Trinity test,"
00:25:25.500,00:25:28.050,"Oppenheimer said that he thought of another verse"
00:25:28.050,00:25:29.520,"from the Ghita."
00:25:29.520,00:25:31.877,"- He knew the world would not be the same."
00:25:34.557,00:25:36.813,"Few people laughed,"
00:25:38.820,00:25:40.083,"few people cried."
00:25:41.010,00:25:42.573,"Most people were silent."
00:25:45.900,00:25:49.800,"I remembered the line from the Hindu scripture,"
00:25:49.800,00:25:50.687,"the (speaking foreign language)."
00:25:54.513,00:25:57.900,"The Vishnu is trying to persuade the prince"
00:26:00.210,00:26:03.917,"that he should do his duty"
00:26:03.917,00:26:08.917,"and to impress him takes on his multi-armed form and says,"
00:26:12.453,00:26:16.407,"'Now I am become death the destroyer of worlds.'"
00:26:19.260,00:26:21.753,"I suppose we all thought that one way or another."
00:26:23.370,00:26:24.510,"- [Derek] After the war,"
00:26:24.510,00:26:26.940,"Oppenheimer was a national hero."
00:26:26.940,00:26:29.460,"His portrait was on the cover of Time Magazine,"
00:26:29.460,00:26:31.473,"and he became a household name."
00:26:32.670,00:26:34.770,"In 1947, he became the director"
00:26:34.770,00:26:37.530,"of the Institute of Advanced Study at Princeton."
00:26:37.530,00:26:39.060,"He also became the chairman"
00:26:39.060,00:26:41.130,"of the General Advisory Committee,"
00:26:41.130,00:26:43.470,"where he became an advisor on nuclear weapons"
00:26:43.470,00:26:45.030,"related issues."
00:26:45.030,00:26:48.543,"He used his position to argue for arms control."
00:26:50.100,00:26:51.060,"(dramatic music)"
00:26:51.060,00:26:52.770,"In August, 1949,"
00:26:52.770,00:26:55.773,"the Soviet Union tested their first atomic weapon,"
00:27:00.160,00:27:02.430,"and the US military quickly decided"
00:27:02.430,00:27:04.110,"that the best course of action"
00:27:04.110,00:27:06.870,"was to develop a more powerful bomb."
00:27:06.870,00:27:08.430,"The hydrogen bomb,"
00:27:08.430,00:27:10.347,"known as ""The Super"","
00:27:10.347,00:27:13.380,"Oppenheimer was against the development"
00:27:13.380,00:27:15.540,"of The Super on ethical grounds"
00:27:15.540,00:27:18.840,"and the worry that it would start an arms race."
00:27:18.840,00:27:21.480,"But Truman's administration pushed through,"
00:27:21.480,00:27:23.640,"and three years later, Ivy Mike,"
00:27:23.640,00:27:27.570,"the first hydrogen bomb was tested in the Marshall Islands."
00:27:27.570,00:27:31.800,"It had a yield of 10.4 megatons of TNT."
00:27:31.800,00:27:36.513,"That's 400 times more powerful than the Trinity test."
00:27:40.740,00:27:44.250,"A hydrogen bomb is actually three bombs in one,"
00:27:44.250,00:27:46.380,"a conventional bomb, a fission bomb,"
00:27:46.380,00:27:48.120,"and a fusion bomb."
00:27:48.120,00:27:50.969,"The conventional explosives trigger a fission reaction,"
00:27:50.969,00:27:53.430,"which increases the temperature and pressure"
00:27:53.430,00:27:56.850,"enough to fuse deuterium and tritium together,"
00:27:56.850,00:28:00.300,"releasing a huge amount of energy."
00:28:00.300,00:28:04.350,"In 1961, the Soviet Union tested the Tsar Bomba,"
00:28:04.350,00:28:07.650,"the most powerful explosion ever detonated."
00:28:07.650,00:28:11.250,"It was another five times more powerful than Ivy Mike"
00:28:11.250,00:28:14.763,"around 2000 times more powerful than Trinity."
00:28:17.040,00:28:17.873,"This kind of arms race"
00:28:17.873,00:28:21.420,"was exactly what Oppenheimer had feared,"
00:28:21.420,00:28:23.760,"in part, due to his opposition to the hydrogen bomb."
00:28:23.760,00:28:26.640,"And due to his calls to avert a nuclear arms race,"
00:28:26.640,00:28:28.740,"Oppenheimer was essentially put on trial"
00:28:28.740,00:28:30.810,"to revoke his security clearance."
00:28:30.810,00:28:32.670,"He had been surveilled while he was working"
00:28:32.670,00:28:33.990,"for the Manhattan Project,"
00:28:33.990,00:28:36.870,"but that surveillance didn't stop after he left."
00:28:36.870,00:28:40.320,"Many of the wiretaps were illegal and warrantless."
00:28:40.320,00:28:42.150,"Oppenheimer was questioned about his ties"
00:28:42.150,00:28:43.140,"to the Communist Party,"
00:28:43.140,00:28:45.360,"including his affair with Gene Tatlock,"
00:28:45.360,00:28:47.040,"a Communist party member"
00:28:47.040,00:28:49.920,"while he was leading the Los Alamos lab."
00:28:49.920,00:28:54.032,"He was essentially accused of treason and espionage."
00:28:54.032,00:28:56.040,"In December, 1953,"
00:28:56.040,00:28:59.134,"Oppenheimer had his security clearance suspended."
00:28:59.134,00:29:02.009,"His face now grim and in black and white"
00:29:02.009,00:29:05.070,"was once again on the cover of time."
00:29:05.070,00:29:08.283,"His security hearings were international news."
00:29:09.750,00:29:13.290,"In 1964, German playwright Heinar Kipphardt"
00:29:13.290,00:29:16.470,"wrote a play about Oppenheimer's life."
00:29:16.470,00:29:19.200,"Oppenheimer was sent a copy of this script,"
00:29:19.200,00:29:22.770,"and he hated it so much that he threatened to sue."
00:29:22.770,00:29:25.540,"He especially despised the final scene where the character"
00:29:25.540,00:29:29.340,"of Oppenheimer realizes the evil of his work."
00:29:29.340,00:29:30.487,"And I quote,"
00:29:30.487,00:29:33.570,"""We have been doing the work of the devil."""
00:29:33.570,00:29:37.320,"To Oppenheimer, it was always more complicated than that."
00:29:37.320,00:29:40.260,"- I think that it probably was assumed,"
00:29:40.260,00:29:42.919,"it certainly was always assumed at Los Alamos"
00:29:42.919,00:29:47.919,"that if the war were not over and not clearly"
00:29:52.470,00:29:57.470,"to be brought to a conclusion by the diplomatic means"
00:29:58.940,00:30:01.230,"this weapon would play a part."
00:30:01.230,00:30:04.503,"At the time, the alternative,"
00:30:06.300,00:30:10.230,"the campaign of invasion was certainly much more terrible"
00:30:10.230,00:30:11.763,"for everyone concerned."
00:30:13.440,00:30:18.440,"I think that Hiroshima was far more costly in life"
00:30:21.180,00:30:26.180,"and suffering inhumane than it needed to have been,"
00:30:27.210,00:30:32.210,"to have been an effective argument for ending the war."
00:30:33.510,00:30:36.540,"This is easy to say after the fact."
00:30:36.540,00:30:39.870,"- In 1965, he was asked about the recent proposal of talks"
00:30:39.870,00:30:42.450,"with the Soviet Union to halt the proliferation"
00:30:42.450,00:30:43.380,"of nuclear weapons,"
00:30:43.380,00:30:44.857,"and his response was,"
00:30:44.857,00:30:48.180,"""It should have been done the day after Trinity."
00:30:48.180,00:30:51.570,"Later that same year, he was diagnosed with throat cancer."
00:30:51.570,00:30:53.295,"He was a lifelong smoker,"
00:30:53.295,00:30:58.295,"and he died on the 18th of February, 1967 aged 62."
00:31:05.190,00:31:07.951,"Advances in science and technology have given humans"
00:31:07.951,00:31:12.240,"tremendous power to make the world better or worse,"
00:31:12.240,00:31:15.480,"and nuclear war isn't the only thing we have to worry about."
00:31:15.480,00:31:18.630,"Human caused climate change poses a serious threat to"
00:31:18.630,00:31:22.380,"ecosystems and the most vulnerable people around the world."
00:31:22.380,00:31:25.290,"As I record this, we are in the midst of a heat wave,"
00:31:25.290,00:31:27.120,"and my folks up in Canada are suffering"
00:31:27.120,00:31:29.070,"in the smoke from wildfires."
00:31:29.070,00:31:31.723,"This is where this video sponsor Wren comes in."
00:31:31.723,00:31:34.712,"Their mission is to take action on climate change."
00:31:34.712,00:31:37.590,"On their website, you can calculate your carbon footprint,"
00:31:37.590,00:31:40.530,"which can help you identify ways to reduce your impact."
00:31:40.530,00:31:41.640,"And if you like,"
00:31:41.640,00:31:43.590,"you can offset your carbon footprint"
00:31:43.590,00:31:45.780,"with a simple monthly subscription."
00:31:45.780,00:31:47.880,"While individual action is important,"
00:31:47.880,00:31:51.000,"Wren understands that this alone is not enough,"
00:31:51.000,00:31:52.560,"which is why your subscription funds"
00:31:52.560,00:31:54.870,"not only carbon removal and offsets,"
00:31:54.870,00:31:57.660,"but also lobbying to enact climate policy"
00:31:57.660,00:31:59.970,"and land conservation projects."
00:31:59.970,00:32:01.230,"I am particularly fond"
00:32:01.230,00:32:04.110,"of their new refrigerant destruction project."
00:32:04.110,00:32:06.840,"We actually made a video about Thomas Midgley"
00:32:06.840,00:32:08.460,"who invented Freon,"
00:32:08.460,00:32:10.770,"which is a refrigerant that is both destructive"
00:32:10.770,00:32:14.730,"to the ozone layer and a very potent greenhouse gas."
00:32:14.730,00:32:16.680,"Well this project permanently destroys"
00:32:16.680,00:32:19.407,"harmful refrigerants like CFCs, HCFCs,"
00:32:19.407,00:32:22.860,"and HFCs to stop them from getting into the atmosphere."
00:32:22.860,00:32:25.442,"And this will reduce global warming and prevent the further"
00:32:25.442,00:32:27.210,"destruction of the ozone layer."
00:32:27.210,00:32:28.043,"It's a win-win."
00:32:28.043,00:32:30.600,"I personally offset my emissions with Wren,"
00:32:30.600,00:32:32.220,"and for the first a hundred people to sign up"
00:32:32.220,00:32:33.394,"using the link in the description,"
00:32:33.394,00:32:35.790,"I will personally pay for the first month"
00:32:35.790,00:32:36.840,"of your subscription."
00:32:36.840,00:32:39.030,"This is an idea I came up with myself"
00:32:39.030,00:32:41.430,"because I think it's so important that for those of us"
00:32:41.430,00:32:42.270,"who can help,"
00:32:42.270,00:32:43.740,"that we pool our resources together"
00:32:43.740,00:32:45.180,"to have a greater impact."
00:32:45.180,00:32:47.460,"So I hope you take the time to check out Wren."
00:32:47.460,00:32:49.740,"I wanna thank them for sponsoring this part of the video,"
00:32:49.740,00:32:51.603,"and I wanna thank you for watching."
