Start Time,End Time,Text
00:00:00.240,00:00:01.560,"J. Robert Oppenheimer"
00:00:01.560,00:00:03.840,"might be the most important physicist"
00:00:03.840,00:00:05.400,"to have ever lived."
00:00:05.400,00:00:07.260,"He never won a Nobel Prize,"
00:00:07.260,00:00:11.460,"but he changed the world more than most Nobel Prize winners."
00:00:11.460,00:00:12.630,"Under his leadership,"
00:00:12.630,00:00:15.360,"the best physicists of the 20th century"
00:00:15.360,00:00:17.400,"built the atomic bomb"
00:00:17.400,00:00:20.220,"forever changing the course of history."
00:00:20.220,00:00:22.860,"- If there is another world war,"
00:00:22.860,00:00:26.430,"this civilization may go under."
00:00:26.430,00:00:28.860,"- [Derek] He has affected every war waged"
00:00:28.860,00:00:32.167,"and every peace settled since the end of World War ii."
00:00:32.167,00:00:37.080,"He also created a way for humanity to destroy itself."
00:00:37.080,00:00:38.463,"- Now I am become death,"
00:00:39.510,00:00:41.013,"the destroyer of worlds."
00:00:42.000,00:00:45.060,"- [Derek] This video is about how to build an atomic bomb,"
00:00:45.060,00:00:46.800,"the life of Oppenheimer,"
00:00:46.800,00:00:50.400,"and why serious scientists were worried about the explosion"
00:00:50.400,00:00:52.800,"setting fire to the atmosphere,"
00:00:52.800,00:00:54.453,"ending all life on earth."
00:00:56.520,00:00:58.773,"Part of this video is brought to you by Wren."
00:01:01.650,00:01:04.260,"When J. Robert Oppenheimer was 21,"
00:01:04.260,00:01:07.320,"he placed an apple laced with toxic chemicals"
00:01:07.320,00:01:09.179,"on the desk of his physics tutor."
00:01:09.179,00:01:11.250,"The tutor, Patrick Blackett,"
00:01:11.250,00:01:14.070,"was an experimentalist and he had hounded Robert"
00:01:14.070,00:01:15.540,"to do more of what he thought"
00:01:15.540,00:01:18.584,"Robert wasn't very good at, experimental work."
00:01:18.584,00:01:21.810,"Oppenheimer had already been spending his days in a corner"
00:01:21.810,00:01:24.060,"of JJ Thompson's basement laboratory,"
00:01:24.060,00:01:26.460,"attempting to make thin films of beryllium,"
00:01:26.460,00:01:28.950,"which were used to study electrons."
00:01:28.950,00:01:32.463,"But Oppenheimer was clumsy and not good at this work."
00:01:33.870,00:01:36.240,"He was soon avoiding his duties in the lab,"
00:01:36.240,00:01:38.100,"spending his time listening to lectures"
00:01:38.100,00:01:39.900,"and reading physics journals."
00:01:39.900,00:01:43.680,"It was 1925 and the 21 year old Oppenheimer was becoming"
00:01:43.680,00:01:46.623,"fascinated by the new field of quantum mechanics."
00:01:47.520,00:01:50.550,"Despite being surrounded by brilliant physicists"
00:01:50.550,00:01:52.740,"like Rutherford and Chadwick,"
00:01:52.740,00:01:55.380,"Oppenheimer was deeply unhappy."
00:01:55.380,00:01:58.110,"He wrote, ""I'm having a pretty bad time."
00:01:58.110,00:02:00.060,"The lab work is a terrible bore,"
00:02:00.060,00:02:03.090,"and I'm so bad at it that it's impossible to feel"
00:02:03.090,00:02:04.518,"that I'm learning anything."""
00:02:04.518,00:02:06.060,"A friend walked in on him,"
00:02:06.060,00:02:07.500,"lying on the floor of his room,"
00:02:07.500,00:02:10.080,"which he called ""A miserable hole"","
00:02:10.080,00:02:13.925,"groaning and rolling from side to side in emotional anguish."
00:02:13.925,00:02:16.620,"It was in this state that Robert"
00:02:16.620,00:02:19.080,"attempted to poison Blackett."
00:02:19.080,00:02:21.150,"The specifics are lost to history."
00:02:21.150,00:02:23.957,"There are conflicting reports if Oppenheimer used cyanide"
00:02:23.957,00:02:26.010,"or something he found in the lab,"
00:02:26.010,00:02:28.590,"which would've just made Blackett sick."
00:02:28.590,00:02:30.525,"This story sounds unbelievable,"
00:02:30.525,00:02:33.597,"but Oppenheimer himself confirmed it."
00:02:33.597,00:02:36.524,"Luckily, Blackett did not eat the apple,"
00:02:36.524,00:02:39.000,"but the attempted poisoning became known"
00:02:39.000,00:02:41.790,"to the Cambridge University authorities."
00:02:41.790,00:02:43.440,"Robert's parents were visiting their son"
00:02:43.440,00:02:44.610,"from the US at the time,"
00:02:44.610,00:02:48.030,"and Julius Oppenheimer successfully lobbied Cambridge"
00:02:48.030,00:02:51.630,"not to press criminal charges. Due to his family's wealth,"
00:02:51.630,00:02:53.970,"Robert wasn't even expelled from Cambridge"
00:02:53.970,00:02:56.499,"on the condition that he had periodic counseling sessions"
00:02:56.499,00:02:59.207,"with a psychiatrist in London."
00:02:59.207,00:03:01.260,"(train horn blaring)"
00:03:01.260,00:03:02.640,"In the summer of 1926,"
00:03:02.640,00:03:05.700,"Robert traveled to the University of Göttingen."
00:03:05.700,00:03:08.130,"The chairman of the department was Max Born,"
00:03:08.130,00:03:11.269,"who just two years earlier had coined the term,"
00:03:11.269,00:03:13.260,"""Quantum Mechanics""."
00:03:13.260,00:03:16.440,"Born was reportedly a thoughtful and gentle teacher"
00:03:16.440,00:03:18.930,"and had nurtured the work of Werner Heisenberg,"
00:03:18.930,00:03:21.030,"Wolfgang Pauli, Enrico Fermi,"
00:03:21.030,00:03:22.290,"and Eugene Wigner,"
00:03:22.290,00:03:24.678,"basically the who's who of quantum mechanics."
00:03:24.678,00:03:28.140,"The class that Oppenheimer was in was also extraordinary,"
00:03:28.140,00:03:31.383,"including luminaries like Paul Dirac and John Von Neumann,"
00:03:32.220,00:03:34.130,"where the academic culture at Cambridge focused on"
00:03:34.130,00:03:36.090,"experimental physics."
00:03:36.090,00:03:38.700,"Göttingen was all about theoretical physics,"
00:03:38.700,00:03:41.040,"and under Max Born's mentorship,"
00:03:41.040,00:03:42.660,"Oppenheimer thrived."
00:03:42.660,00:03:44.280,"His mental health improved,"
00:03:44.280,00:03:46.320,"and he found a community of people who were"
00:03:46.320,00:03:49.023,"as obsessed with physics as he was."
00:03:49.980,00:03:52.200,"On November 14th, 1926,"
00:03:52.200,00:03:54.596,"Robert wrote to Frank, his younger brother,"
00:03:54.596,00:03:56.520,"""You would like Göttingen."
00:03:56.520,00:03:58.620,"I find the work hard, thank God,"
00:03:58.620,00:04:00.690,"and almost pleasant."""
00:04:00.690,00:04:04.290,"Robert was thriving and his talent was being recognized."
00:04:04.290,00:04:05.257,"Born later wrote,"
00:04:05.257,00:04:08.250,"""He was a man of great talent and he was conscious"
00:04:08.250,00:04:11.190,"of his superiority in a way which was embarrassing"
00:04:11.190,00:04:12.297,"and led to trouble."""
00:04:13.200,00:04:14.880,"When Oppenheimer was 23,"
00:04:14.880,00:04:17.430,"he graduated with his PhD in physics."
00:04:17.430,00:04:20.550,"He wrote his thesis in German on the quantum theory"
00:04:20.550,00:04:22.171,"of continuous spectra."
00:04:22.171,00:04:23.070,"All in all,"
00:04:23.070,00:04:24.585,"he published more than a dozen papers"
00:04:24.585,00:04:26.883,"in the two years he was at Göttingen."
00:04:26.883,00:04:30.570,"Many of them expanded upon the work of Werner Heisenberg,"
00:04:30.570,00:04:33.001,"who was just three years older than Oppenheimer."
00:04:33.001,00:04:36.240,"The two eventually met in 1927,"
00:04:36.240,00:04:39.480,"the same year Heisenberg published his groundbreaking paper"
00:04:39.480,00:04:41.486,"on the Quantum uncertainty principle."
00:04:41.486,00:04:42.840,"By all accounts,"
00:04:42.840,00:04:44.830,"the pair got along well."
00:04:44.830,00:04:47.730,"There was no way to know that just 15 years later,"
00:04:47.730,00:04:50.850,"they would be deadly rivals attempting to build"
00:04:50.850,00:04:52.350,"the first nuclear bomb."
00:04:52.350,00:04:54.240,"Oppenheimer for the USA"
00:04:54.240,00:04:56.193,"and Heisenberg for Nazi Germany."
00:04:57.226,00:04:58.350,"At the time,"
00:04:58.350,00:05:01.350,"it was thought that getting significant amounts of energy"
00:05:01.350,00:05:04.950,"out of radioactive atoms was impossible."
00:05:04.950,00:05:07.230,"Ever since the discovery of radioactivity"
00:05:07.230,00:05:09.000,"by Henri Becquerel, Marie Curie,"
00:05:09.000,00:05:11.550,"and Pierre Curie in the late 1890s,"
00:05:11.550,00:05:15.210,"it was known that radioactivity was a passive process."
00:05:15.210,00:05:17.460,"Unstable atoms would just decay at random,"
00:05:17.460,00:05:19.650,"unpredictable times,"
00:05:19.650,00:05:23.200,"and surely there was no way to control that."
00:05:23.200,00:05:26.070,"In 1933, Ernest Rutherford,"
00:05:26.070,00:05:28.927,"Oppenheimer's old boss from Cambridge wrote that,"
00:05:28.927,00:05:30.750,"""Anyone who expects a source of power"
00:05:30.750,00:05:32.580,"from the transformations of these atoms"
00:05:32.580,00:05:34.290,"is talking moonshine."""
00:05:34.290,00:05:35.250,"That same year,"
00:05:35.250,00:05:36.277,"Albert Einstein said,"
00:05:36.277,00:05:38.195,"""That there is not the slightest indication"
00:05:38.195,00:05:40.729,"that nuclear energy will ever be obtainable."
00:05:40.729,00:05:42.480,"It would mean that the atom"
00:05:42.480,00:05:45.057,"would have to be shattered at will."""
00:05:46.260,00:05:49.183,"So how would you break an atomic nucleus?"
00:05:49.183,00:05:51.240,"Well, you could take a proton"
00:05:51.240,00:05:53.730,"and accelerate it through a large electric field"
00:05:53.730,00:05:56.580,"and then smash it into a nucleus."
00:05:56.580,00:05:58.617,"This is exactly what John Cockcroft"
00:05:58.617,00:06:00.930,"and Ernest Walton did in 1932."
00:06:00.930,00:06:04.560,"They accelerated protons into lithium nuclei,"
00:06:04.560,00:06:05.526,"breaking them apart."
00:06:05.526,00:06:08.982,"The pair would later win a Nobel Prize for this work,"
00:06:08.982,00:06:11.790,"but a proton is positively charged,"
00:06:11.790,00:06:14.220,"so it's repelled by all nuclei,"
00:06:14.220,00:06:16.650,"which are also positively charged."
00:06:16.650,00:06:19.350,"So to give them a hope of overcoming this barrier,"
00:06:19.350,00:06:23.610,"Cockcroft and Walton had to use 250,000 volts"
00:06:23.610,00:06:25.440,"to accelerate the protons."
00:06:25.440,00:06:28.710,"Even then, only about one in a billion protons"
00:06:28.710,00:06:31.920,"actually hit and split a lithium nucleus,"
00:06:31.920,00:06:35.403,"so this would not be an effective way to get energy."
00:06:36.240,00:06:38.133,"But there is another way."
00:06:39.660,00:06:42.720,"In 1932, the neutron was discovered"
00:06:42.720,00:06:46.110,"this subatomic particle that's about 0.1%"
00:06:46.110,00:06:47.640,"heavier than a proton,"
00:06:47.640,00:06:49.468,"and it has no electric charge,"
00:06:49.468,00:06:53.760,"so a neutron would not be repelled from a nucleus."
00:06:53.760,00:06:55.410,"And in 1933,"
00:06:55.410,00:06:58.950,"Leo Szilard was thinking about how you could use neutrons"
00:06:58.950,00:07:00.757,"to split nuclei."
00:07:00.757,00:07:03.810,"""It suddenly occurred to me that if we could find an element"
00:07:03.810,00:07:07.350,"which is split by neutrons and which would emit two neutrons"
00:07:07.350,00:07:09.120,"when it absorbed one neutron,"
00:07:09.120,00:07:12.307,"such an element if assembled sufficiently large mass,"
00:07:12.307,00:07:16.110,"could sustain a nuclear chain reaction."""
00:07:16.110,00:07:17.190,"But the thing is,"
00:07:17.190,00:07:19.380,"nobody knew if there was an element"
00:07:19.380,00:07:21.680,"that had a kind of nucleus that would do that."
00:07:24.060,00:07:26.550,"On the 29th of January, 1939,"
00:07:26.550,00:07:28.950,"Louise Alvarez, a promising young physicist,"
00:07:28.950,00:07:30.547,"was getting a haircut while reading"
00:07:30.547,00:07:32.123,"""The San Francisco Chronicle"","
00:07:32.123,00:07:34.530,"and suddenly he got outta the chair"
00:07:34.530,00:07:38.430,"halfway through the haircut and ran to Oppenheimer's office."
00:07:38.430,00:07:41.430,"Alvarez read an article about how two German chemists,"
00:07:41.430,00:07:43.440,"Otto Hahn and Fritz Strassmann"
00:07:43.440,00:07:46.020,"had successfully split an atom of uranium"
00:07:46.020,00:07:48.326,"by bombarding it with neutrons."
00:07:48.326,00:07:50.977,"Oppenheimer was not impressed."
00:07:50.977,00:07:52.110,"""That's impossible."""
00:07:52.110,00:07:54.270,"He reportedly told the Young Alvarez"
00:07:54.270,00:07:56.820,"proceeding to mathematically prove on his blackboard"
00:07:56.820,00:07:59.193,"why fission could never be achieved."
00:08:00.840,00:08:02.100,"But the next day,"
00:08:02.100,00:08:04.470,"Alvarez had repeated the experiment"
00:08:04.470,00:08:06.704,"and invited Oppenheimer to see it."
00:08:06.704,00:08:08.437,"Alvarez later recalled that,"
00:08:08.437,00:08:09.887,"""In less than 15 minutes,"
00:08:09.887,00:08:12.960,"he not only agreed that the reaction was authentic,"
00:08:12.960,00:08:14.978,"but also speculated that in the process,"
00:08:14.978,00:08:17.280,"extra neutrons would boil off."
00:08:17.280,00:08:19.710,"That could be used to split more uranium atoms"
00:08:19.710,00:08:23.292,"and thereby generate power or make bombs."""
00:08:23.292,00:08:27.180,"When a single atom of uranium-235 splits apart,"
00:08:27.180,00:08:29.130,"it loses a little bit of mass,"
00:08:29.130,00:08:31.020,"which is released as energy."
00:08:31.020,00:08:33.990,"Following Einstein's mass energy equivalence."
00:08:33.990,00:08:36.480,"That is a tiny amount of energy,"
00:08:36.480,00:08:39.330,"about 20 times less than the amount required"
00:08:39.330,00:08:40.920,"to raise a grain of sand,"
00:08:40.920,00:08:43.530,"the thickness of a piece of paper."
00:08:43.530,00:08:45.510,"But atoms are also tiny."
00:08:45.510,00:08:47.550,"In a one kilogram lump of uranium,"
00:08:47.550,00:08:50.730,"there are about a trillion, trillion atoms,"
00:08:50.730,00:08:53.610,"so the energy quickly adds up."
00:08:53.610,00:08:57.930,"Soon, almost everyone was convinced in August of 1939,"
00:08:57.930,00:09:00.030,"Einstein, who just six years earlier"
00:09:00.030,00:09:02.220,"believed that nuclear bombs were impossible,"
00:09:02.220,00:09:03.780,"signed his name to a letter"
00:09:03.780,00:09:05.843,"addressed to President Franklin Roosevelt."
00:09:05.843,00:09:09.510,"The letter actually written by Szilard warned Roosevelt"
00:09:09.510,00:09:11.790,"of the possibility of nuclear weapons."
00:09:11.790,00:09:14.400,"It also pointed out that Germany had access to uranium"
00:09:14.400,00:09:16.470,"from the mines in Czechoslovakia,"
00:09:16.470,00:09:19.530,"which was recently taken over by the Nazis."
00:09:19.530,00:09:22.650,"Roosevelt began an informal uranium committee"
00:09:22.650,00:09:24.390,"to discuss this topic,"
00:09:24.390,00:09:27.183,"but then for two years, nothing happened."
00:09:28.680,00:09:31.860,"In 1941, Roosevelt upgraded the informal"
00:09:31.860,00:09:34.410,"uranium committee to the S-1 committee,"
00:09:34.410,00:09:37.050,"which would report directly to the White House."
00:09:37.050,00:09:40.592,"The explicit goal was to develop an atomic bomb,"
00:09:40.592,00:09:42.507,"and in May, 1942,"
00:09:42.507,00:09:45.150,"Oppenheimer was hired onto the committee"
00:09:45.150,00:09:48.724,"to be the coordinator of rapid rupture."
00:09:48.724,00:09:51.682,"So why was he selected?"
00:09:51.682,00:09:54.720,"(dramatic music)"
00:09:54.720,00:09:56.234,"Well, after completing his PhD,"
00:09:56.234,00:09:58.890,"Oppenheimer became a physics professor,"
00:09:58.890,00:10:01.276,"first at UC Berkeley, and then at Caltech,"
00:10:01.276,00:10:03.060,"the brilliance he had shown"
00:10:03.060,00:10:05.640,"under Max Born's tutelage didn't fade."
00:10:05.640,00:10:07.559,"Indeed, it blossomed into a remarkable"
00:10:07.559,00:10:10.740,"but strange physics career."
00:10:10.740,00:10:13.530,"In the 15 years after finishing his PhD,"
00:10:13.530,00:10:16.230,"Oppenheimer made important contributions to everything from"
00:10:16.230,00:10:18.750,"nuclear physics to quantum field theory,"
00:10:18.750,00:10:20.520,"and even astrophysics."
00:10:20.520,00:10:22.720,"He had a number of Nobel Prize winning ideas."
00:10:22.720,00:10:24.540,"One of his students, Willis Lamb,"
00:10:24.540,00:10:26.430,"became a Nobel laureate,"
00:10:26.430,00:10:29.003,"but Oppenheimer himself was nominated three times,"
00:10:29.003,00:10:32.463,"but never actually won the Nobel Prize."
00:10:33.420,00:10:35.400,"When asked why he thought that Oppenheimer"
00:10:35.400,00:10:36.906,"never won the Nobel Prize,"
00:10:36.906,00:10:38.917,"Murray Gell-Mann said that,"
00:10:38.917,00:10:41.160,"""He didn't have Sitzfleisch"""
00:10:41.160,00:10:44.340,"A German word that translates to sitting flesh."
00:10:44.340,00:10:47.400,"The ability to sit down in a chair for a long time"
00:10:47.400,00:10:48.727,"and do the hard work."
00:10:48.727,00:10:52.590,"""He never wrote a long paper or did a long calculation."
00:10:52.590,00:10:54.713,"He didn't have the patience for that."""
00:10:54.713,00:10:56.416,"Wolfgang Pauli also said,"
00:10:56.416,00:10:58.470,"""His ideas are very good,"
00:10:58.470,00:11:00.927,"but his calculations are always wrong."""
00:11:03.600,00:11:06.660,"But Oppenheimer was amazing with people."
00:11:06.660,00:11:09.030,"He was a natural and charismatic leader,"
00:11:09.030,00:11:10.320,"and this combination,"
00:11:10.320,00:11:13.214,"his charisma and his ability to generate great ideas"
00:11:13.214,00:11:16.297,"would serve him well in the next phase of his life."
00:11:16.297,00:11:18.880,"(upbeat music)"
00:11:21.510,00:11:23.730,"On the 18th of September, 1942,"
00:11:23.730,00:11:26.070,"general Leslie Groves was put in charge"
00:11:26.070,00:11:27.690,"of the Manhattan Project."
00:11:27.690,00:11:31.920,"- I was responsible for the development of the atomic bomb."
00:11:31.920,00:11:36.011,"- [Derek] On day one, he ordered 1200 tons of uranium ore."
00:11:36.011,00:11:37.230,"The next day,"
00:11:37.230,00:11:39.270,"he ordered to buy the Oak Ridge site"
00:11:39.270,00:11:41.430,"where the ore would be refined."
00:11:41.430,00:11:43.170,"The next month in a surprising move,"
00:11:43.170,00:11:45.750,"he chose Oppenheimer to be the science director"
00:11:45.750,00:11:49.470,"of the soon to be established Los Alamos laboratory."
00:11:49.470,00:11:52.350,"Oppenheimer had just been selected to be the chief architect"
00:11:52.350,00:11:53.433,"of the atomic bomb."
00:11:55.830,00:11:58.385,"The military establishment had concerns."
00:11:58.385,00:12:01.080,"Oppenheimer did not have a Nobel Prize,"
00:12:01.080,00:12:03.180,"so would the scientists hired for the project,"
00:12:03.180,00:12:04.290,"respect his opinion,"
00:12:04.290,00:12:06.120,"and follow his leadership?"
00:12:06.120,00:12:09.090,"Oppenheimer also had no prior administrative experience"
00:12:09.090,00:12:11.550,"over a large project like this."
00:12:11.550,00:12:14.190,"Furthermore, he was a theoretical physicist,"
00:12:14.190,00:12:16.237,"who according to Isidor Rabi,"
00:12:16.237,00:12:18.660,"""Was a very impractical fellow."
00:12:18.660,00:12:21.450,"He didn't know anything about equipment."""
00:12:21.450,00:12:22.800,"And then there was the problem"
00:12:22.800,00:12:24.720,"of Oppenheimer's political stance."
00:12:24.720,00:12:26.970,"He had links to the Communist Party,"
00:12:26.970,00:12:28.770,"including his wife, Catherine,"
00:12:28.770,00:12:31.560,"who was a member of that party."
00:12:31.560,00:12:34.170,"But Groves was impressed by Oppenheimer."
00:12:34.170,00:12:36.750,"He valued his overwhelming ambition."
00:12:36.750,00:12:39.000,"He also knew that Oppenheimer's ability to understand"
00:12:39.000,00:12:40.530,"problems not just in physics,"
00:12:40.530,00:12:41.970,"but chemistry, engineering,"
00:12:41.970,00:12:44.580,"and metallurgy would be invaluable."
00:12:44.580,00:12:48.270,"Groves thought that Oppenheimer was a ""Real genius."""
00:12:48.270,00:12:51.877,"Saying that why Oppenheimer knows about everything."
00:12:51.877,00:12:54.000,"""He can talk to you about anything you bring up."
00:12:54.000,00:12:55.050,"Well, not exactly."
00:12:55.050,00:12:57.057,"He doesn't know anything about sports."""
00:12:57.900,00:13:00.270,"The two men couldn't have been more different."
00:13:00.270,00:13:02.880,"Oppenheimer weighed half as much as Groves"
00:13:02.880,00:13:05.647,"despite both of them being nearly six feet tall."
00:13:05.647,00:13:08.820,"Ideologically, Oppenheimer was a communist."
00:13:08.820,00:13:11.160,"Groves, a staunch conservative,"
00:13:11.160,00:13:13.260,"but Groves was convinced that Oppenheimer"
00:13:13.260,00:13:15.600,"would be the person that would build the atomic bomb"
00:13:15.600,00:13:16.860,"before the Nazis,"
00:13:16.860,00:13:19.263,"and that was all that mattered."
00:13:19.263,00:13:21.120,"Isador Rabi later commented that,"
00:13:21.120,00:13:23.080,"hiring Oppenheimer for this role was"
00:13:24.402,00:13:25.235,"""A real stroke of genius"
00:13:25.235,00:13:26.190,"on the part of General Groves,"
00:13:26.190,00:13:28.857,"who was not generally considered to be a genius."""
00:13:29.700,00:13:32.610,"The Manhattan Project needed a location."
00:13:32.610,00:13:34.927,"Somewhere isolated to keep the project secret"
00:13:34.927,00:13:36.845,"safe from enemy attack."
00:13:36.845,00:13:38.910,"And while no one wanted to admit it,"
00:13:38.910,00:13:40.830,"somewhere that was sparsely populated,"
00:13:40.830,00:13:43.233,"just in case there was an accident,"
00:13:44.310,00:13:47.310,"Oppenheimer proposed Los Alamos, New Mexico."
00:13:47.310,00:13:49.890,"He had fallen in love with the harsh desert in the mountains"
00:13:49.890,00:13:51.758,"of New Mexico when he was in his twenties."
00:13:51.758,00:13:54.420,"In 1929, Oppenheimer wrote to a friend."
00:13:54.420,00:13:57.900,"""My two great loves are physics and New Mexico."
00:13:57.900,00:14:00.600,"It's a pity they can't be combined."""
00:14:00.600,00:14:03.480,"But Oppenheimer had severely underestimated the logistical"
00:14:03.480,00:14:04.648,"challenge ahead."
00:14:04.648,00:14:07.779,"(gentle music)"
00:14:07.779,00:14:10.440,"In 1943, Oppenheimer estimated"
00:14:10.440,00:14:13.118,"that he'd need about six scientists"
00:14:13.118,00:14:15.300,"supported by a handful of engineers"
00:14:15.300,00:14:16.863,"and technicians to make a bomb."
00:14:20.220,00:14:24.060,"He was off by two orders of magnitude."
00:14:24.060,00:14:26.160,"764 scientists would end up"
00:14:26.160,00:14:27.810,"working for the Manhattan Project."
00:14:27.810,00:14:31.023,"302 of which would work at the Los Alamos site."
00:14:33.270,00:14:36.870,"Over 600,000 people in total were involved"
00:14:36.870,00:14:38.620,"with the making of the atomic bomb."
00:14:40.110,00:14:43.440,"By this point, making the atom bomb didn't seem impossible."
00:14:43.440,00:14:45.183,"It seemed likely."
00:14:47.760,00:14:49.890,"On the 2nd of December, 1942,"
00:14:49.890,00:14:52.350,"a team of physicists at the University of Chicago"
00:14:52.350,00:14:55.230,"led by Enrico Fermi created the world's"
00:14:55.230,00:14:58.680,"first artificial nuclear reactor Pile-1."
00:14:58.680,00:15:02.580,"It consisted of 45 tons of uranium and uranium oxide"
00:15:02.580,00:15:05.425,"and 330 tons of graphite blocks."
00:15:05.425,00:15:06.870,"Horrifyingly enough."
00:15:06.870,00:15:10.740,"It was located under the stands of the football field."
00:15:10.740,00:15:14.820,"It generated about half a watt of power,"
00:15:14.820,00:15:16.785,"and if you can make a nuclear power plant,"
00:15:16.785,00:15:18.630,"you can make a bomb."
00:15:18.630,00:15:20.460,"The only real difference between the two"
00:15:20.460,00:15:22.500,"is how many neutrons hit the next atom,"
00:15:22.500,00:15:25.590,"causing it to split and release more neutrons."
00:15:25.590,00:15:27.690,"If on average that number is one,"
00:15:27.690,00:15:30.570,"there will be a stable self-sustaining chain reaction,"
00:15:30.570,00:15:31.648,"but it won't grow."
00:15:31.648,00:15:33.390,"If it's less than one,"
00:15:33.390,00:15:35.340,"the reaction will die down,"
00:15:35.340,00:15:36.450,"and if it's more than one,"
00:15:36.450,00:15:37.997,"the reaction will grow."
00:15:37.997,00:15:42.090,"This is known as the multiplication factor, K."
00:15:42.090,00:15:45.453,"Nuclear reactions are similar to pandemics in this way."
00:15:48.210,00:15:50.250,"The simplest way to make a nuclear bomb"
00:15:50.250,00:15:53.310,"is to get enough fissile material close together"
00:15:53.310,00:15:55.980,"that it creates a runaway chain reaction."
00:15:55.980,00:15:58.770,"That amount is known as the critical mass."
00:15:58.770,00:16:00.120,"With uranium-235,"
00:16:00.120,00:16:02.700,"you need about 52 kilograms."
00:16:02.700,00:16:06.230,"Forming a sphere with a diameter of 17 centimeters."
00:16:06.230,00:16:08.700,"If you use plutonium-239,"
00:16:08.700,00:16:10.260,"the critical mass is much smaller,"
00:16:10.260,00:16:12.120,"only around 10 kilograms,"
00:16:12.120,00:16:16.170,"which would create a sphere only 10 centimeters wide."
00:16:16.170,00:16:17.370,"For the first few years,"
00:16:17.370,00:16:20.790,"the scientists worked on a bomb with a gun type design."
00:16:20.790,00:16:22.590,"Inside a gun type bomb,"
00:16:22.590,00:16:24.800,"you have two slabs of uranium-235,"
00:16:24.800,00:16:27.720,"both of which are below the critical mass."
00:16:27.720,00:16:31.320,"Then using a conventional explosive like cordite,"
00:16:31.320,00:16:34.620,"you rapidly fire one towards the other."
00:16:34.620,00:16:38.430,"So the combined mass is higher than the critical mass."
00:16:38.430,00:16:41.850,"When the uranium bullet is about 25 centimeters away,"
00:16:41.850,00:16:44.280,"the nuclear chain reaction begins"
