Start Time,End Time,Text,sentiment-score
00:20:35.350,00:20:37.350,south,0.0
00:20:37.390,00:20:39.390,Falls,0.0
00:20:39.940,00:20:44.550,Einstein realized that curvature could cause things to be seemingly attracted to one another,0.4215
00:20:45.070,00:20:48.720,Without needing to invent the existence of forces like gravity,0.3612
00:20:49.090,00:20:56.189,but attraction only happens if things move along the surface if they stay still they,0.6124
00:20:56.590,00:21:02.370,"Well, they don't come together so for something at rest. How does falling begin?",0.128
00:21:02.370,00:21:07.920,"I mean the thing has to move in this direction, but it's at rest right well",0.3919
00:21:07.990,00:21:08.490,Yes,0.4019
00:21:08.490,00:21:14.189,But it's only at rest in space and that's not the whole story up down,0.0
00:21:14.650,00:21:22.469,Forward backward and left-right are all you need to describe where an event occur but a complete description will also need to describe,0.0
00:21:23.320,00:21:28.559,When together these four dimensions form the setting in which everything in our universe happens,0.0
00:21:30.280,00:21:31.660,Space-time,0.0
00:21:31.660,00:21:38.790,Since we can talk about a falling pencil using just one spatial dimension up and down we can use a piece of paper to model,-0.1531
00:21:39.010,00:21:43.109,"Space-time for it. Okay, so we've got up and down, but we have to add another",0.1154
00:21:43.660,00:21:45.460,direction the pencil moves in,0.0
00:21:45.460,00:21:46.300,time,0.0
00:21:46.300,00:21:50.339,Now if no forces act on the pencil it won't move through space,-0.296
00:21:50.340,00:21:54.840,It will only get older and as you can see if all it does is get older,0.0
00:21:54.840,00:22:00.030,It won't fall if space-time was flat when I let go of the pencil,0.0
00:22:00.640,00:22:07.650,"it wouldn't go anywhere, but now let's allow the earth which is massive to manipulate space-time into say a",0.3291
00:22:08.170,00:22:09.190,cone,0.0
00:22:09.190,00:22:13.980,Now with no forces acting on it every part of the pencil follows a straight line,-0.0772
00:22:14.080,00:22:20.610,But on a cone as we saw earlier such a path will look like this it will fall,0.5023
00:22:20.860,00:22:24.900,This is because distances around the cone are shorter higher up,0.0
00:22:25.210,00:22:29.429,"Time runs faster further from a massive object, but to go straight",0.3291
00:22:29.500,00:22:34.079,Not turn every part of the pencil must cover an equal distance in space-time,0.0
00:22:34.630,00:22:36.190,like this,0.3612
00:22:36.190,00:22:43.290,Only when the pencil hits the earth does the repulsion of their mutual electrons provide a force pushing the pencil off a geodesic,0.0
00:22:43.750,00:22:49.949,For the earth time is a series of slices from this evolution the pencils force-free,0.0
00:22:50.259,00:22:57.869,Geodesic is why it falls not a push or pull just the pencils natural tendency to follow a straight line,0.5267
00:22:58.149,00:23:04.349,Until something acts on it now. We only used one dimension of space and one of time because,0.0
00:23:04.870,00:23:11.639,Visualizing our universes three of space and one of time would take us beyond the limits of what could be shown on paper or screens,0.0
00:23:12.100,00:23:13.389,but math,0.0
00:23:13.389,00:23:15.159,Can take us there,0.0
00:23:15.159,00:23:18.809,General relativity allows us to calculate how much mass and energy,0.2732
00:23:19.149,00:23:26.399,Curved space-time and has been used to explain things that Newton's older theory of falling as the result of,-0.1531
00:23:26.649,00:23:34.378,Forces couldn't like anomalies in the orbit of mercury which orbits nearest the Sun and is therefore most affected by the sun's grip on,-0.4594
00:23:34.840,00:23:41.309,space-time many other experiments have confirmed general relativity's picture of the universe fitting the conclusion that,0.0
00:23:42.009,00:23:44.009,There is no,-0.296
00:23:44.620,00:23:46.620,Gravity there's just,0.0
00:23:47.080,00:23:52.400,Space-time its curvature and a us in it. As John Wheeler famously put it,0.0
00:23:52.960,00:23:59.760,Space-time grips mass telling it how to move mass grips space-time telling it how to curve?,0.0
00:24:00.669,00:24:07.439,Relative to the earth we don't move very fast even jet airplanes move negligibly close to the speed of light,0.0
00:24:07.600,00:24:10.589,So relative to earth we move almost,0.0
00:24:10.960,00:24:17.549,Exclusively through time as such we are more affected by the way time is curved by mass,-0.2247
00:24:17.740,00:24:19.659,Than how space is curved?,0.0
00:24:19.659,00:24:24.869,This has led many to claim that for the most part you feel as though you're being pushed into the ground,0.0
00:24:25.240,00:24:27.419,Not because of a force called gravity,0.0
00:24:27.519,00:24:33.449,But because time is moving faster for your head than for your feet down is,0.0
00:24:33.759,00:24:41.249,"Relative and always changing, but it exists because of and is always in the direction of slower time",0.0
00:24:41.980,00:24:45.839,Bertrand Russell called this the law of cosmic laziness,0.0
00:24:46.690,00:24:53.759,Everything is naturally steered towards where time is slowest we call this falling,-0.1901
00:24:54.429,00:24:56.429,going down,0.0
00:24:56.530,00:24:59.849,So you don't have to keep anything on the down-low,0.0
00:25:00.580,00:25:03.689,time will take care of that for you and,0.4939
00:25:04.750,00:25:06.490,and as always,0.0
00:25:06.490,00:25:08.490,Thanks for watching,0.4404
00:25:19.190,00:25:24.370,Remember that you can support Vsauce and Alzheimer's research by subscribing to the Vsauce,0.4019
00:25:24.920,00:25:29.320,curiosity box the current one comes with a code to get a free copy of universe sandbox 2,0.5106
00:25:29.390,00:25:35.590,Which is amazing and a whole host of other science toys and tools picked by myself Jake and Kevin,0.5859
00:25:35.590,00:25:41.980,I love it all so I hope to see you at brain candy live. We are coming to many many cities very soon,0.8115
00:25:42.130,00:25:45.340,Hopefully one near you by going to the show you can see Adam,0.4019
00:25:45.340,00:25:51.220,And I doing things that will you may not have seen us do before we also explore the science and common,0.0
00:25:51.770,00:25:54.490,misconceptions behind all things,0.0
00:25:55.790,00:26:03.159,Err. Maybe have said too much. Maybe not I hope to see you there and as always thanks for watching,0.1265
