Start Time,End Time,Text,sentiment-score
00:00:00.020,00:00:02.040,"Hey, Vsauce. Michael here.",0.0
00:00:03.200,00:00:03.780,Down here.,0.0
00:00:05.200,00:00:07.560,But which way is down?,0.0
00:00:07.740,00:00:14.420,"And how much does down weigh? Well, down weighs about a 100th of a gram per cubic centimeter.",0.2732
00:00:14.680,00:00:20.060,"It is light and airy, which makes it a great source of insulation and buoyancy for water birds.",0.6249
00:00:20.240,00:00:22.380,But if you let go of down...,0.0
00:00:22.940,00:00:24.840,It falls down.,0.0
00:00:25.040,00:00:26.580,So that's which way down is.,0.0
00:00:26.680,00:00:28.960,It's the direction gravity is pulling everything in.,0.0
00:00:29.240,00:00:32.920,"Now, for someone on the other side of the Earth, my down is their up.",0.0
00:00:33.100,00:00:38.420,But where are falling things going? Why do things fall?,-0.3094
00:00:38.520,00:00:43.680,"Are they being pushed, or pulled, or is it because of time travel?",0.0
00:00:44.400,00:00:48.460,First things first: let's turn the Sun into a black hole.,0.0
00:00:49.140,00:00:55.000,"We can do that using Universe Sandbox 2, this simulator will blow your mind. I love it.",0.6369
00:00:55.040,00:00:59.380,"In fact, I love it so much I put a code to get the game for free in the current Curiosity Box.",0.8176
00:00:59.380,00:01:02.180,"If you're not subscribed to the box yet, you are missing out!",-0.3595
00:01:02.200,00:01:06.240,"Okay, look, for the purposes of this video, we want the Solar System.",0.296
00:01:06.240,00:01:10.420,And here it is. Notice that everything's moving pretty quickly around the Sun.,0.4939
00:01:10.440,00:01:14.720,"That's because we currently have the game set so that every second that passes for us,",0.0
00:01:14.720,00:01:17.220,"is 14 days, almost, in the game.",0.0
00:01:17.220,00:01:20.740,"If I change this to one second,",0.0
00:01:20.740,00:01:23.280,we're looking at the Solar System in real time.,0.0
00:01:23.580,00:01:25.880,You'll notice that it almost looks like it's frozen.,0.3008
00:01:26.420,00:01:31.600,"Even though the earth is traveling around the Sun at about 30 km/s, it barely appears to be moving.",0.0
00:01:31.760,00:01:35.640,"That is how vast space is. Anyway, let's go back to 14 days",0.0
00:01:35.660,00:01:37.560,I like that motion. Now look at the Sun,0.3612
00:01:37.570,00:01:43.259,"It is not, currently, a black hole, but we can change that. What we need to do is compress the Sun.",0.0
00:01:43.390,00:01:48.720,So let's lock its mass so that it doesn't change while we make its radius smaller.,0.0
00:01:49.299,00:01:51.959,Let's make its radius as small as we can.,0.0
00:01:52.580,00:01:58.860,"And, oh, where'd it go? Well it's still there, it's just become a black hole.",0.2732
00:01:59.140,00:02:03.440,"Pretty spooky, but now, let's look at the rest of the Solar System.",0.2732
00:02:03.540,00:02:06.819,"Alright, zooming out and-",0.25
00:02:06.819,00:02:07.959,huh.,0.0
00:02:07.960,00:02:11.120,Nothing's... changed. I mean something's changed.,0.0
00:02:11.240,00:02:16.000,"It's colder and darker, but nothing's flying off into space or getting sucked in.",-0.6124
00:02:16.260,00:02:20.340,"You see,  by shrinking the Sun, we didn't change the direction of down for the planets.",0.0
00:02:20.340,00:02:25.739,They're always being pulled by gravity towards its middle and making it smaller didn't move where the middle was.,0.0
00:02:25.920,00:02:31.800,"But also, the strength of that force pulling them to the middle of the sun stayed the same.",0.6486
00:02:32.260,00:02:35.420,That gives us a clue as to what down is.,0.0
00:02:35.620,00:02:39.980,The clue is the other thing we didn't change: mass.,0.0
00:02:40.260,00:02:45.200,Mass is a measure of how hard it is to accelerate something; to change its motion.,-0.1027
00:02:45.460,00:02:49.400,"Now right now, these two balls have zero motion relative to me.",0.0
00:02:50.260,00:02:52.560,Slapping around this hollow plastic ball,0.0
00:02:54.340,00:02:58.109,"is pretty easy, but doing the same to this solid steel ball",0.634
00:03:01.420,00:03:02.680,is a lot harder.,0.0
00:03:03.120,00:03:05.940,Now gravity and weight have nothing to do with this.,0.0
00:03:06.480,00:03:10.280,"Gravity acts downward, not against my horizontal slapping.",0.0
00:03:10.280,00:03:16.400,"Of course, gravity does contribute to friction, but friction works against me when I start moving the ball,",0.0
00:03:16.599,00:03:19.018,but works with me when I stop the ball.,-0.4215
00:03:19.019,00:03:22.739,And the steel ball is harder to stop than the plastic ball.,-0.296
00:03:23.079,00:03:27.149,The difference is mass. The steel ball is more massive,0.0
00:03:27.149,00:03:30.940,It's more resistant to having its motion changed.,0.0
00:03:30.940,00:03:36.700,Mass is an intrinsic property; it does not depend on what's around or change from place to place.,0.0
00:03:36.700,00:03:40.620,It can sometimes be thought of as the amount of matter something has.,0.0258
00:03:40.620,00:03:43.960,Your mass is the same regardless of where you are.,0.0
00:03:43.960,00:03:47.760,"On the moon, on earth, in the middle of intergalactic space floating around.",0.0
00:03:48.000,00:03:53.300,"But all of this said, mass does seem to care about what's around.",0.6486
00:03:53.820,00:03:56.360,Mass loves company.,0.5719
00:03:57.160,00:04:03.360,Things with mass and/or energy are attracted together by a force that we call gravity.,0.5994
00:04:03.609,00:04:08.189,The feeling of gravity is just you and the earth being attracted to one another.,0.5106
00:04:08.640,00:04:13.120,Now every portion of an object with mass attracts other portions towards it.,0.4019
00:04:13.480,00:04:18.860,The average of all this pulling is an attraction between centers of mass.,0.4588
00:04:19.020,00:04:26.500,"Giant things like Earth exert an obvious pull, but everything does. Even a baseball.",0.1901
00:04:26.580,00:04:32.220,These two baseballs are attracted together by their own gravities.,0.4215
00:04:36.160,00:04:42.920,"Except their masses are so small, the force is minuscule, and it can't overcome friction or push air out of the way.",0.0
00:04:43.240,00:04:44.889,They're never gonna come together,0.0
00:04:44.889,00:04:51.809,But if you put two baseballs one meter apart in the middle of empty space where no other forces could act on them,-0.6124
00:04:52.030,00:04:56.579,They would literally fall together and collide.,-0.0772
00:04:57.130,00:05:00.539,"It would take three days to happen, but it would.",0.0
00:05:01.599,00:05:07.439,Isaac Newton found that the strength of the force bringing two things together is equal to the product of their masses,0.4939
00:05:08.320,00:05:15.389,"Divided by the distance between their centers of mass squared times big G, the gravitational constant.",0.0
00:05:15.780,00:05:20.780,"If you make one of two objects more massive, or move them closer together, the force will be",0.0
00:05:21.000,00:05:25.360,stronger and this force of attraction is what we call weight,0.6808
00:05:26.040,00:05:30.260,"So mass is intrinsic, whereas weight depends on what's around.",0.0
00:05:31.460,00:05:35.139,"Now, a weird thing happens when you weigh yourself on most scales.",-0.1779
00:05:35.420,00:05:39.520,"Weight is a force, but scales display pounds or kilograms,",0.0
00:05:39.640,00:05:41.980,which are units of mass.,0.0
00:05:41.980,00:05:44.840,What's going on is that a scale is,0.0
00:05:44.840,00:05:46.700,activated by a force.,0.0
00:05:46.700,00:05:47.289,Any force.,0.0
00:05:47.290,00:05:51.999,It doesn't have to be caused by gravity. The scale then displays what amount of mass,0.0
00:05:52.250,00:05:57.310,near the surface of the earth would be attracted to the earth with the force it's detecting.,0.4215
00:05:57.950,00:06:03.819,"Now since scales tend to be used on the surface of the earth, by people, on which the only force acting is gravity,",0.0
00:06:04.040,00:06:11.469,"they tend to not be very far off. But they can be easily tricked, and they further lead to the confusion between mass and weight.",-0.1531
00:06:12.950,00:06:20.289,Notice that weight is mutual. You are pulled down by earth with the same force that you pull up on earth.,0.0
00:06:20.840,00:06:23.259,"According to a scale, I weigh",0.0
00:06:23.990,00:06:25.990,180 pounds on earth..,0.0
00:06:30.760,00:06:35.430,And the earth weighs 180 pounds on me.,0.0
00:06:36.700,00:06:40.890,"But because the Earth's mass is so much greater than my own, and",0.5672
00:06:41.560,00:06:46.530,"because the more massive something is, the more it resists being moved, our",0.0
00:06:46.810,00:06:50.730,equal and opposite weight forces accelerate me a lot more than the earth.,0.0
00:06:51.160,00:06:58.589,"If you drop a pencil from a height of 6 feet, the pencil doesn't just fall to the earth. More precisely,",-0.2732
00:06:58.870,00:07:00.870,they both come together.,0.0
00:07:01.270,00:07:03.719,They're attracted to each other by equal forces,0.4215
00:07:03.720,00:07:06.029,but the same force moves the pencil a,0.0
00:07:06.250,00:07:11.369,"lot more than the earth. When you let go of the pencil, the earth is literally pulled up",0.0
00:07:11.440,00:07:16.890,"to the pencil by the pencil's own gravity, a distance equal to about 9 trillionths",0.0
00:07:17.460,00:07:19.640,the width of a proton. That,0.0
00:07:20.020,00:07:24.960,"same force moves the pencil the remaining distance, which is still pretty much six feet.",0.4939
00:07:26.580,00:07:32.220,"At the height of the International Space Station's orbit, you and earth are attracted about",0.4215
00:07:33.070,00:07:39.150,"10% less than when you're on the surface; about eight point eight times your mass, but not zero.",0.0
00:07:39.820,00:07:46.679,"For this reason, weightless astronauts in zero gravity are neither weightless, nor in zero gravity.",0.0
00:07:47.470,00:07:51.720,"Their weight force fails to bring them and earth together, because they move horizontally",-0.4215
00:07:51.970,00:07:57.690,so quickly that they fall just as fast as Earth's surface curves away from them.,0.0
00:07:58.300,00:08:02.759,"And even though they're experiencing 90 percent of the gravity you and I are feeling right now,",0.128
00:08:03.190,00:08:04.750,(That's why they don't just fly away),0.0
00:08:04.750,00:08:11.880,"There are no forces, called g-forces, to resist their weight, since everything around them is falling too.",-0.4215
00:08:12.310,00:08:16.170,"It's resistance to your weight force, stress,",-0.4215
00:08:17.080,00:08:23.189,"deformation, that is needed for you to feel weight. What astronauts in orbit actually lack is",-0.3182
00:08:24.130,00:08:26.130,apparent weight.,0.0
00:08:26.350,00:08:29.460,"Likewise, a helium balloon has weight.",0.0
00:08:29.460,00:08:35.299,"I mean, it's made out of matter it clearly has mass, so it's attracted to the earth.",0.7076
00:08:36.029,00:08:38.119,Let's try to measure its weight force.,0.0
00:08:43.979,00:08:46.759,"Okay, it has negative apparent weight.",-0.4215
00:08:46.890,00:08:52.580,That's because its attraction to the earth is weaker than the buoyant forces from the air around it that push it up.,0.25
00:08:52.860,00:08:54.500,"Now, while it moves up,",0.0
00:08:54.500,00:09:01.700,"It pushes air molecules down, but they transfer that force widely. Not just directly down onto the scale.",0.0
00:09:02.279,00:09:07.369,"Buoyant forces are caused by the fact that whenever you are immersed in a fluid like water or air,",0.5267
00:09:08.190,00:09:10.760,molecules lower down are at greater pressure.,-0.2263
00:09:10.980,00:09:13.310,They're being pressed by the weight of all the molecules,0.0
00:09:13.440,00:09:18.469,"above them and are closer to earth, so they're pulled to it with a stronger force. Now having greater pressure",0.4404
00:09:18.570,00:09:21.709,means they pack a bigger punch when they collide with things.,-0.0772
00:09:22.260,00:09:23.459,"So,",0.0
00:09:23.459,00:09:25.549,"horizontally, those collisions cancel out,",-0.4767
00:09:25.620,00:09:32.239,"but vertically, the stronger collisions from below win out, providing lift, a buoyant force.",0.8519
00:09:32.550,00:09:38.479,This even happens on your own body. Across its surface area air lifts you with the force of about one,0.0
00:09:38.610,00:09:45.589,"Newton, which is equal to the weight force of an apple. So if you weighed yourself in a vacuum you would weigh about",0.0
00:09:45.839,00:09:47.839,this much more.,0.0
00:09:48.270,00:09:54.679,But that's not all Earth's spin causes it to bulge at the equator so the closer you are to it,0.0
00:09:54.680,00:10:01.760,The further you are from Earth's center of mass and the less your actual gravitational weight will be down is,0.0
00:10:02.100,00:10:04.190,"Always changing, I mean",0.0
00:10:04.290,00:10:11.029,where is Earth's center of mass? It would always be the same as Earth's geometric middle if Earth's,0.0
00:10:11.250,00:10:18.380,"composition was uniform, but earth contains pockets of massive rock at different depths water mountains",0.0
00:10:18.380,00:10:23.779,It's got moving changing insides and air and seasonal ice and though they're far away,0.0
00:10:24.240,00:10:30.799,Gravity extends forever from everything so the moon the Sun the planets all of them pull on you,0.128
00:10:31.709,00:10:32.820,"negligibly,",0.0
00:10:32.820,00:10:39.289,But truly. You weigh about a millionth of your weight less when the moon is directly above you,0.5927
00:10:39.660,00:10:46.740,This chunky shifting balance of material on earth and ever where else in the universe means that down is,0.0
00:10:47.200,00:10:48.250,always,0.0
00:10:48.250,00:10:50.849,changing on top of that Earth's spin,0.2023
00:10:51.100,00:10:56.820,Skews what you consider the direction of down away from its center of mass because the push you get from Earth's spin,0.0
00:10:57.040,00:11:01.440,Seems to slightly lift you reducing your apparent weight and bending down,0.0
00:11:01.930,00:11:03.310,towards the equator,0.0
00:11:03.310,00:11:10.500,The net result is an apparent weight reduction at the equator of about half of a percent if a scale guesses your mass must be,0.0
00:11:10.930,00:11:14.039,200 pounds at the poles it'll guess that you're,0.0
00:11:14.769,00:11:18.239,199 at the equator. The 9.8,0.0
00:11:18.310,00:11:24.690,Multiplier used so often in physics is calculated based on how these factors affect someone at 45 degrees latitude,0.0
00:11:25.209,00:11:30.419,all of these influences on the direction of down result in a total vertical deflection.,0.0
00:11:30.820,00:11:34.769,That's only ever at most a few arc seconds anywhere on earth,0.0
00:11:35.050,00:11:41.820,"That's not enough to be felt, but changes in direction and strength can be used to study the shape of the seafloor",0.6486
00:11:42.430,00:11:47.370,Determine what's under you or even help you discover ancient buried rooms?,0.4019
00:11:48.399,00:11:53.969,Point is all of our downs aren't a bunch of radially symmetric lines,0.0
00:11:54.579,00:11:57.029,Down is an uncombed mess.,-0.3612
00:11:57.550,00:12:03.240,Now since solids don't flow they can have shapes that don't pay much mind to this but water can,0.0382
00:12:03.640,00:12:11.249,Flow so ignoring influences like wind and tides the surface of oceans and lakes and puddles is always perpendicular,-0.0591
00:12:11.380,00:12:17.070,"To down if water could pass through land, or if earth were submerged in water",0.0
00:12:17.860,00:12:21.419,Gravity would be the same everywhere along its bumpy surface,0.0
00:12:21.790,00:12:26.250,Such a surface is called a geoid and can be drawn at any altitude,0.0
00:12:26.709,00:12:32.459,If you wanted to build a table that completely enclosed the earth it would have to have rolling undulation,0.0
00:12:32.459,00:12:35.339,Z' nearly 100 meters at some points in order to be,0.0
00:12:35.890,00:12:39.629,Level so that a ball placed anywhere on it wouldn't roll,0.0
00:12:40.240,00:12:43.620,Here is Earth's G. I exaggerated a thousand times,-0.1027
00:12:44.110,00:12:48.180,You'd weigh about a hundredth of a percent less a few grams here?,0.0
00:12:48.180,00:12:53.909,Then you would say here where gravity is a bit stronger point is the strength and direction,0.7003
00:12:54.259,00:12:58.728,Down is variable by location and changes over time,0.0
00:12:59.489,00:13:04.279,So down is a fluctuating vector easy enough except?,0.4404
00:13:04.739,00:13:08.539,Why should matter attract matter in the first place?,0.4019
00:13:09.540,00:13:13.759,"Isaac Newton was able to describe attraction, but not explain it",0.25
00:13:14.369,00:13:19.369,humanity got closer however when Albert Einstein introduced his general theory of relativity,0.0
00:13:20.639,00:13:23.988,Einstein thought a lot about the fact that everything falls to the ground,0.0
00:13:24.329,00:13:26.508,At the same rate no matter,-0.0191
00:13:26.509,00:13:33.108,How massive something is when dropped it will accelerate towards the earth down gaining about 9.8,0.4215
00:13:33.109,00:13:37.249,Meters per second for every second that it falls. That means that a hammer,0.0
00:13:37.589,00:13:44.628,"That's quite massive, and a not so massive feather when dropped from the same height will hit the ground at the same time",0.0
00:13:47.819,00:13:49.819,"Okay, what just happened...",0.2263
00:13:50.279,00:13:51.989,"was an ""air""ror.",0.0
00:13:51.989,00:13:53.039,awkward laugh,0.4588
00:13:53.039,00:13:56.389,In order to fall through air a thing has to push air out of the way,0.0
00:13:56.549,00:14:01.759,But if it has a large surface area and a low weight force it will have a lot of air to move,-0.3919
00:14:01.889,00:14:07.279,"But won't be able to move that air very quickly. In a vacuum, things do fall at the same rate regardless",0.0
00:14:07.460,00:14:12.940,Of mass. This was famously demonstrated by Apollo 15 commander David Scott on the moon,0.0
00:14:14.040,00:14:18.660,"And I'll, uh, drop the two of them here and hopefully, they'll hit the ground at the same time.",0.1531
00:14:20.280,00:14:21.260,How 'bout that?,0.0
00:14:21.260,00:14:26.340,That's weird right? I mean if a more massive object is pulled with a greater force,0.2023
00:14:27.149,00:14:30.589,Shouldn't it fall faster? Well Newton's explanation was simple:,0.2732
00:14:31.410,00:14:34.160,Larger masses are attracted with greater forces,0.6486
00:14:34.589,00:14:39.438,But will also require more force to be accelerated the same as a less massive thing,0.0
00:14:39.899,00:14:46.008,"Something a hundred times more massive might require a hundred times the force, but it will be pulled by gravity",0.0
00:14:46.769,00:14:51.769,100 times more so everything falls to earth at the same rate,0.0
00:14:52.499,00:14:54.499,What a fun coincidence right?,0.5106
00:14:56.970,00:14:58.739,Maybe not,0.0
00:14:58.739,00:15:02.749,Einstein realized that there's another way for things to appear to fall together,0.0
00:15:03.889,00:15:05.399,of their masses,0.0
00:15:05.399,00:15:12.888,Imagine a feather and a hammer floating in space in a room if the room is suddenly accelerated up at 9.8,0.0
00:15:13.319,00:15:18.079,M/s^2 the feather and the hammer will hit the floor at the same time,0.0
00:15:18.720,00:15:24.319,furthermore whether it's the room coming up to meet them or gravity being suddenly switched on,0.0
00:15:24.660,00:15:27.919,Neither object will feel any force pushing them,0.0
00:15:28.079,00:15:33.318,There's no way to tell which of these happen. This is Einstein's famous,-0.296
00:15:34.019,00:15:35.399,equivalence principle,0.0
00:15:35.399,00:15:39.618,He once admitted that his greatest thought ever was that of a man,0.6808
00:15:40.439,00:15:42.439,falling off of a roof,-0.1531
00:15:42.629,00:15:48.558,While falling the man would not feel any forces on him even though. He's speeding up,-0.1531
00:15:49.529,00:15:50.910,freefall is,0.0
00:15:50.910,00:15:57.290,Indistinguishable from floating alone in space from having no forces on you from not being moved,-0.4939
00:15:57.689,00:16:03.558,What if gravity isn't a force at all what if things fall not because they're being pushed or pulled,0.0
00:16:03.809,00:16:07.789,But because they're not being pushed or pull,0.0
00:16:08.100,00:16:12.619,To see how this could be we need to talk about straight lines,0.2263
00:16:13.649,00:16:17.388,What I have here is a retractable ID badge holder,0.0
00:16:17.489,00:16:20.209,This is a great way to test for straight paths,0.7184
00:16:20.699,00:16:24.168,Because the string is always kept taut the card,0.0
00:16:24.169,00:16:26.749,I have behind has two lines drawn on it,0.0
00:16:26.749,00:16:32.058,And if while I pull the string out it always stays between those two lines,0.0
00:16:32.059,00:16:34.459,I will know that I never turned,0.0
00:16:34.860,00:16:40.699,While I pulled it because any turn will translate into a different angle between the lines on the card and the string,0.0
00:16:40.949,00:16:47.178,"Now if I put two of these on a flat table and pull them out, always ensuring that they go straight ahead",0.4588
00:16:47.399,00:16:55.128,"They will never meet. They will be forever parallel, but now let's put them on a sphere a curved surface",0.0
00:16:55.799,00:17:02.119,"Again, I pull both strings forward making sure that they always are pulled out straight. No turning",0.25
00:17:03.059,00:17:05.059,Wait they came together,0.0
00:17:06.130,00:17:08.309,"Well, they didn't turn look",0.2732
00:17:08.710,00:17:15.840,"Maybe there's some kind of weird force that pulled my hands together and just like gravity. I didn't feel it, but it happened",0.0653
00:17:16.390,00:17:17.560,No,-0.296
00:17:17.560,00:17:22.440,What happened was not the result of a force it was just a natural result of?,0.3612
00:17:23.140,00:17:29.970,Curvature you might be thinking wait a second are those really straight lines. I mean they don't look that straight to me,0.1348
00:17:30.640,00:17:37.500,"Also, what if they've just moved along latitude lines then they've never come together and those look pretty darn straight",0.6249
00:17:38.440,00:17:45.509,But they're not a straight line never turns and although latitude lines look straight at first glance,0.0903
00:17:46.270,00:17:48.270,following one requires,0.0
00:17:48.280,00:17:54.149,Turning to find straight line paths on surfaces whether they're flat like this or curved,0.5267
00:17:54.330,00:17:58.319,I love the ribbon test. Now you can use an actual ribbon,0.6369
00:17:58.320,00:18:04.169,But I have found that a strip of paper works. Even better. Let's take a look at this path right here,0.5927
00:18:04.480,00:18:10.319,"It's straight at first, but then it curves now if two people are traveling along this curve",0.1154
00:18:10.320,00:18:16.080,And they want to stay together the person on the inside will have to cover a shorter distance than the person on the outside,0.0772
00:18:16.990,00:18:20.429,Since both sides of this strip of paper cannot change their lengths,0.0
00:18:20.430,00:18:25.409,They'll help us find a straight path if the strip of paper can lay flat,0.5574
00:18:25.600,00:18:28.889,We'll know that we have found a straight line and as you can see,0.2263
00:18:29.230,00:18:32.789,The strip can lay flat and follow the straight part of this path,0.2263
00:18:32.890,00:18:36.150,But when it comes to the curve in order to follow the path now,0.0
00:18:36.340,00:18:40.169,The strip well it has too much material on the inside and that material,0.2732
00:18:40.330,00:18:46.409,Bunches up and leaves the plane therefore we know that this part of the path is not straight,-0.1695
00:18:47.770,00:18:52.199,Let's use the ribbon test to find straight lines on the surface of a cone,0.2263
00:18:52.660,00:18:58.889,Well from the looks of it aligned directly from the base to the tip seems like it would be straight and sure enough,0.7783
00:18:58.930,00:19:04.199,"Yeah, the ribbon lays flat on that path, but what about a ring around the cone?",0.1531
00:19:05.080,00:19:11.460,Nope doesn't work shorter distances around nearer the tip of the cone mean that there's too much ribbon up at the top,0.2023
00:19:11.460,00:19:13.180,So doesn't lay flat,0.0
00:19:13.180,00:19:19.469,Let's see what else is there though besides this well if I start here and just allow the ribbon,0.5065
00:19:20.920,00:19:22.690,to lay flat,0.0
00:19:22.690,00:19:26.370,Huh I get a little curvy looking shape like this,0.3612
00:19:26.429,00:19:32.759,I say curvy looking because while to someone say at the base this path might seem to go up,0.0
00:19:33.190,00:19:39.780,Slow down change direction and then fall down faster and faster since a ribbon on such a path is flat,0.0
00:19:39.940,00:19:43.530,It's actually for inhabitants on the cones surface,0.0
00:19:44.110,00:19:48.059,Perfectly straight if we trace the ribbons path on to the cone,0.7269
00:19:48.059,00:19:55.139,We can see this clearly because a cone can be flattened a straight line on a curved surface is called a geodesic,0.6155
00:19:56.530,00:20:00.929,Here is a geodesic on a sphere the Equator is one,0.0
00:20:01.510,00:20:05.369,Here's another a line of latitude is not a geodesic,0.0
00:20:05.370,00:20:09.479,It's not a straight line to see why let's try to follow it with the ribbon you,-0.1695
00:20:10.090,00:20:13.140,Know what I have to keep kind of lifting it,0.0
00:20:13.330,00:20:17.429,"Yeah, see distances around the sphere becomes shorter as we go up",0.296
00:20:17.500,00:20:19.800,So there's too much material on the ribbon up here,0.0
00:20:19.800,00:20:24.629,and it leaves the surface this path contains turns and in order to turn a,0.0
00:20:24.760,00:20:27.749,Force has to act on you if no forces,-0.296
00:20:27.750,00:20:34.619,"Did this is the path you would take notice that the ribbon begins moving due east, but then falls",0.0
